    1 1612291809.468497972 192.168.2.254 → 192.168.1.254 TCP 74 41006 → 80 [SYN] Seq=0 Win=64240 Len=0 MSS=1460 SACK_PERM=1 TSval=2122102918 TSecr=0 WS=128
    2 1612291809.468556972 192.168.1.254 → 192.168.2.254 TCP 74 80 → 41006 [SYN, ACK] Seq=0 Ack=1 Win=65160 Len=0 MSS=1460 SACK_PERM=1 TSval=4280232357 TSecr=2122102918 WS=128
    3 1612291809.469423250 192.168.2.254 → 192.168.1.254 TCP 66 41006 → 80 [ACK] Seq=1 Ack=1 Win=64256 Len=0 TSval=2122102919 TSecr=4280232357
    4 1612291809.471038527 192.168.2.254 → 192.168.1.254 HTTP 540 GET /1.php HTTP/1.1 
    5 1612291809.471200157 192.168.1.254 → 192.168.2.254 TCP 66 80 → 41006 [ACK] Seq=1 Ack=475 Win=64768 Len=0 TSval=4280232360 TSecr=2122102921
    6 1612291809.474595472 192.168.1.254 → 192.168.2.254 TCP 1514 HTTP/1.1 200 OK  [TCP segment of a reassembled PDU]
    7 1612291809.474611527 192.168.1.254 → 192.168.2.254 TCP 1514 80 → 41006 [ACK] Seq=1449 Ack=475 Win=64768 Len=1448 TSval=4280232363 TSecr=2122102921 [TCP segment of a reassembled PDU]
    8 1612291809.474615787 192.168.1.254 → 192.168.2.254 TCP 1514 80 → 41006 [ACK] Seq=2897 Ack=475 Win=64768 Len=1448 TSval=4280232363 TSecr=2122102921 [TCP segment of a reassembled PDU]
    9 1612291809.474619657 192.168.1.254 → 192.168.2.254 TCP 1514 80 → 41006 [ACK] Seq=4345 Ack=475 Win=64768 Len=1448 TSval=4280232363 TSecr=2122102921 [TCP segment of a reassembled PDU]
   10 1612291809.474623546 192.168.1.254 → 192.168.2.254 HTTP 1027 HTTP/1.1 200 OK  (text/html)
   11 1612291809.476258509 192.168.2.254 → 192.168.1.254 TCP 66 41006 → 80 [ACK] Seq=475 Ack=1449 Win=64128 Len=0 TSval=2122102926 TSecr=4280232363
   12 1612291809.476299490 192.168.2.254 → 192.168.1.254 TCP 66 41006 → 80 [ACK] Seq=475 Ack=2897 Win=64128 Len=0 TSval=2122102926 TSecr=4280232363
   13 1612291809.476299583 192.168.2.254 → 192.168.1.254 TCP 66 41006 → 80 [ACK] Seq=475 Ack=4345 Win=64128 Len=0 TSval=2122102926 TSecr=4280232363
   14 1612291809.476601175 192.168.2.254 → 192.168.1.254 TCP 66 41006 → 80 [ACK] Seq=475 Ack=5793 Win=64128 Len=0 TSval=2122102926 TSecr=4280232363
   15 1612291809.476633935 192.168.2.254 → 192.168.1.254 TCP 66 41006 → 80 [ACK] Seq=475 Ack=6754 Win=64128 Len=0 TSval=2122102926 TSecr=4280232363
   16 1612291812.318966933 192.168.2.254 → 192.168.1.254 HTTP 540 GET /1.php HTTP/1.1 
   17 1612291812.319026748 192.168.1.254 → 192.168.2.254 TCP 66 80 → 41006 [ACK] Seq=6754 Ack=949 Win=64384 Len=0 TSval=4280235207 TSecr=2122105768
   18 1612291812.321814007 192.168.1.254 → 192.168.2.254 TCP 1514 HTTP/1.1 200 OK  [TCP segment of a reassembled PDU]
   19 1612291812.321829914 192.168.1.254 → 192.168.2.254 TCP 1514 80 → 41006 [ACK] Seq=8202 Ack=949 Win=64384 Len=1448 TSval=4280235210 TSecr=2122105768 [TCP segment of a reassembled PDU]
   20 1612291812.321834303 192.168.1.254 → 192.168.2.254 TCP 1514 80 → 41006 [ACK] Seq=9650 Ack=949 Win=64384 Len=1448 TSval=4280235210 TSecr=2122105768 [TCP segment of a reassembled PDU]
   21 1612291812.321838526 192.168.1.254 → 192.168.2.254 TCP 1514 80 → 41006 [ACK] Seq=11098 Ack=949 Win=64384 Len=1448 TSval=4280235210 TSecr=2122105768 [TCP segment of a reassembled PDU]
   22 1612291812.321842285 192.168.1.254 → 192.168.2.254 HTTP 1030 HTTP/1.1 200 OK  (text/html)
   23 1612291812.323003711 192.168.2.254 → 192.168.1.254 TCP 66 41006 → 80 [ACK] Seq=949 Ack=8202 Win=64128 Len=0 TSval=2122105773 TSecr=4280235210
   24 1612291812.323049377 192.168.2.254 → 192.168.1.254 TCP 66 41006 → 80 [ACK] Seq=949 Ack=9650 Win=64128 Len=0 TSval=2122105773 TSecr=4280235210
   25 1612291812.323245322 192.168.2.254 → 192.168.1.254 TCP 66 41006 → 80 [ACK] Seq=949 Ack=11098 Win=64128 Len=0 TSval=2122105773 TSecr=4280235210
   26 1612291812.323271563 192.168.2.254 → 192.168.1.254 TCP 66 41006 → 80 [ACK] Seq=949 Ack=12546 Win=64128 Len=0 TSval=2122105773 TSecr=4280235210
   27 1612291812.323289618 192.168.2.254 → 192.168.1.254 TCP 66 41006 → 80 [ACK] Seq=949 Ack=13510 Win=64128 Len=0 TSval=2122105773 TSecr=4280235210
   28 1612291816.715446116 192.168.2.254 → 192.168.1.254 HTTP 540 GET /1.php HTTP/1.1 
   29 1612291816.715497504 192.168.1.254 → 192.168.2.254 TCP 66 80 → 41006 [ACK] Seq=13510 Ack=1423 Win=64128 Len=0 TSval=4280239604 TSecr=2122110165
   30 1612291816.718217542 192.168.1.254 → 192.168.2.254 TCP 1514 HTTP/1.1 200 OK  [TCP segment of a reassembled PDU]
   31 1612291816.718233208 192.168.1.254 → 192.168.2.254 TCP 1514 80 → 41006 [ACK] Seq=14958 Ack=1423 Win=64128 Len=1448 TSval=4280239607 TSecr=2122110165 [TCP segment of a reassembled PDU]
   32 1612291816.718237282 192.168.1.254 → 192.168.2.254 TCP 1514 80 → 41006 [ACK] Seq=16406 Ack=1423 Win=64128 Len=1448 TSval=4280239607 TSecr=2122110165 [TCP segment of a reassembled PDU]
   33 1612291816.718241412 192.168.1.254 → 192.168.2.254 TCP 1514 80 → 41006 [ACK] Seq=17854 Ack=1423 Win=64128 Len=1448 TSval=4280239607 TSecr=2122110165 [TCP segment of a reassembled PDU]
   34 1612291816.718245430 192.168.1.254 → 192.168.2.254 HTTP 1039 HTTP/1.1 200 OK  (text/html)
   35 1612291816.720042467 192.168.2.254 → 192.168.1.254 TCP 66 41006 → 80 [ACK] Seq=1423 Ack=14958 Win=64128 Len=0 TSval=2122110169 TSecr=4280239607
   36 1612291816.720082764 192.168.2.254 → 192.168.1.254 TCP 66 41006 → 80 [ACK] Seq=1423 Ack=16406 Win=64128 Len=0 TSval=2122110170 TSecr=4280239607
   37 1612291816.720082856 192.168.2.254 → 192.168.1.254 TCP 66 41006 → 80 [ACK] Seq=1423 Ack=17854 Win=64128 Len=0 TSval=2122110170 TSecr=4280239607
   38 1612291816.720103930 192.168.2.254 → 192.168.1.254 TCP 66 41006 → 80 [ACK] Seq=1423 Ack=19302 Win=64128 Len=0 TSval=2122110170 TSecr=4280239607
   39 1612291816.720124430 192.168.2.254 → 192.168.1.254 TCP 66 41006 → 80 [ACK] Seq=1423 Ack=20275 Win=64128 Len=0 TSval=2122110170 TSecr=4280239607
   40 1612291821.723458964 192.168.1.254 → 192.168.2.254 TCP 66 80 → 41006 [FIN, ACK] Seq=20275 Ack=1423 Win=64128 Len=0 TSval=4280244612 TSecr=2122110170
   41 1612291821.768815742 192.168.2.254 → 192.168.1.254 TCP 66 41006 → 80 [ACK] Seq=1423 Ack=20276 Win=64128 Len=0 TSval=2122115219 TSecr=4280244612
   42 1612291823.351466593 192.168.2.254 → 192.168.1.254 TCP 66 41006 → 80 [FIN, ACK] Seq=1423 Ack=20276 Win=64128 Len=0 TSval=2122116801 TSecr=4280244612
   43 1612291823.351513260 192.168.1.254 → 192.168.2.254 TCP 66 80 → 41006 [ACK] Seq=20276 Ack=1424 Win=64128 Len=0 TSval=4280246240 TSecr=2122116801
   44 1612291823.352028945 192.168.2.254 → 192.168.1.254 TCP 74 41008 → 80 [SYN] Seq=0 Win=64240 Len=0 MSS=1460 SACK_PERM=1 TSval=2122116802 TSecr=0 WS=128
   45 1612291823.352076538 192.168.1.254 → 192.168.2.254 TCP 74 80 → 41008 [SYN, ACK] Seq=0 Ack=1 Win=65160 Len=0 MSS=1460 SACK_PERM=1 TSval=4280246241 TSecr=2122116802 WS=128
   46 1612291823.352756167 192.168.2.254 → 192.168.1.254 TCP 66 41008 → 80 [ACK] Seq=1 Ack=1 Win=64256 Len=0 TSval=2122116802 TSecr=4280246241
   47 1612291823.354739519 192.168.2.254 → 192.168.1.254 HTTP 540 GET /1.php HTTP/1.1 
   48 1612291823.354827723 192.168.1.254 → 192.168.2.254 TCP 66 80 → 41008 [ACK] Seq=1 Ack=475 Win=64768 Len=0 TSval=4280246243 TSecr=2122116804
   49 1612291823.357749038 192.168.1.254 → 192.168.2.254 TCP 1514 HTTP/1.1 200 OK  [TCP segment of a reassembled PDU]
   50 1612291823.357765408 192.168.1.254 → 192.168.2.254 TCP 1514 80 → 41008 [ACK] Seq=1449 Ack=475 Win=64768 Len=1448 TSval=4280246246 TSecr=2122116804 [TCP segment of a reassembled PDU]
   51 1612291823.357770704 192.168.1.254 → 192.168.2.254 TCP 1514 80 → 41008 [ACK] Seq=2897 Ack=475 Win=64768 Len=1448 TSval=4280246246 TSecr=2122116804 [TCP segment of a reassembled PDU]
   52 1612291823.357774667 192.168.1.254 → 192.168.2.254 TCP 1514 80 → 41008 [ACK] Seq=4345 Ack=475 Win=64768 Len=1448 TSval=4280246246 TSecr=2122116804 [TCP segment of a reassembled PDU]
   53 1612291823.357778612 192.168.1.254 → 192.168.2.254 HTTP 1026 HTTP/1.1 200 OK  (text/html)
   54 1612291823.359158575 192.168.2.254 → 192.168.1.254 TCP 66 41008 → 80 [ACK] Seq=475 Ack=1449 Win=64128 Len=0 TSval=2122116809 TSecr=4280246246
   55 1612291823.359198760 192.168.2.254 → 192.168.1.254 TCP 66 41008 → 80 [ACK] Seq=475 Ack=2897 Win=64128 Len=0 TSval=2122116809 TSecr=4280246246
   56 1612291823.359361204 192.168.2.254 → 192.168.1.254 TCP 66 41008 → 80 [ACK] Seq=475 Ack=4345 Win=64128 Len=0 TSval=2122116809 TSecr=4280246246
   57 1612291823.359389686 192.168.2.254 → 192.168.1.254 TCP 66 41008 → 80 [ACK] Seq=475 Ack=5793 Win=64128 Len=0 TSval=2122116809 TSecr=4280246246
   58 1612291823.359411001 192.168.2.254 → 192.168.1.254 TCP 66 41008 → 80 [ACK] Seq=475 Ack=6753 Win=63232 Len=0 TSval=2122116809 TSecr=4280246246
   59 1612291826.842191702 192.168.2.254 → 192.168.1.254 HTTP 540 GET /1.php HTTP/1.1 
   60 1612291826.842244924 192.168.1.254 → 192.168.2.254 TCP 66 80 → 41008 [ACK] Seq=6753 Ack=949 Win=64384 Len=0 TSval=4280249731 TSecr=2122120292
   61 1612291826.844968591 192.168.1.254 → 192.168.2.254 TCP 1514 HTTP/1.1 200 OK  [TCP segment of a reassembled PDU]
   62 1612291826.844984110 192.168.1.254 → 192.168.2.254 TCP 1514 80 → 41008 [ACK] Seq=8201 Ack=949 Win=64384 Len=1448 TSval=4280249733 TSecr=2122120292 [TCP segment of a reassembled PDU]
   63 1612291826.844988461 192.168.1.254 → 192.168.2.254 TCP 1514 80 → 41008 [ACK] Seq=9649 Ack=949 Win=64384 Len=1448 TSval=4280249733 TSecr=2122120292 [TCP segment of a reassembled PDU]
   64 1612291826.844992998 192.168.1.254 → 192.168.2.254 TCP 1514 80 → 41008 [ACK] Seq=11097 Ack=949 Win=64384 Len=1448 TSval=4280249733 TSecr=2122120292 [TCP segment of a reassembled PDU]
   65 1612291826.844996943 192.168.1.254 → 192.168.2.254 HTTP 1073 HTTP/1.1 200 OK  (text/html)
   66 1612291826.845822073 192.168.2.254 → 192.168.1.254 TCP 66 41008 → 80 [ACK] Seq=949 Ack=8201 Win=64128 Len=0 TSval=2122120296 TSecr=4280249733
   67 1612291826.845910961 192.168.2.254 → 192.168.1.254 TCP 66 41008 → 80 [ACK] Seq=949 Ack=9649 Win=64128 Len=0 TSval=2122120296 TSecr=4280249733
   68 1612291826.845946591 192.168.2.254 → 192.168.1.254 TCP 66 41008 → 80 [ACK] Seq=949 Ack=11097 Win=62720 Len=0 TSval=2122120296 TSecr=4280249733
   69 1612291826.846014998 192.168.2.254 → 192.168.1.254 TCP 66 41008 → 80 [ACK] Seq=949 Ack=12545 Win=61312 Len=0 TSval=2122120296 TSecr=4280249733
   70 1612291826.846071591 192.168.2.254 → 192.168.1.254 TCP 66 41008 → 80 [ACK] Seq=949 Ack=13552 Win=60416 Len=0 TSval=2122120296 TSecr=4280249733
   71 1612291829.529823312 192.168.2.254 → 192.168.1.254 HTTP 540 GET /1.php HTTP/1.1 
   72 1612291829.529870163 192.168.1.254 → 192.168.2.254 TCP 66 80 → 41008 [ACK] Seq=13552 Ack=1423 Win=64128 Len=0 TSval=4280252418 TSecr=2122122979
   73 1612291829.532601923 192.168.1.254 → 192.168.2.254 TCP 1514 HTTP/1.1 200 OK  [TCP segment of a reassembled PDU]
   74 1612291829.532617645 192.168.1.254 → 192.168.2.254 TCP 1514 80 → 41008 [ACK] Seq=15000 Ack=1423 Win=64128 Len=1448 TSval=4280252421 TSecr=2122122979 [TCP segment of a reassembled PDU]
   75 1612291829.532621830 192.168.1.254 → 192.168.2.254 TCP 1514 80 → 41008 [ACK] Seq=16448 Ack=1423 Win=64128 Len=1448 TSval=4280252421 TSecr=2122122979 [TCP segment of a reassembled PDU]
   76 1612291829.532625941 192.168.1.254 → 192.168.2.254 TCP 1514 80 → 41008 [ACK] Seq=17896 Ack=1423 Win=64128 Len=1448 TSval=4280252421 TSecr=2122122979 [TCP segment of a reassembled PDU]
   77 1612291829.532630071 192.168.1.254 → 192.168.2.254 HTTP 1070 HTTP/1.1 200 OK  (text/html)
   78 1612291829.533925052 192.168.2.254 → 192.168.1.254 TCP 66 41008 → 80 [ACK] Seq=1423 Ack=15000 Win=64128 Len=0 TSval=2122122983 TSecr=4280252421
   79 1612291829.533968626 192.168.2.254 → 192.168.1.254 TCP 66 41008 → 80 [ACK] Seq=1423 Ack=16448 Win=64128 Len=0 TSval=2122122984 TSecr=4280252421
   80 1612291829.534230589 192.168.2.254 → 192.168.1.254 TCP 66 41008 → 80 [ACK] Seq=1423 Ack=17896 Win=64128 Len=0 TSval=2122122984 TSecr=4280252421
   81 1612291829.534261423 192.168.2.254 → 192.168.1.254 TCP 66 41008 → 80 [ACK] Seq=1423 Ack=19344 Win=64128 Len=0 TSval=2122122984 TSecr=4280252421
   82 1612291829.534280163 192.168.2.254 → 192.168.1.254 TCP 66 41008 → 80 [ACK] Seq=1423 Ack=20348 Win=64128 Len=0 TSval=2122122984 TSecr=4280252421
   83 1612291832.061434755 192.168.2.254 → 192.168.1.254 HTTP 540 GET /1.php HTTP/1.1 
   84 1612291832.061491662 192.168.1.254 → 192.168.2.254 TCP 66 80 → 41008 [ACK] Seq=20348 Ack=1897 Win=64128 Len=0 TSval=4280254950 TSecr=2122125511
   85 1612291832.064338773 192.168.1.254 → 192.168.2.254 TCP 1514 HTTP/1.1 200 OK  [TCP segment of a reassembled PDU]
   86 1612291832.064355199 192.168.1.254 → 192.168.2.254 TCP 1514 80 → 41008 [ACK] Seq=21796 Ack=1897 Win=64128 Len=1448 TSval=4280254953 TSecr=2122125511 [TCP segment of a reassembled PDU]
   87 1612291832.064359458 192.168.1.254 → 192.168.2.254 TCP 1514 80 → 41008 [ACK] Seq=23244 Ack=1897 Win=64128 Len=1448 TSval=4280254953 TSecr=2122125511 [TCP segment of a reassembled PDU]
   88 1612291832.064363421 192.168.1.254 → 192.168.2.254 TCP 1514 80 → 41008 [ACK] Seq=24692 Ack=1897 Win=64128 Len=1448 TSval=4280254953 TSecr=2122125511 [TCP segment of a reassembled PDU]
   89 1612291832.064367106 192.168.1.254 → 192.168.2.254 HTTP 1048 HTTP/1.1 200 OK  (text/html)
   90 1612291832.065625106 192.168.2.254 → 192.168.1.254 TCP 66 41008 → 80 [ACK] Seq=1897 Ack=21796 Win=64128 Len=0 TSval=2122125515 TSecr=4280254953
   91 1612291832.065666847 192.168.2.254 → 192.168.1.254 TCP 66 41008 → 80 [ACK] Seq=1897 Ack=23244 Win=64128 Len=0 TSval=2122125515 TSecr=4280254953
   92 1612291832.065755218 192.168.2.254 → 192.168.1.254 TCP 66 41008 → 80 [ACK] Seq=1897 Ack=24692 Win=64128 Len=0 TSval=2122125515 TSecr=4280254953
   93 1612291832.065782162 192.168.2.254 → 192.168.1.254 TCP 66 41008 → 80 [ACK] Seq=1897 Ack=26140 Win=64128 Len=0 TSval=2122125516 TSecr=4280254953
   94 1612291832.065800958 192.168.2.254 → 192.168.1.254 TCP 66 41008 → 80 [ACK] Seq=1897 Ack=27122 Win=64128 Len=0 TSval=2122125516 TSecr=4280254953
   95 1612291834.446258216 192.168.2.254 → 192.168.1.254 HTTP 540 GET /1.php HTTP/1.1 
   96 1612291834.448997864 192.168.1.254 → 192.168.2.254 TCP 1514 HTTP/1.1 200 OK  [TCP segment of a reassembled PDU]
   97 1612291834.449013735 192.168.1.254 → 192.168.2.254 TCP 1514 80 → 41008 [ACK] Seq=28570 Ack=2371 Win=64128 Len=1448 TSval=4280257337 TSecr=2122127896 [TCP segment of a reassembled PDU]
   98 1612291834.449018068 192.168.1.254 → 192.168.2.254 TCP 1514 80 → 41008 [ACK] Seq=30018 Ack=2371 Win=64128 Len=1448 TSval=4280257337 TSecr=2122127896 [TCP segment of a reassembled PDU]
   99 1612291834.449022031 192.168.1.254 → 192.168.2.254 TCP 1514 80 → 41008 [ACK] Seq=31466 Ack=2371 Win=64128 Len=1448 TSval=4280257337 TSecr=2122127896 [TCP segment of a reassembled PDU]
  100 1612291834.449025827 192.168.1.254 → 192.168.2.254 HTTP 1079 HTTP/1.1 200 OK  (text/html)
