    1 1612290792.781450692 192.168.2.254 → 192.168.1.254 TCP 66 40830 → 80 [FIN, ACK] Seq=1 Ack=1 Win=501 Len=0 TSval=2121094410 TSecr=4279203420
    2 1612290792.782247777 192.168.1.254 → 192.168.2.254 TCP 66 80 → 40830 [ACK] Seq=1 Ack=2 Win=506 Len=0 TSval=4279223852 TSecr=2121094410
    3 1612290792.783137467 192.168.2.254 → 192.168.1.254 TCP 74 40852 → 80 [SYN] Seq=0 Win=64240 Len=0 MSS=1460 SACK_PERM=1 TSval=2121094412 TSecr=0 WS=128
    4 1612290792.783707781 192.168.1.254 → 192.168.2.254 TCP 74 80 → 40852 [SYN, ACK] Seq=0 Ack=1 Win=65160 Len=0 MSS=1460 SACK_PERM=1 TSval=4279223853 TSecr=2121094412 WS=128
    5 1612290792.783969760 192.168.2.254 → 192.168.1.254 TCP 66 40852 → 80 [ACK] Seq=1 Ack=1 Win=64256 Len=0 TSval=2121094413 TSecr=4279223853
    6 1612290792.786642736 192.168.2.254 → 192.168.1.254 HTTP 540 GET /1.php HTTP/1.1 
    7 1612290792.787320393 192.168.1.254 → 192.168.2.254 TCP 66 80 → 40852 [ACK] Seq=1 Ack=475 Win=64768 Len=0 TSval=4279223857 TSecr=2121094416
    8 1612290792.790769933 192.168.1.254 → 192.168.2.254 TCP 1514 HTTP/1.1 200 OK  [TCP segment of a reassembled PDU]
    9 1612290792.791144673 192.168.2.254 → 192.168.1.254 TCP 66 40852 → 80 [ACK] Seq=475 Ack=1449 Win=64128 Len=0 TSval=2121094420 TSecr=4279223860
   10 1612290792.790841808 192.168.1.254 → 192.168.2.254 TCP 1514 80 → 40852 [ACK] Seq=1449 Ack=475 Win=64768 Len=1448 TSval=4279223860 TSecr=2121094416 [TCP segment of a reassembled PDU]
   11 1612290792.791262017 192.168.2.254 → 192.168.1.254 TCP 66 40852 → 80 [ACK] Seq=475 Ack=2897 Win=64128 Len=0 TSval=2121094420 TSecr=4279223860
   12 1612290792.790847693 192.168.1.254 → 192.168.2.254 TCP 1514 80 → 40852 [ACK] Seq=2897 Ack=475 Win=64768 Len=1448 TSval=4279223860 TSecr=2121094416 [TCP segment of a reassembled PDU]
   13 1612290792.791313788 192.168.2.254 → 192.168.1.254 TCP 66 40852 → 80 [ACK] Seq=475 Ack=4345 Win=64128 Len=0 TSval=2121094420 TSecr=4279223860
   14 1612290792.791364778 192.168.1.254 → 192.168.2.254 TCP 1514 80 → 40852 [ACK] Seq=4345 Ack=475 Win=64768 Len=1448 TSval=4279223860 TSecr=2121094416 [TCP segment of a reassembled PDU]
   15 1612290792.791604622 192.168.2.254 → 192.168.1.254 TCP 66 40852 → 80 [ACK] Seq=475 Ack=5793 Win=64128 Len=0 TSval=2121094421 TSecr=4279223860
   16 1612290792.791371236 192.168.1.254 → 192.168.2.254 HTTP 1027 HTTP/1.1 200 OK  (text/html)
   17 1612290792.791660039 192.168.2.254 → 192.168.1.254 TCP 66 40852 → 80 [ACK] Seq=475 Ack=6754 Win=64128 Len=0 TSval=2121094421 TSecr=4279223860
   18 1612290795.705682245 192.168.2.254 → 192.168.1.254 HTTP 540 GET /1.php HTTP/1.1 
   19 1612290795.706444018 192.168.1.254 → 192.168.2.254 TCP 66 80 → 40852 [ACK] Seq=6754 Ack=949 Win=64384 Len=0 TSval=4279226776 TSecr=2121097335
   20 1612290795.709559598 192.168.1.254 → 192.168.2.254 TCP 1514 HTTP/1.1 200 OK  [TCP segment of a reassembled PDU]
   21 1612290795.709798661 192.168.2.254 → 192.168.1.254 TCP 66 40852 → 80 [ACK] Seq=949 Ack=8202 Win=64128 Len=0 TSval=2121097339 TSecr=4279226779
   22 1612290795.709566473 192.168.1.254 → 192.168.2.254 TCP 1514 80 → 40852 [ACK] Seq=8202 Ack=949 Win=64384 Len=1448 TSval=4279226779 TSecr=2121097335 [TCP segment of a reassembled PDU]
   23 1612290795.709863349 192.168.2.254 → 192.168.1.254 TCP 66 40852 → 80 [ACK] Seq=949 Ack=9650 Win=64128 Len=0 TSval=2121097339 TSecr=4279226779
   24 1612290795.709571057 192.168.1.254 → 192.168.2.254 TCP 1514 80 → 40852 [ACK] Seq=9650 Ack=949 Win=64384 Len=1448 TSval=4279226779 TSecr=2121097335 [TCP segment of a reassembled PDU]
   25 1612290795.709921006 192.168.2.254 → 192.168.1.254 TCP 66 40852 → 80 [ACK] Seq=949 Ack=11098 Win=64128 Len=0 TSval=2121097339 TSecr=4279226779
   26 1612290795.709991474 192.168.1.254 → 192.168.2.254 TCP 1514 80 → 40852 [ACK] Seq=11098 Ack=949 Win=64384 Len=1448 TSval=4279226779 TSecr=2121097335 [TCP segment of a reassembled PDU]
   27 1612290795.710107621 192.168.2.254 → 192.168.1.254 TCP 66 40852 → 80 [ACK] Seq=949 Ack=12546 Win=64128 Len=0 TSval=2121097339 TSecr=4279226779
   28 1612290795.709996787 192.168.1.254 → 192.168.2.254 HTTP 1060 HTTP/1.1 200 OK  (text/html)
   29 1612290795.710158141 192.168.2.254 → 192.168.1.254 TCP 66 40852 → 80 [ACK] Seq=949 Ack=13540 Win=64128 Len=0 TSval=2121097339 TSecr=4279226779
   30 1612290797.874187050 192.168.2.254 → 192.168.1.254 HTTP 540 GET /1.php HTTP/1.1 
   31 1612290797.874792884 192.168.1.254 → 192.168.2.254 TCP 66 80 → 40852 [ACK] Seq=13540 Ack=1423 Win=64128 Len=0 TSval=4279228945 TSecr=2121099503
   32 1612290797.878215132 192.168.1.254 → 192.168.2.254 TCP 1514 HTTP/1.1 200 OK  [TCP segment of a reassembled PDU]
   33 1612290797.878435966 192.168.2.254 → 192.168.1.254 TCP 66 40852 → 80 [ACK] Seq=1423 Ack=14988 Win=64128 Len=0 TSval=2121099507 TSecr=4279228947
   34 1612290797.878223570 192.168.1.254 → 192.168.2.254 TCP 1514 80 → 40852 [ACK] Seq=14988 Ack=1423 Win=64128 Len=1448 TSval=4279228947 TSecr=2121099503 [TCP segment of a reassembled PDU]
   35 1612290797.878522216 192.168.2.254 → 192.168.1.254 TCP 66 40852 → 80 [ACK] Seq=1423 Ack=16436 Win=64128 Len=0 TSval=2121099508 TSecr=4279228947
   36 1612290797.878228257 192.168.1.254 → 192.168.2.254 TCP 1514 80 → 40852 [ACK] Seq=16436 Ack=1423 Win=64128 Len=1448 TSval=4279228947 TSecr=2121099503 [TCP segment of a reassembled PDU]
   37 1612290797.878584612 192.168.2.254 → 192.168.1.254 TCP 66 40852 → 80 [ACK] Seq=1423 Ack=17884 Win=64128 Len=0 TSval=2121099508 TSecr=4279228947
   38 1612290797.878621071 192.168.1.254 → 192.168.2.254 TCP 1514 80 → 40852 [ACK] Seq=17884 Ack=1423 Win=64128 Len=1448 TSval=4279228947 TSecr=2121099503 [TCP segment of a reassembled PDU]
   39 1612290797.878765915 192.168.2.254 → 192.168.1.254 TCP 66 40852 → 80 [ACK] Seq=1423 Ack=19332 Win=64128 Len=0 TSval=2121099508 TSecr=4279228947
   40 1612290797.878628258 192.168.1.254 → 192.168.2.254 HTTP 1039 HTTP/1.1 200 OK  (text/html)
   41 1612290797.878818415 192.168.2.254 → 192.168.1.254 TCP 66 40852 → 80 [ACK] Seq=1423 Ack=20305 Win=64128 Len=0 TSval=2121099508 TSecr=4279228947
   42 1612290802.882894093 192.168.1.254 → 192.168.2.254 TCP 66 80 → 40852 [FIN, ACK] Seq=20305 Ack=1423 Win=64128 Len=0 TSval=4279233953 TSecr=2121099508
   43 1612290802.929493370 192.168.2.254 → 192.168.1.254 TCP 66 40852 → 80 [ACK] Seq=1423 Ack=20306 Win=64128 Len=0 TSval=2121104559 TSecr=4279233953
   44 1612290803.776107315 192.168.2.254 → 192.168.1.254 TCP 66 40852 → 80 [FIN, ACK] Seq=1423 Ack=20306 Win=64128 Len=0 TSval=2121105405 TSecr=4279233953
   45 1612290803.776637421 192.168.2.254 → 192.168.1.254 TCP 74 40854 → 80 [SYN] Seq=0 Win=64240 Len=0 MSS=1460 SACK_PERM=1 TSval=2121105406 TSecr=0 WS=128
   46 1612290803.776656223 192.168.1.254 → 192.168.2.254 TCP 66 80 → 40852 [ACK] Seq=20306 Ack=1424 Win=64128 Len=0 TSval=4279234846 TSecr=2121105405
   47 1612290803.777082005 192.168.1.254 → 192.168.2.254 TCP 74 80 → 40854 [SYN, ACK] Seq=0 Ack=1 Win=65160 Len=0 MSS=1460 SACK_PERM=1 TSval=4279234847 TSecr=2121105406 WS=128
   48 1612290803.777210078 192.168.2.254 → 192.168.1.254 TCP 66 40854 → 80 [ACK] Seq=1 Ack=1 Win=64256 Len=0 TSval=2121105406 TSecr=4279234847
   49 1612290803.777886799 192.168.2.254 → 192.168.1.254 HTTP 540 GET /1.php HTTP/1.1 
   50 1612290803.778501592 192.168.1.254 → 192.168.2.254 TCP 66 80 → 40854 [ACK] Seq=1 Ack=475 Win=64768 Len=0 TSval=4279234848 TSecr=2121105407
   51 1612290803.781798527 192.168.1.254 → 192.168.2.254 TCP 1514 HTTP/1.1 200 OK  [TCP segment of a reassembled PDU]
   52 1612290803.782092017 192.168.2.254 → 192.168.1.254 TCP 66 40854 → 80 [ACK] Seq=475 Ack=1449 Win=64128 Len=0 TSval=2121105411 TSecr=4279234851
   53 1612290803.781838579 192.168.1.254 → 192.168.2.254 TCP 1514 80 → 40854 [ACK] Seq=1449 Ack=475 Win=64768 Len=1448 TSval=4279234851 TSecr=2121105407 [TCP segment of a reassembled PDU]
   54 1612290803.782165142 192.168.2.254 → 192.168.1.254 TCP 66 40854 → 80 [ACK] Seq=475 Ack=2897 Win=64128 Len=0 TSval=2121105411 TSecr=4279234851
   55 1612290803.782257226 192.168.1.254 → 192.168.2.254 TCP 1514 80 → 40854 [ACK] Seq=2897 Ack=475 Win=64768 Len=1448 TSval=4279234851 TSecr=2121105407 [TCP segment of a reassembled PDU]
   56 1612290803.782260768 192.168.1.254 → 192.168.2.254 TCP 1514 80 → 40854 [ACK] Seq=4345 Ack=475 Win=64768 Len=1448 TSval=4279234851 TSecr=2121105407 [TCP segment of a reassembled PDU]
   57 1612290803.782364049 192.168.2.254 → 192.168.1.254 TCP 66 40854 → 80 [ACK] Seq=475 Ack=4345 Win=62720 Len=0 TSval=2121105411 TSecr=4279234851
   58 1612290803.782263476 192.168.1.254 → 192.168.2.254 HTTP 1027 HTTP/1.1 200 OK  (text/html)
   59 1612290803.782429778 192.168.2.254 → 192.168.1.254 TCP 66 40854 → 80 [ACK] Seq=475 Ack=6754 Win=60416 Len=0 TSval=2121105411 TSecr=4279234851
   60 1612290805.572113211 192.168.2.254 → 192.168.1.254 HTTP 540 GET /1.php HTTP/1.1 
   61 1612290805.572858525 192.168.1.254 → 192.168.2.254 TCP 66 80 → 40854 [ACK] Seq=6754 Ack=949 Win=64384 Len=0 TSval=4279236643 TSecr=2121107201
   62 1612290805.576216867 192.168.1.254 → 192.168.2.254 TCP 1514 HTTP/1.1 200 OK  [TCP segment of a reassembled PDU]
   63 1612290805.576419367 192.168.2.254 → 192.168.1.254 TCP 66 40854 → 80 [ACK] Seq=949 Ack=8202 Win=64128 Len=0 TSval=2121107205 TSecr=4279236646
   64 1612290805.576223690 192.168.1.254 → 192.168.2.254 TCP 1514 80 → 40854 [ACK] Seq=8202 Ack=949 Win=64384 Len=1448 TSval=4279236646 TSecr=2121107201 [TCP segment of a reassembled PDU]
   65 1612290805.576517544 192.168.2.254 → 192.168.1.254 TCP 66 40854 → 80 [ACK] Seq=949 Ack=9650 Win=64128 Len=0 TSval=2121107206 TSecr=4279236646
   66 1612290805.576635409 192.168.1.254 → 192.168.2.254 TCP 1514 80 → 40854 [ACK] Seq=9650 Ack=949 Win=64384 Len=1448 TSval=4279236646 TSecr=2121107201 [TCP segment of a reassembled PDU]
   67 1612290805.576748691 192.168.2.254 → 192.168.1.254 TCP 66 40854 → 80 [ACK] Seq=949 Ack=11098 Win=64128 Len=0 TSval=2121107206 TSecr=4279236646
   68 1612290805.576641399 192.168.1.254 → 192.168.2.254 TCP 1514 80 → 40854 [ACK] Seq=11098 Ack=949 Win=64384 Len=1448 TSval=4279236646 TSecr=2121107201 [TCP segment of a reassembled PDU]
   69 1612290805.576797962 192.168.2.254 → 192.168.1.254 TCP 66 40854 → 80 [ACK] Seq=949 Ack=12546 Win=64128 Len=0 TSval=2121107206 TSecr=4279236646
   70 1612290805.576645826 192.168.1.254 → 192.168.2.254 HTTP 1037 HTTP/1.1 200 OK  (text/html)
   71 1612290805.576881764 192.168.2.254 → 192.168.1.254 TCP 66 40854 → 80 [ACK] Seq=949 Ack=13517 Win=64128 Len=0 TSval=2121107206 TSecr=4279236646
   72 1612290808.483785360 192.168.2.254 → 192.168.1.254 HTTP 540 GET /1.php HTTP/1.1 
   73 1612290808.484670258 192.168.1.254 → 192.168.2.254 TCP 66 80 → 40854 [ACK] Seq=13517 Ack=1423 Win=64128 Len=0 TSval=4279239554 TSecr=2121110113
   74 1612290808.488227714 192.168.1.254 → 192.168.2.254 TCP 1514 HTTP/1.1 200 OK  [TCP segment of a reassembled PDU]
   75 1612290808.488606361 192.168.2.254 → 192.168.1.254 TCP 66 40854 → 80 [ACK] Seq=1423 Ack=14965 Win=64128 Len=0 TSval=2121110118 TSecr=4279239557
   76 1612290808.488278183 192.168.1.254 → 192.168.2.254 TCP 1514 80 → 40854 [ACK] Seq=14965 Ack=1423 Win=64128 Len=1448 TSval=4279239557 TSecr=2121110113 [TCP segment of a reassembled PDU]
   77 1612290808.488742767 192.168.2.254 → 192.168.1.254 TCP 66 40854 → 80 [ACK] Seq=1423 Ack=16413 Win=64128 Len=0 TSval=2121110118 TSecr=4279239557
   78 1612290808.488282974 192.168.1.254 → 192.168.2.254 TCP 1514 80 → 40854 [ACK] Seq=16413 Ack=1423 Win=64128 Len=1448 TSval=4279239557 TSecr=2121110113 [TCP segment of a reassembled PDU]
   79 1612290808.488822924 192.168.2.254 → 192.168.1.254 TCP 66 40854 → 80 [ACK] Seq=1423 Ack=17861 Win=64128 Len=0 TSval=2121110118 TSecr=4279239557
   80 1612290808.488879955 192.168.1.254 → 192.168.2.254 TCP 1514 80 → 40854 [ACK] Seq=17861 Ack=1423 Win=64128 Len=1448 TSval=4279239557 TSecr=2121110113 [TCP segment of a reassembled PDU]
   81 1612290808.489111987 192.168.2.254 → 192.168.1.254 TCP 66 40854 → 80 [ACK] Seq=1423 Ack=19309 Win=64128 Len=0 TSval=2121110118 TSecr=4279239557
   82 1612290808.488889018 192.168.1.254 → 192.168.2.254 HTTP 1054 HTTP/1.1 200 OK  (text/html)
   83 1612290808.489165424 192.168.2.254 → 192.168.1.254 TCP 66 40854 → 80 [ACK] Seq=1423 Ack=20297 Win=64128 Len=0 TSval=2121110118 TSecr=4279239557
   84 1612290811.517923842 192.168.2.254 → 192.168.1.254 HTTP 540 GET /1.php HTTP/1.1 
   85 1612290811.518601448 192.168.1.254 → 192.168.2.254 TCP 66 80 → 40854 [ACK] Seq=20297 Ack=1897 Win=64128 Len=0 TSval=4279242588 TSecr=2121113147
   86 1612290811.521928799 192.168.1.254 → 192.168.2.254 TCP 1514 HTTP/1.1 200 OK  [TCP segment of a reassembled PDU]
   87 1612290811.522164841 192.168.2.254 → 192.168.1.254 TCP 66 40854 → 80 [ACK] Seq=1897 Ack=21745 Win=64128 Len=0 TSval=2121113151 TSecr=4279242591
   88 1612290811.521937185 192.168.1.254 → 192.168.2.254 TCP 1514 80 → 40854 [ACK] Seq=21745 Ack=1897 Win=64128 Len=1448 TSval=4279242591 TSecr=2121113147 [TCP segment of a reassembled PDU]
   89 1612290811.522245935 192.168.2.254 → 192.168.1.254 TCP 66 40854 → 80 [ACK] Seq=1897 Ack=23193 Win=64128 Len=0 TSval=2121113151 TSecr=4279242591
   90 1612290811.522342915 192.168.1.254 → 192.168.2.254 TCP 1514 80 → 40854 [ACK] Seq=23193 Ack=1897 Win=64128 Len=1448 TSval=4279242591 TSecr=2121113147 [TCP segment of a reassembled PDU]
   91 1612290811.522465832 192.168.2.254 → 192.168.1.254 TCP 66 40854 → 80 [ACK] Seq=1897 Ack=24641 Win=64128 Len=0 TSval=2121113152 TSecr=4279242591
   92 1612290811.522347967 192.168.1.254 → 192.168.2.254 TCP 1514 80 → 40854 [ACK] Seq=24641 Ack=1897 Win=64128 Len=1448 TSval=4279242591 TSecr=2121113147 [TCP segment of a reassembled PDU]
   93 1612290811.522523592 192.168.2.254 → 192.168.1.254 TCP 66 40854 → 80 [ACK] Seq=1897 Ack=26089 Win=64128 Len=0 TSval=2121113152 TSecr=4279242591
   94 1612290811.522352498 192.168.1.254 → 192.168.2.254 HTTP 1043 HTTP/1.1 200 OK  (text/html)
   95 1612290811.522575676 192.168.2.254 → 192.168.1.254 TCP 66 40854 → 80 [ACK] Seq=1897 Ack=27066 Win=64128 Len=0 TSval=2121113152 TSecr=4279242591
   96 1612290814.328093769 192.168.2.254 → 192.168.1.254 HTTP 540 GET /1.php HTTP/1.1 
   97 1612290814.332350446 192.168.1.254 → 192.168.2.254 TCP 1514 HTTP/1.1 200 OK  [TCP segment of a reassembled PDU]
   98 1612290814.332846281 192.168.2.254 → 192.168.1.254 TCP 66 40854 → 80 [ACK] Seq=2371 Ack=28514 Win=64128 Len=0 TSval=2121115962 TSecr=4279245401
   99 1612290814.332406175 192.168.1.254 → 192.168.2.254 TCP 1514 80 → 40854 [ACK] Seq=28514 Ack=2371 Win=64128 Len=1448 TSval=4279245401 TSecr=2121115957 [TCP segment of a reassembled PDU]
  100 1612290814.333015135 192.168.2.254 → 192.168.1.254 TCP 66 40854 → 80 [ACK] Seq=2371 Ack=29962 Win=64128 Len=0 TSval=2121115962 TSecr=4279245401
