    1 1612283432.192312047 192.168.2.254 → 192.168.102.153 TCP 74 44102 → 8000 [SYN] Seq=0 Win=64240 Len=0 MSS=1460 SACK_PERM=1 TSval=2461469857 TSecr=0 WS=128
    2 1612283432.193877416 192.168.102.153 → 192.168.2.254 TCP 74 8000 → 44102 [SYN, ACK] Seq=0 Ack=1 Win=65160 Len=0 MSS=1460 SACK_PERM=1 TSval=2753038668 TSecr=2461469857 WS=128
    3 1612283432.194356063 192.168.2.254 → 192.168.102.153 TCP 66 44102 → 8000 [ACK] Seq=1 Ack=1 Win=64256 Len=0 TSval=2461469859 TSecr=2753038668
    4 1612283432.197535914 192.168.2.254 → 192.168.102.153 HTTP 547 GET /1.php HTTP/1.1 
    5 1612283432.198484979 192.168.102.153 → 192.168.2.254 TCP 66 8000 → 44102 [ACK] Seq=1 Ack=482 Win=64768 Len=0 TSval=2753038673 TSecr=2461469863
    6 1612283432.215723457 192.168.102.153 → 192.168.2.254 TCP 1514 HTTP/1.1 200 OK  [TCP segment of a reassembled PDU]
    7 1612283432.216134031 192.168.2.254 → 192.168.102.153 TCP 66 44102 → 8000 [ACK] Seq=482 Ack=1449 Win=64128 Len=0 TSval=2461469881 TSecr=2753038687
    8 1612283432.215790385 192.168.102.153 → 192.168.2.254 TCP 1514 8000 → 44102 [ACK] Seq=1449 Ack=482 Win=64768 Len=1448 TSval=2753038687 TSecr=2461469863 [TCP segment of a reassembled PDU]
    9 1612283432.216296323 192.168.2.254 → 192.168.102.153 TCP 66 44102 → 8000 [ACK] Seq=482 Ack=2897 Win=64128 Len=0 TSval=2461469881 TSecr=2753038687
   10 1612283432.215794187 192.168.102.153 → 192.168.2.254 TCP 1514 8000 → 44102 [ACK] Seq=2897 Ack=482 Win=64768 Len=1448 TSval=2753038687 TSecr=2461469863 [TCP segment of a reassembled PDU]
   11 1612283432.216358823 192.168.2.254 → 192.168.102.153 TCP 66 44102 → 8000 [ACK] Seq=482 Ack=4345 Win=64128 Len=0 TSval=2461469881 TSecr=2753038687
   12 1612283432.216481272 192.168.102.153 → 192.168.2.254 TCP 1514 8000 → 44102 [PSH, ACK] Seq=4345 Ack=482 Win=64768 Len=1448 TSval=2753038687 TSecr=2461469863 [TCP segment of a reassembled PDU]
   13 1612283432.216693147 192.168.2.254 → 192.168.102.153 TCP 66 44102 → 8000 [ACK] Seq=482 Ack=5793 Win=64128 Len=0 TSval=2461469882 TSecr=2753038687
   14 1612283432.216489605 192.168.102.153 → 192.168.2.254 HTTP 1029 HTTP/1.1 200 OK  (text/html)
   15 1612283432.216758251 192.168.2.254 → 192.168.102.153 TCP 66 44102 → 8000 [ACK] Seq=482 Ack=6756 Win=64128 Len=0 TSval=2461469882 TSecr=2753038687
   16 1612283437.216458710 192.168.102.153 → 192.168.2.254 TCP 66 8000 → 44102 [FIN, ACK] Seq=6756 Ack=482 Win=64768 Len=0 TSval=2753043691 TSecr=2461469882
   17 1612283437.259475636 192.168.2.254 → 192.168.102.153 TCP 66 44102 → 8000 [ACK] Seq=482 Ack=6757 Win=64128 Len=0 TSval=2461474925 TSecr=2753043691
   18 1612283476.145479731 192.168.2.254 → 192.168.102.153 TCP 66 44102 → 8000 [FIN, ACK] Seq=482 Ack=6757 Win=64128 Len=0 TSval=2461513810 TSecr=2753043691
   19 1612283476.146627598 192.168.2.254 → 192.168.102.153 TCP 74 44104 → 8000 [SYN] Seq=0 Win=64240 Len=0 MSS=1460 SACK_PERM=1 TSval=2461513812 TSecr=0 WS=128
   20 1612283476.147562028 192.168.102.153 → 192.168.2.254 TCP 74 8000 → 44104 [SYN, ACK] Seq=0 Ack=1 Win=65160 Len=0 MSS=1460 SACK_PERM=1 TSval=2753082622 TSecr=2461513812 WS=128
   21 1612283476.147819997 192.168.2.254 → 192.168.102.153 TCP 66 44104 → 8000 [ACK] Seq=1 Ack=1 Win=64256 Len=0 TSval=2461513813 TSecr=2753082622
   22 1612283476.149597345 192.168.2.254 → 192.168.102.153 HTTP 547 GET /1.php HTTP/1.1 
   23 1612283476.150803181 192.168.102.153 → 192.168.2.254 TCP 66 8000 → 44104 [ACK] Seq=1 Ack=482 Win=64768 Len=0 TSval=2753082625 TSecr=2461513815
   24 1612283476.154254543 192.168.102.153 → 192.168.2.254 TCP 1514 HTTP/1.1 200 OK  [TCP segment of a reassembled PDU]
   25 1612283476.154512669 192.168.2.254 → 192.168.102.153 TCP 66 44104 → 8000 [ACK] Seq=482 Ack=1449 Win=64128 Len=0 TSval=2461513820 TSecr=2753082628
   26 1612283476.154261314 192.168.102.153 → 192.168.2.254 TCP 1514 8000 → 44104 [ACK] Seq=1449 Ack=482 Win=64768 Len=1448 TSval=2753082628 TSecr=2461513815 [TCP segment of a reassembled PDU]
   27 1612283476.154672774 192.168.2.254 → 192.168.102.153 TCP 66 44104 → 8000 [ACK] Seq=482 Ack=2897 Win=64128 Len=0 TSval=2461513820 TSecr=2753082628
   28 1612283476.154265793 192.168.102.153 → 192.168.2.254 TCP 1514 8000 → 44104 [ACK] Seq=2897 Ack=482 Win=64768 Len=1448 TSval=2753082628 TSecr=2461513815 [TCP segment of a reassembled PDU]
   29 1612283476.154750378 192.168.2.254 → 192.168.102.153 TCP 66 44104 → 8000 [ACK] Seq=482 Ack=4345 Win=64128 Len=0 TSval=2461513820 TSecr=2753082628
   30 1612283476.154943660 192.168.102.153 → 192.168.2.254 TCP 1514 8000 → 44104 [ACK] Seq=4345 Ack=482 Win=64768 Len=1448 TSval=2753082628 TSecr=2461513815 [TCP segment of a reassembled PDU]
   31 1612283476.155104493 192.168.2.254 → 192.168.102.153 TCP 66 44104 → 8000 [ACK] Seq=482 Ack=5793 Win=64128 Len=0 TSval=2461513820 TSecr=2753082628
   32 1612283476.154950951 192.168.102.153 → 192.168.2.254 HTTP 1033 HTTP/1.1 200 OK  (text/html)
   33 1612283476.155161264 192.168.2.254 → 192.168.102.153 TCP 66 44104 → 8000 [ACK] Seq=482 Ack=6760 Win=64128 Len=0 TSval=2461513820 TSecr=2753082628
   34 1612283476.359577741 192.168.2.254 → 192.168.102.153 TCP 66 [TCP Retransmission] 44102 → 8000 [FIN, ACK] Seq=482 Ack=6757 Win=64128 Len=0 TSval=2461514025 TSecr=2753043691
   35 1612283476.579583839 192.168.2.254 → 192.168.102.153 TCP 66 [TCP Retransmission] 44102 → 8000 [FIN, ACK] Seq=482 Ack=6757 Win=64128 Len=0 TSval=2461514245 TSecr=2753043691
   36 1612283477.009527259 192.168.2.254 → 192.168.102.153 TCP 66 [TCP Retransmission] 44102 → 8000 [FIN, ACK] Seq=482 Ack=6757 Win=64128 Len=0 TSval=2461514675 TSecr=2753043691
   37 1612283477.869547747 192.168.2.254 → 192.168.102.153 TCP 66 [TCP Retransmission] 44102 → 8000 [FIN, ACK] Seq=482 Ack=6757 Win=64128 Len=0 TSval=2461515535 TSecr=2753043691
   38 1612283479.629511681 192.168.2.254 → 192.168.102.153 TCP 66 [TCP Retransmission] 44102 → 8000 [FIN, ACK] Seq=482 Ack=6757 Win=64128 Len=0 TSval=2461517295 TSecr=2753043691
   39 1612283481.158752983 192.168.102.153 → 192.168.2.254 TCP 66 8000 → 44104 [FIN, ACK] Seq=6760 Ack=482 Win=64768 Len=0 TSval=2753087633 TSecr=2461513820
   40 1612283481.199471257 192.168.2.254 → 192.168.102.153 TCP 66 44104 → 8000 [ACK] Seq=482 Ack=6761 Win=64128 Len=0 TSval=2461518865 TSecr=2753087633
   41 1612283483.069521391 192.168.2.254 → 192.168.102.153 TCP 66 [TCP Retransmission] 44102 → 8000 [FIN, ACK] Seq=482 Ack=6757 Win=64128 Len=0 TSval=2461520735 TSecr=2753043691
   42 1612283489.479773077 192.168.2.254 → 192.168.102.153 TCP 66 44104 → 8000 [FIN, ACK] Seq=482 Ack=6761 Win=64128 Len=0 TSval=2461527145 TSecr=2753087633
   43 1612283489.480669850 192.168.102.153 → 192.168.2.254 TCP 66 8000 → 44104 [ACK] Seq=6761 Ack=483 Win=64768 Len=0 TSval=2753095955 TSecr=2461527145
   44 1612283489.481502404 192.168.2.254 → 192.168.102.153 TCP 74 44106 → 8000 [SYN] Seq=0 Win=64240 Len=0 MSS=1460 SACK_PERM=1 TSval=2461527147 TSecr=0 WS=128
   45 1612283489.482248291 192.168.102.153 → 192.168.2.254 TCP 74 8000 → 44106 [SYN, ACK] Seq=0 Ack=1 Win=65160 Len=0 MSS=1460 SACK_PERM=1 TSval=2753095956 TSecr=2461527147 WS=128
   46 1612283489.482467511 192.168.2.254 → 192.168.102.153 TCP 66 44106 → 8000 [ACK] Seq=1 Ack=1 Win=64256 Len=0 TSval=2461527147 TSecr=2753095956
   47 1612283489.483883868 192.168.2.254 → 192.168.102.153 HTTP 634 GET / HTTP/1.1 
   48 1612283489.484810902 192.168.102.153 → 192.168.2.254 TCP 66 8000 → 44106 [ACK] Seq=1 Ack=569 Win=64640 Len=0 TSval=2753095959 TSecr=2461527149
   49 1612283489.486873354 192.168.102.153 → 192.168.2.254 TCP 1514 HTTP/1.1 200 OK  [TCP segment of a reassembled PDU]
   50 1612283489.487140178 192.168.2.254 → 192.168.102.153 TCP 66 44106 → 8000 [ACK] Seq=569 Ack=1449 Win=64128 Len=0 TSval=2461527152 TSecr=2753095960
   51 1612283489.486890386 192.168.102.153 → 192.168.2.254 TCP 1514 8000 → 44106 [ACK] Seq=1449 Ack=569 Win=64640 Len=1448 TSval=2753095960 TSecr=2461527149 [TCP segment of a reassembled PDU]
   52 1612283489.487293512 192.168.2.254 → 192.168.102.153 TCP 66 44106 → 8000 [ACK] Seq=569 Ack=2897 Win=64128 Len=0 TSval=2461527152 TSecr=2753095960
   53 1612283489.486894031 192.168.102.153 → 192.168.2.254 HTTP 552 HTTP/1.1 200 OK  (text/html)
   54 1612283489.487345491 192.168.2.254 → 192.168.102.153 TCP 66 44106 → 8000 [ACK] Seq=569 Ack=3383 Win=64128 Len=0 TSval=2461527152 TSecr=2753095960
   55 1612283490.349543588 192.168.2.254 → 192.168.102.153 TCP 66 [TCP Retransmission] 44102 → 8000 [FIN, ACK] Seq=482 Ack=6757 Win=64128 Len=0 TSval=2461528015 TSecr=2753043691
   56 1612283494.491567940 192.168.102.153 → 192.168.2.254 TCP 66 8000 → 44106 [FIN, ACK] Seq=3383 Ack=569 Win=64640 Len=0 TSval=2753100965 TSecr=2461527152
   57 1612283494.539533679 192.168.2.254 → 192.168.102.153 TCP 66 44106 → 8000 [ACK] Seq=569 Ack=3384 Win=64128 Len=0 TSval=2461532205 TSecr=2753100965
   58 1612283494.982861402 192.168.2.254 → 192.168.102.153 TCP 66 44106 → 8000 [FIN, ACK] Seq=569 Ack=3384 Win=64128 Len=0 TSval=2461532648 TSecr=2753100965
   59 1612283494.983538904 192.168.2.254 → 192.168.102.153 TCP 74 44108 → 8000 [SYN] Seq=0 Win=64240 Len=0 MSS=1460 SACK_PERM=1 TSval=2461532649 TSecr=0 WS=128
   60 1612283494.983641352 192.168.102.153 → 192.168.2.254 TCP 66 8000 → 44106 [ACK] Seq=3384 Ack=570 Win=64640 Len=0 TSval=2753101458 TSecr=2461532648
   61 1612283494.984162499 192.168.102.153 → 192.168.2.254 TCP 74 8000 → 44108 [SYN, ACK] Seq=0 Ack=1 Win=65160 Len=0 MSS=1460 SACK_PERM=1 TSval=2753101458 TSecr=2461532649 WS=128
   62 1612283494.984307916 192.168.2.254 → 192.168.102.153 TCP 66 44108 → 8000 [ACK] Seq=1 Ack=1 Win=64256 Len=0 TSval=2461532649 TSecr=2753101458
   63 1612283494.986299432 192.168.2.254 → 192.168.102.153 HTTP 547 GET /1.php HTTP/1.1 
   64 1612283494.987131934 192.168.102.153 → 192.168.2.254 TCP 66 8000 → 44108 [ACK] Seq=1 Ack=482 Win=64768 Len=0 TSval=2753101461 TSecr=2461532651
   65 1612283494.990863297 192.168.102.153 → 192.168.2.254 TCP 1514 HTTP/1.1 200 OK  [TCP segment of a reassembled PDU]
   66 1612283494.991293037 192.168.2.254 → 192.168.102.153 TCP 66 44108 → 8000 [ACK] Seq=482 Ack=1449 Win=64128 Len=0 TSval=2461532656 TSecr=2753101464
   67 1612283494.990874807 192.168.102.153 → 192.168.2.254 TCP 1514 8000 → 44108 [ACK] Seq=1449 Ack=482 Win=64768 Len=1448 TSval=2753101464 TSecr=2461532651 [TCP segment of a reassembled PDU]
   68 1612283494.991451006 192.168.2.254 → 192.168.102.153 TCP 66 44108 → 8000 [ACK] Seq=482 Ack=2897 Win=64128 Len=0 TSval=2461532656 TSecr=2753101464
   69 1612283494.990879703 192.168.102.153 → 192.168.2.254 TCP 1514 8000 → 44108 [ACK] Seq=2897 Ack=482 Win=64768 Len=1448 TSval=2753101464 TSecr=2461532651 [TCP segment of a reassembled PDU]
   70 1612283494.991535017 192.168.2.254 → 192.168.102.153 TCP 66 44108 → 8000 [ACK] Seq=482 Ack=4345 Win=64128 Len=0 TSval=2461532657 TSecr=2753101464
   71 1612283494.991693090 192.168.102.153 → 192.168.2.254 TCP 1514 8000 → 44108 [ACK] Seq=4345 Ack=482 Win=64768 Len=1448 TSval=2753101464 TSecr=2461532651 [TCP segment of a reassembled PDU]
   72 1612283494.992106216 192.168.2.254 → 192.168.102.153 TCP 66 44108 → 8000 [ACK] Seq=482 Ack=5793 Win=64128 Len=0 TSval=2461532657 TSecr=2753101464
   73 1612283494.991702309 192.168.102.153 → 192.168.2.254 HTTP 1048 HTTP/1.1 200 OK  (text/html)
   74 1612283494.992267987 192.168.2.254 → 192.168.102.153 TCP 66 44108 → 8000 [ACK] Seq=482 Ack=6775 Win=64128 Len=0 TSval=2461532657 TSecr=2753101464
   75 1612283499.995023402 192.168.102.153 → 192.168.2.254 TCP 66 8000 → 44108 [FIN, ACK] Seq=6775 Ack=482 Win=64768 Len=0 TSval=2753106469 TSecr=2461532657
   76 1612283500.039549497 192.168.2.254 → 192.168.102.153 TCP 66 44108 → 8000 [ACK] Seq=482 Ack=6776 Win=64128 Len=0 TSval=2461537705 TSecr=2753106469
   77 1612283500.231375684 192.168.2.254 → 192.168.102.153 TCP 66 44108 → 8000 [FIN, ACK] Seq=482 Ack=6776 Win=64128 Len=0 TSval=2461537896 TSecr=2753106469
   78 1612283500.232123758 192.168.2.254 → 192.168.102.153 TCP 74 44110 → 8000 [SYN] Seq=0 Win=64240 Len=0 MSS=1460 SACK_PERM=1 TSval=2461537897 TSecr=0 WS=128
   79 1612283500.232143446 192.168.102.153 → 192.168.2.254 TCP 66 8000 → 44108 [ACK] Seq=6776 Ack=483 Win=64768 Len=0 TSval=2753106706 TSecr=2461537896
   80 1612283500.232870427 192.168.102.153 → 192.168.2.254 TCP 74 8000 → 44110 [SYN, ACK] Seq=0 Ack=1 Win=65160 Len=0 MSS=1460 SACK_PERM=1 TSval=2753106707 TSecr=2461537897 WS=128
   81 1612283500.233176886 192.168.2.254 → 192.168.102.153 TCP 66 44110 → 8000 [ACK] Seq=1 Ack=1 Win=64256 Len=0 TSval=2461537898 TSecr=2753106707
   82 1612283500.234723973 192.168.2.254 → 192.168.102.153 HTTP 634 GET / HTTP/1.1 
   83 1612283500.235677829 192.168.102.153 → 192.168.2.254 TCP 66 8000 → 44110 [ACK] Seq=1 Ack=569 Win=64640 Len=0 TSval=2753106710 TSecr=2461537900
   84 1612283500.237723251 192.168.102.153 → 192.168.2.254 TCP 1514 HTTP/1.1 200 OK  [TCP segment of a reassembled PDU]
   85 1612283500.237939189 192.168.2.254 → 192.168.102.153 TCP 66 44110 → 8000 [ACK] Seq=569 Ack=1449 Win=64128 Len=0 TSval=2461537903 TSecr=2753106711
   86 1612283500.237734241 192.168.102.153 → 192.168.2.254 TCP 1514 8000 → 44110 [ACK] Seq=1449 Ack=569 Win=64640 Len=1448 TSval=2753106711 TSecr=2461537900 [TCP segment of a reassembled PDU]
   87 1612283500.238144762 192.168.2.254 → 192.168.102.153 TCP 66 44110 → 8000 [ACK] Seq=569 Ack=2897 Win=64128 Len=0 TSval=2461537903 TSecr=2753106711
   88 1612283500.237737366 192.168.102.153 → 192.168.2.254 HTTP 552 HTTP/1.1 200 OK  (text/html)
   89 1612283500.238248929 192.168.2.254 → 192.168.102.153 TCP 66 44110 → 8000 [ACK] Seq=569 Ack=3383 Win=64128 Len=0 TSval=2461537903 TSecr=2753106711
   90 1612283503.170994305 192.168.2.254 → 192.168.102.153 HTTP 547 GET /1.php HTTP/1.1 
   91 1612283503.171953630 192.168.102.153 → 192.168.2.254 TCP 66 8000 → 44110 [ACK] Seq=3383 Ack=1050 Win=64256 Len=0 TSval=2753109646 TSecr=2461540836
   92 1612283503.175737754 192.168.102.153 → 192.168.2.254 TCP 1514 HTTP/1.1 200 OK  [TCP segment of a reassembled PDU]
   93 1612283503.176033536 192.168.2.254 → 192.168.102.153 TCP 66 44110 → 8000 [ACK] Seq=1050 Ack=4831 Win=64128 Len=0 TSval=2461540841 TSecr=2753109649
   94 1612283503.175748483 192.168.102.153 → 192.168.2.254 TCP 1514 8000 → 44110 [ACK] Seq=4831 Ack=1050 Win=64256 Len=1448 TSval=2753109649 TSecr=2461540836 [TCP segment of a reassembled PDU]
   95 1612283503.176147390 192.168.2.254 → 192.168.102.153 TCP 66 44110 → 8000 [ACK] Seq=1050 Ack=6279 Win=64128 Len=0 TSval=2461540841 TSecr=2753109649
   96 1612283503.175753379 192.168.102.153 → 192.168.2.254 TCP 1514 8000 → 44110 [ACK] Seq=6279 Ack=1050 Win=64256 Len=1448 TSval=2753109649 TSecr=2461540836 [TCP segment of a reassembled PDU]
   97 1612283503.176220516 192.168.2.254 → 192.168.102.153 TCP 66 44110 → 8000 [ACK] Seq=1050 Ack=7727 Win=64128 Len=0 TSval=2461540841 TSecr=2753109649
   98 1612283503.175757962 192.168.102.153 → 192.168.2.254 TCP 1514 8000 → 44110 [ACK] Seq=7727 Ack=1050 Win=64256 Len=1448 TSval=2753109649 TSecr=2461540836 [TCP segment of a reassembled PDU]
   99 1612283503.176275307 192.168.2.254 → 192.168.102.153 TCP 66 44110 → 8000 [ACK] Seq=1050 Ack=9175 Win=64128 Len=0 TSval=2461540841 TSecr=2753109649
  100 1612283503.175762389 192.168.102.153 → 192.168.2.254 HTTP 1078 HTTP/1.1 200 OK  (text/html)
