    1 1612290692.809314248 192.168.2.254 → 192.168.1.254 TCP 66 40800 → 80 [FIN, ACK] Seq=1 Ack=1 Win=501 Len=0 TSval=2120986256 TSecr=4279077554
    2 1612290692.809368304 192.168.1.254 → 192.168.2.254 TCP 66 80 → 40800 [ACK] Seq=1 Ack=2 Win=504 Len=0 TSval=4279115698 TSecr=2120986256
    3 1612290692.809824193 192.168.2.254 → 192.168.1.254 TCP 74 40822 → 80 [SYN] Seq=0 Win=64240 Len=0 MSS=1460 SACK_PERM=1 TSval=2120986257 TSecr=0 WS=128
    4 1612290692.809858785 192.168.1.254 → 192.168.2.254 TCP 74 80 → 40822 [SYN, ACK] Seq=0 Ack=1 Win=65160 Len=0 MSS=1460 SACK_PERM=1 TSval=4279115698 TSecr=2120986257 WS=128
    5 1612290692.810351952 192.168.2.254 → 192.168.1.254 TCP 66 40822 → 80 [ACK] Seq=1 Ack=1 Win=64256 Len=0 TSval=2120986257 TSecr=4279115698
    6 1612290692.813617934 192.168.2.254 → 192.168.1.254 HTTP 627 GET / HTTP/1.1 
    7 1612290692.813668452 192.168.1.254 → 192.168.2.254 TCP 66 80 → 40822 [ACK] Seq=1 Ack=562 Win=64640 Len=0 TSval=4279115702 TSecr=2120986260
    8 1612290692.815079397 192.168.1.254 → 192.168.2.254 TCP 1514 HTTP/1.1 200 OK  [TCP segment of a reassembled PDU]
    9 1612290692.815094619 192.168.1.254 → 192.168.2.254 TCP 1514 80 → 40822 [ACK] Seq=1449 Ack=562 Win=64640 Len=1448 TSval=4279115703 TSecr=2120986260 [TCP segment of a reassembled PDU]
   10 1612290692.815099082 192.168.1.254 → 192.168.2.254 HTTP 552 HTTP/1.1 200 OK  (text/html)
   11 1612290692.816308304 192.168.2.254 → 192.168.1.254 TCP 66 40822 → 80 [ACK] Seq=562 Ack=1449 Win=64128 Len=0 TSval=2120986263 TSecr=4279115703
   12 1612290692.816375841 192.168.2.254 → 192.168.1.254 TCP 66 40822 → 80 [ACK] Seq=562 Ack=2897 Win=64128 Len=0 TSval=2120986263 TSecr=4279115703
   13 1612290692.816398100 192.168.2.254 → 192.168.1.254 TCP 66 40822 → 80 [ACK] Seq=562 Ack=3383 Win=64128 Len=0 TSval=2120986263 TSecr=4279115703
   14 1612290697.663735746 192.168.2.254 → 192.168.1.254 HTTP 540 GET /1.php HTTP/1.1 
   15 1612290697.663787968 192.168.1.254 → 192.168.2.254 TCP 66 80 → 40822 [ACK] Seq=3383 Ack=1036 Win=64256 Len=0 TSval=4279120552 TSecr=2120991110
   16 1612290697.666662560 192.168.1.254 → 192.168.2.254 TCP 1514 HTTP/1.1 200 OK  [TCP segment of a reassembled PDU]
   17 1612290697.666677875 192.168.1.254 → 192.168.2.254 TCP 1514 80 → 40822 [ACK] Seq=4831 Ack=1036 Win=64256 Len=1448 TSval=4279120555 TSecr=2120991110 [TCP segment of a reassembled PDU]
   18 1612290697.666682171 192.168.1.254 → 192.168.2.254 TCP 1514 80 → 40822 [ACK] Seq=6279 Ack=1036 Win=64256 Len=1448 TSval=4279120555 TSecr=2120991110 [TCP segment of a reassembled PDU]
   19 1612290697.666686486 192.168.1.254 → 192.168.2.254 TCP 1514 80 → 40822 [ACK] Seq=7727 Ack=1036 Win=64256 Len=1448 TSval=4279120555 TSecr=2120991110 [TCP segment of a reassembled PDU]
   20 1612290697.666690394 192.168.1.254 → 192.168.2.254 HTTP 1027 HTTP/1.1 200 OK  (text/html)
   21 1612290697.668128246 192.168.2.254 → 192.168.1.254 TCP 66 40822 → 80 [ACK] Seq=1036 Ack=4831 Win=64128 Len=0 TSval=2120991115 TSecr=4279120555
   22 1612290697.668169264 192.168.2.254 → 192.168.1.254 TCP 66 40822 → 80 [ACK] Seq=1036 Ack=6279 Win=64128 Len=0 TSval=2120991115 TSecr=4279120555
   23 1612290697.668447301 192.168.2.254 → 192.168.1.254 TCP 66 40822 → 80 [ACK] Seq=1036 Ack=7727 Win=64128 Len=0 TSval=2120991115 TSecr=4279120555
   24 1612290697.668476283 192.168.2.254 → 192.168.1.254 TCP 66 40822 → 80 [ACK] Seq=1036 Ack=9175 Win=64128 Len=0 TSval=2120991115 TSecr=4279120555
   25 1612290697.668494264 192.168.2.254 → 192.168.1.254 TCP 66 40822 → 80 [ACK] Seq=1036 Ack=10136 Win=64128 Len=0 TSval=2120991115 TSecr=4279120555
   26 1612290701.824242891 192.168.2.254 → 192.168.1.254 HTTP 627 GET / HTTP/1.1 
   27 1612290701.824300799 192.168.1.254 → 192.168.2.254 TCP 66 80 → 40822 [ACK] Seq=10136 Ack=1597 Win=64128 Len=0 TSval=4279124713 TSecr=2120995271
   28 1612290701.825598539 192.168.1.254 → 192.168.2.254 TCP 1514 HTTP/1.1 200 OK  [TCP segment of a reassembled PDU]
   29 1612290701.825613002 192.168.1.254 → 192.168.2.254 TCP 1514 80 → 40822 [ACK] Seq=11584 Ack=1597 Win=64128 Len=1448 TSval=4279124714 TSecr=2120995271 [TCP segment of a reassembled PDU]
   30 1612290701.825617410 192.168.1.254 → 192.168.2.254 HTTP 551 HTTP/1.1 200 OK  (text/html)
   31 1612290701.827019076 192.168.2.254 → 192.168.1.254 TCP 66 40822 → 80 [ACK] Seq=1597 Ack=11584 Win=64128 Len=0 TSval=2120995274 TSecr=4279124714
   32 1612290701.827054373 192.168.2.254 → 192.168.1.254 TCP 66 40822 → 80 [ACK] Seq=1597 Ack=13032 Win=64128 Len=0 TSval=2120995274 TSecr=4279124714
   33 1612290701.827071039 192.168.2.254 → 192.168.1.254 TCP 66 40822 → 80 [ACK] Seq=1597 Ack=13517 Win=64128 Len=0 TSval=2120995274 TSecr=4279124714
   34 1612290704.297760742 192.168.2.254 → 192.168.1.254 HTTP 540 GET /1.php HTTP/1.1 
   35 1612290704.297812816 192.168.1.254 → 192.168.2.254 TCP 66 80 → 40822 [ACK] Seq=13517 Ack=2071 Win=64128 Len=0 TSval=4279127186 TSecr=2120997745
   36 1612290704.300815853 192.168.1.254 → 192.168.2.254 TCP 1514 HTTP/1.1 200 OK  [TCP segment of a reassembled PDU]
   37 1612290704.300832279 192.168.1.254 → 192.168.2.254 TCP 1514 80 → 40822 [ACK] Seq=14965 Ack=2071 Win=64128 Len=1448 TSval=4279127189 TSecr=2120997745 [TCP segment of a reassembled PDU]
   38 1612290704.300836612 192.168.1.254 → 192.168.2.254 TCP 1514 80 → 40822 [ACK] Seq=16413 Ack=2071 Win=64128 Len=1448 TSval=4279127189 TSecr=2120997745 [TCP segment of a reassembled PDU]
   39 1612290704.300840464 192.168.1.254 → 192.168.2.254 TCP 1514 80 → 40822 [ACK] Seq=17861 Ack=2071 Win=64128 Len=1448 TSval=4279127189 TSecr=2120997745 [TCP segment of a reassembled PDU]
   40 1612290704.300844519 192.168.1.254 → 192.168.2.254 HTTP 1022 HTTP/1.1 200 OK  (text/html)
   41 1612290704.302139334 192.168.2.254 → 192.168.1.254 TCP 66 40822 → 80 [ACK] Seq=2071 Ack=14965 Win=64128 Len=0 TSval=2120997749 TSecr=4279127189
   42 1612290704.302178705 192.168.2.254 → 192.168.1.254 TCP 66 40822 → 80 [ACK] Seq=2071 Ack=16413 Win=64128 Len=0 TSval=2120997749 TSecr=4279127189
   43 1612290704.302178797 192.168.2.254 → 192.168.1.254 TCP 66 40822 → 80 [ACK] Seq=2071 Ack=17861 Win=64128 Len=0 TSval=2120997749 TSecr=4279127189
   44 1612290704.302315723 192.168.2.254 → 192.168.1.254 TCP 66 40822 → 80 [ACK] Seq=2071 Ack=19309 Win=64128 Len=0 TSval=2120997749 TSecr=4279127189
   45 1612290704.302350186 192.168.2.254 → 192.168.1.254 TCP 66 40822 → 80 [ACK] Seq=2071 Ack=20265 Win=64128 Len=0 TSval=2120997749 TSecr=4279127189
   46 1612290709.306102942 192.168.1.254 → 192.168.2.254 TCP 66 80 → 40822 [FIN, ACK] Seq=20265 Ack=2071 Win=64128 Len=0 TSval=4279132195 TSecr=2120997749
   47 1612290709.351622627 192.168.2.254 → 192.168.1.254 TCP 66 40822 → 80 [ACK] Seq=2071 Ack=20266 Win=64128 Len=0 TSval=2121002799 TSecr=4279132195
   48 1612290710.173015942 192.168.2.254 → 192.168.1.254 TCP 66 40822 → 80 [FIN, ACK] Seq=2071 Ack=20266 Win=64128 Len=0 TSval=2121003620 TSecr=4279132195
   49 1612290710.173063479 192.168.1.254 → 192.168.2.254 TCP 66 80 → 40822 [ACK] Seq=20266 Ack=2072 Win=64128 Len=0 TSval=4279133062 TSecr=2121003620
   50 1612290710.173829220 192.168.2.254 → 192.168.1.254 TCP 74 40824 → 80 [SYN] Seq=0 Win=64240 Len=0 MSS=1460 SACK_PERM=1 TSval=2121003621 TSecr=0 WS=128
   51 1612290710.173870220 192.168.1.254 → 192.168.2.254 TCP 74 80 → 40824 [SYN, ACK] Seq=0 Ack=1 Win=65160 Len=0 MSS=1460 SACK_PERM=1 TSval=4279133062 TSecr=2121003621 WS=128
   52 1612290710.174605386 192.168.2.254 → 192.168.1.254 TCP 66 40824 → 80 [ACK] Seq=1 Ack=1 Win=64256 Len=0 TSval=2121003622 TSecr=4279133062
   53 1612290710.176193831 192.168.2.254 → 192.168.1.254 HTTP 627 GET / HTTP/1.1 
   54 1612290710.176242646 192.168.1.254 → 192.168.2.254 TCP 66 80 → 40824 [ACK] Seq=1 Ack=562 Win=64640 Len=0 TSval=4279133065 TSecr=2121003623
   55 1612290710.177515034 192.168.1.254 → 192.168.2.254 TCP 1514 HTTP/1.1 200 OK  [TCP segment of a reassembled PDU]
   56 1612290710.177528645 192.168.1.254 → 192.168.2.254 TCP 1514 80 → 40824 [ACK] Seq=1449 Ack=562 Win=64640 Len=1448 TSval=4279133066 TSecr=2121003623 [TCP segment of a reassembled PDU]
   57 1612290710.177533220 192.168.1.254 → 192.168.2.254 HTTP 552 HTTP/1.1 200 OK  (text/html)
   58 1612290710.178968757 192.168.2.254 → 192.168.1.254 TCP 66 40824 → 80 [ACK] Seq=562 Ack=1449 Win=64128 Len=0 TSval=2121003626 TSecr=4279133066
   59 1612290710.179013201 192.168.2.254 → 192.168.1.254 TCP 66 40824 → 80 [ACK] Seq=562 Ack=2897 Win=64128 Len=0 TSval=2121003626 TSecr=4279133066
   60 1612290710.179013275 192.168.2.254 → 192.168.1.254 TCP 66 40824 → 80 [ACK] Seq=562 Ack=3383 Win=64128 Len=0 TSval=2121003626 TSecr=4279133066
   61 1612290715.182729828 192.168.1.254 → 192.168.2.254 TCP 66 80 → 40824 [FIN, ACK] Seq=3383 Ack=562 Win=64640 Len=0 TSval=4279138071 TSecr=2121003626
   62 1612290715.231614309 192.168.2.254 → 192.168.1.254 TCP 66 40824 → 80 [ACK] Seq=562 Ack=3384 Win=64128 Len=0 TSval=2121008679 TSecr=4279138071
   63 1612290718.764598437 192.168.2.254 → 192.168.1.254 TCP 66 40824 → 80 [FIN, ACK] Seq=562 Ack=3384 Win=64128 Len=0 TSval=2121012212 TSecr=4279138071
   64 1612290718.764654418 192.168.1.254 → 192.168.2.254 TCP 66 80 → 40824 [ACK] Seq=3384 Ack=563 Win=64640 Len=0 TSval=4279141653 TSecr=2121012212
   65 1612290718.765539326 192.168.2.254 → 192.168.1.254 TCP 74 40826 → 80 [SYN] Seq=0 Win=64240 Len=0 MSS=1460 SACK_PERM=1 TSval=2121012213 TSecr=0 WS=128
   66 1612290718.765601196 192.168.1.254 → 192.168.2.254 TCP 74 80 → 40826 [SYN, ACK] Seq=0 Ack=1 Win=65160 Len=0 MSS=1460 SACK_PERM=1 TSval=4279141654 TSecr=2121012213 WS=128
   67 1612290718.766226048 192.168.2.254 → 192.168.1.254 TCP 66 40826 → 80 [ACK] Seq=1 Ack=1 Win=64256 Len=0 TSval=2121012213 TSecr=4279141654
   68 1612290718.767750974 192.168.2.254 → 192.168.1.254 HTTP 540 GET /1.php HTTP/1.1 
   69 1612290718.767807270 192.168.1.254 → 192.168.2.254 TCP 66 80 → 40826 [ACK] Seq=1 Ack=475 Win=64768 Len=0 TSval=4279141656 TSecr=2121012215
   70 1612290718.770671603 192.168.1.254 → 192.168.2.254 TCP 1514 HTTP/1.1 200 OK  [TCP segment of a reassembled PDU]
   71 1612290718.770685992 192.168.1.254 → 192.168.2.254 TCP 1514 80 → 40826 [ACK] Seq=1449 Ack=475 Win=64768 Len=1448 TSval=4279141659 TSecr=2121012215 [TCP segment of a reassembled PDU]
   72 1612290718.770690418 192.168.1.254 → 192.168.2.254 TCP 1514 80 → 40826 [ACK] Seq=2897 Ack=475 Win=64768 Len=1448 TSval=4279141659 TSecr=2121012215 [TCP segment of a reassembled PDU]
   73 1612290718.770694529 192.168.1.254 → 192.168.2.254 TCP 1514 80 → 40826 [ACK] Seq=4345 Ack=475 Win=64768 Len=1448 TSval=4279141659 TSecr=2121012215 [TCP segment of a reassembled PDU]
   74 1612290718.770698289 192.168.1.254 → 192.168.2.254 HTTP 1020 HTTP/1.1 200 OK  (text/html)
   75 1612290718.772420992 192.168.2.254 → 192.168.1.254 TCP 66 40826 → 80 [ACK] Seq=475 Ack=1449 Win=64128 Len=0 TSval=2121012219 TSecr=4279141659
   76 1612290718.772464622 192.168.2.254 → 192.168.1.254 TCP 66 40826 → 80 [ACK] Seq=475 Ack=2897 Win=64128 Len=0 TSval=2121012219 TSecr=4279141659
   77 1612290718.772464714 192.168.2.254 → 192.168.1.254 TCP 66 40826 → 80 [ACK] Seq=475 Ack=4345 Win=64128 Len=0 TSval=2121012219 TSecr=4279141659
   78 1612290718.772488511 192.168.2.254 → 192.168.1.254 TCP 66 40826 → 80 [ACK] Seq=475 Ack=5793 Win=64128 Len=0 TSval=2121012219 TSecr=4279141659
   79 1612290718.772711714 192.168.2.254 → 192.168.1.254 TCP 66 40826 → 80 [ACK] Seq=475 Ack=6747 Win=64128 Len=0 TSval=2121012220 TSecr=4279141659
   80 1612290723.773383971 192.168.1.254 → 192.168.2.254 TCP 66 80 → 40826 [FIN, ACK] Seq=6747 Ack=475 Win=64768 Len=0 TSval=4279146662 TSecr=2121012220
   81 1612290723.821505841 192.168.2.254 → 192.168.1.254 TCP 66 40826 → 80 [ACK] Seq=475 Ack=6748 Win=64128 Len=0 TSval=2121017269 TSecr=4279146662
   82 1612290724.706109378 192.168.2.254 → 192.168.1.254 TCP 66 40826 → 80 [FIN, ACK] Seq=475 Ack=6748 Win=64128 Len=0 TSval=2121018153 TSecr=4279146662
   83 1612290724.706153637 192.168.1.254 → 192.168.2.254 TCP 66 80 → 40826 [ACK] Seq=6748 Ack=476 Win=64768 Len=0 TSval=4279147595 TSecr=2121018153
   84 1612290724.706601841 192.168.2.254 → 192.168.1.254 TCP 74 40828 → 80 [SYN] Seq=0 Win=64240 Len=0 MSS=1460 SACK_PERM=1 TSval=2121018154 TSecr=0 WS=128
   85 1612290724.706649952 192.168.1.254 → 192.168.2.254 TCP 74 80 → 40828 [SYN, ACK] Seq=0 Ack=1 Win=65160 Len=0 MSS=1460 SACK_PERM=1 TSval=4279147595 TSecr=2121018154 WS=128
   86 1612290724.707100563 192.168.2.254 → 192.168.1.254 TCP 66 40828 → 80 [ACK] Seq=1 Ack=1 Win=64256 Len=0 TSval=2121018154 TSecr=4279147595
   87 1612290724.707963174 192.168.2.254 → 192.168.1.254 HTTP 540 GET /1.php HTTP/1.1 
   88 1612290724.708012896 192.168.1.254 → 192.168.2.254 TCP 66 80 → 40828 [ACK] Seq=1 Ack=475 Win=64768 Len=0 TSval=4279147596 TSecr=2121018155
   89 1612290724.710829896 192.168.1.254 → 192.168.2.254 TCP 1514 HTTP/1.1 200 OK  [TCP segment of a reassembled PDU]
   90 1612290724.710844415 192.168.1.254 → 192.168.2.254 TCP 1514 80 → 40828 [ACK] Seq=1449 Ack=475 Win=64768 Len=1448 TSval=4279147599 TSecr=2121018155 [TCP segment of a reassembled PDU]
   91 1612290724.710848766 192.168.1.254 → 192.168.2.254 TCP 1514 80 → 40828 [ACK] Seq=2897 Ack=475 Win=64768 Len=1448 TSval=4279147599 TSecr=2121018155 [TCP segment of a reassembled PDU]
   92 1612290724.710853174 192.168.1.254 → 192.168.2.254 TCP 1514 80 → 40828 [ACK] Seq=4345 Ack=475 Win=64768 Len=1448 TSval=4279147599 TSecr=2121018155 [TCP segment of a reassembled PDU]
   93 1612290724.710857285 192.168.1.254 → 192.168.2.254 HTTP 1046 HTTP/1.1 200 OK  (text/html)
   94 1612290724.712133952 192.168.2.254 → 192.168.1.254 TCP 66 40828 → 80 [ACK] Seq=475 Ack=1449 Win=64128 Len=0 TSval=2121018159 TSecr=4279147599
   95 1612290724.712186452 192.168.2.254 → 192.168.1.254 TCP 66 40828 → 80 [ACK] Seq=475 Ack=2897 Win=64128 Len=0 TSval=2121018159 TSecr=4279147599
   96 1612290724.712286044 192.168.2.254 → 192.168.1.254 TCP 66 40828 → 80 [ACK] Seq=475 Ack=4345 Win=64128 Len=0 TSval=2121018159 TSecr=4279147599
   97 1612290724.712317655 192.168.2.254 → 192.168.1.254 TCP 66 40828 → 80 [ACK] Seq=475 Ack=5793 Win=64128 Len=0 TSval=2121018159 TSecr=4279147599
   98 1612290724.712336878 192.168.2.254 → 192.168.1.254 TCP 66 40828 → 80 [ACK] Seq=475 Ack=6773 Win=64128 Len=0 TSval=2121018159 TSecr=4279147599
   99 1612290729.712754671 192.168.1.254 → 192.168.2.254 TCP 66 80 → 40828 [FIN, ACK] Seq=6773 Ack=475 Win=64768 Len=0 TSval=4279152601 TSecr=2121018159
  100 1612290729.761415949 192.168.2.254 → 192.168.1.254 TCP 66 40828 → 80 [ACK] Seq=475 Ack=6774 Win=64128 Len=0 TSval=2121023209 TSecr=4279152601
