    1 1612291022.370787274 192.168.2.254 → 192.168.1.254 TCP 66 40896 → 80 [ACK] Seq=1 Ack=1 Win=600 Len=0 TSval=2121315819 TSecr=4279399751
    2 1612291022.370839422 192.168.1.254 → 192.168.2.254 TCP 66 [TCP ACKed unseen segment] 80 → 40896 [ACK] Seq=1 Ack=2 Win=501 Len=0 TSval=4279445259 TSecr=2121270359
    3 1612291032.045752213 192.168.2.254 → 192.168.1.254 TCP 66 [TCP Previous segment not captured] 40896 → 80 [FIN, ACK] Seq=2 Ack=1 Win=600 Len=0 TSval=2121325494 TSecr=4279445259
    4 1612291032.045804824 192.168.1.254 → 192.168.2.254 TCP 66 [TCP ACKed unseen segment] 80 → 40896 [ACK] Seq=1 Ack=3 Win=501 Len=0 TSval=4279454934 TSecr=2121325494
    5 1612291032.046345731 192.168.2.254 → 192.168.1.254 TCP 74 40926 → 80 [SYN] Seq=0 Win=64240 Len=0 MSS=1460 SACK_PERM=1 TSval=2121325494 TSecr=0 WS=128
    6 1612291032.046380361 192.168.1.254 → 192.168.2.254 TCP 74 80 → 40926 [SYN, ACK] Seq=0 Ack=1 Win=65160 Len=0 MSS=1460 SACK_PERM=1 TSval=4279454935 TSecr=2121325494 WS=128
    7 1612291032.046830917 192.168.2.254 → 192.168.1.254 TCP 66 40926 → 80 [ACK] Seq=1 Ack=1 Win=64256 Len=0 TSval=2121325495 TSecr=4279454935
    8 1612291032.048230417 192.168.2.254 → 192.168.1.254 HTTP 540 GET /1.php HTTP/1.1 
    9 1612291032.048313083 192.168.1.254 → 192.168.2.254 TCP 66 80 → 40926 [ACK] Seq=1 Ack=475 Win=64768 Len=0 TSval=4279454937 TSecr=2121325496
   10 1612291032.051154398 192.168.1.254 → 192.168.2.254 TCP 1514 HTTP/1.1 200 OK  [TCP segment of a reassembled PDU]
   11 1612291032.051170102 192.168.1.254 → 192.168.2.254 TCP 1514 80 → 40926 [ACK] Seq=1449 Ack=475 Win=64768 Len=1448 TSval=4279454940 TSecr=2121325496 [TCP segment of a reassembled PDU]
   12 1612291032.051174306 192.168.1.254 → 192.168.2.254 TCP 1514 80 → 40926 [ACK] Seq=2897 Ack=475 Win=64768 Len=1448 TSval=4279454940 TSecr=2121325496 [TCP segment of a reassembled PDU]
   13 1612291032.051178861 192.168.1.254 → 192.168.2.254 TCP 1514 80 → 40926 [ACK] Seq=4345 Ack=475 Win=64768 Len=1448 TSval=4279454940 TSecr=2121325496 [TCP segment of a reassembled PDU]
   14 1612291032.051182731 192.168.1.254 → 192.168.2.254 HTTP 1059 HTTP/1.1 200 OK  (text/html)
   15 1612291032.052469880 192.168.2.254 → 192.168.1.254 TCP 66 40926 → 80 [ACK] Seq=475 Ack=1449 Win=64128 Len=0 TSval=2121325500 TSecr=4279454940
   16 1612291032.052511120 192.168.2.254 → 192.168.1.254 TCP 66 40926 → 80 [ACK] Seq=475 Ack=2897 Win=64128 Len=0 TSval=2121325500 TSecr=4279454940
   17 1612291032.052716676 192.168.2.254 → 192.168.1.254 TCP 66 40926 → 80 [ACK] Seq=475 Ack=4345 Win=64128 Len=0 TSval=2121325501 TSecr=4279454940
   18 1612291032.052745361 192.168.2.254 → 192.168.1.254 TCP 66 40926 → 80 [ACK] Seq=475 Ack=5793 Win=64128 Len=0 TSval=2121325501 TSecr=4279454940
   19 1612291032.052763528 192.168.2.254 → 192.168.1.254 TCP 66 40926 → 80 [ACK] Seq=475 Ack=6786 Win=64128 Len=0 TSval=2121325501 TSecr=4279454940
   20 1612291032.596255842 192.168.2.254 → 192.168.1.254 HTTP 540 GET /1.php HTTP/1.1 
   21 1612291032.596311027 192.168.1.254 → 192.168.2.254 TCP 66 80 → 40926 [ACK] Seq=6786 Ack=949 Win=64384 Len=0 TSval=4279455485 TSecr=2121326044
   22 1612291032.599182713 192.168.1.254 → 192.168.2.254 TCP 1514 HTTP/1.1 200 OK  [TCP segment of a reassembled PDU]
   23 1612291032.599199250 192.168.1.254 → 192.168.2.254 TCP 1514 80 → 40926 [ACK] Seq=8234 Ack=949 Win=64384 Len=1448 TSval=4279455488 TSecr=2121326044 [TCP segment of a reassembled PDU]
   24 1612291032.599203453 192.168.1.254 → 192.168.2.254 TCP 1514 80 → 40926 [ACK] Seq=9682 Ack=949 Win=64384 Len=1448 TSval=4279455488 TSecr=2121326044 [TCP segment of a reassembled PDU]
   25 1612291032.599208213 192.168.1.254 → 192.168.2.254 TCP 1514 80 → 40926 [ACK] Seq=11130 Ack=949 Win=64384 Len=1448 TSval=4279455488 TSecr=2121326044 [TCP segment of a reassembled PDU]
   26 1612291032.599212064 192.168.1.254 → 192.168.2.254 HTTP 1035 HTTP/1.1 200 OK  (text/html)
   27 1612291032.600693527 192.168.2.254 → 192.168.1.254 TCP 66 40926 → 80 [ACK] Seq=949 Ack=8234 Win=64128 Len=0 TSval=2121326048 TSecr=4279455488
   28 1612291032.600737509 192.168.2.254 → 192.168.1.254 TCP 66 40926 → 80 [ACK] Seq=949 Ack=9682 Win=64128 Len=0 TSval=2121326048 TSecr=4279455488
   29 1612291032.601023083 192.168.2.254 → 192.168.1.254 TCP 66 40926 → 80 [ACK] Seq=949 Ack=11130 Win=64128 Len=0 TSval=2121326049 TSecr=4279455488
   30 1612291032.601050657 192.168.2.254 → 192.168.1.254 TCP 66 40926 → 80 [ACK] Seq=949 Ack=12578 Win=64128 Len=0 TSval=2121326049 TSecr=4279455488
   31 1612291032.601095564 192.168.2.254 → 192.168.1.254 TCP 66 40926 → 80 [ACK] Seq=949 Ack=13547 Win=64128 Len=0 TSval=2121326049 TSecr=4279455488
   32 1612291033.127067916 192.168.2.254 → 192.168.1.254 HTTP 540 GET /1.php HTTP/1.1 
   33 1612291033.127121546 192.168.1.254 → 192.168.2.254 TCP 66 80 → 40926 [ACK] Seq=13547 Ack=1423 Win=64128 Len=0 TSval=4279456016 TSecr=2121326575
   34 1612291033.129908175 192.168.1.254 → 192.168.2.254 TCP 1514 HTTP/1.1 200 OK  [TCP segment of a reassembled PDU]
   35 1612291033.129922879 192.168.1.254 → 192.168.2.254 TCP 1514 80 → 40926 [ACK] Seq=14995 Ack=1423 Win=64128 Len=1448 TSval=4279456018 TSecr=2121326575 [TCP segment of a reassembled PDU]
   36 1612291033.129927120 192.168.1.254 → 192.168.2.254 TCP 1514 80 → 40926 [ACK] Seq=16443 Ack=1423 Win=64128 Len=1448 TSval=4279456018 TSecr=2121326575 [TCP segment of a reassembled PDU]
   37 1612291033.129931138 192.168.1.254 → 192.168.2.254 TCP 1514 80 → 40926 [ACK] Seq=17891 Ack=1423 Win=64128 Len=1448 TSval=4279456018 TSecr=2121326575 [TCP segment of a reassembled PDU]
   38 1612291033.129935194 192.168.1.254 → 192.168.2.254 HTTP 1045 HTTP/1.1 200 OK  (text/html)
   39 1612291033.131329934 192.168.2.254 → 192.168.1.254 TCP 66 40926 → 80 [ACK] Seq=1423 Ack=14995 Win=64128 Len=0 TSval=2121326579 TSecr=4279456018
   40 1612291033.131375453 192.168.2.254 → 192.168.1.254 TCP 66 40926 → 80 [ACK] Seq=1423 Ack=16443 Win=64128 Len=0 TSval=2121326579 TSecr=4279456018
   41 1612291033.131375546 192.168.2.254 → 192.168.1.254 TCP 66 40926 → 80 [ACK] Seq=1423 Ack=17891 Win=64128 Len=0 TSval=2121326579 TSecr=4279456018
   42 1612291033.131489805 192.168.2.254 → 192.168.1.254 TCP 66 40926 → 80 [ACK] Seq=1423 Ack=19339 Win=64128 Len=0 TSval=2121326579 TSecr=4279456018
   43 1612291033.131515453 192.168.2.254 → 192.168.1.254 TCP 66 40926 → 80 [ACK] Seq=1423 Ack=20318 Win=64128 Len=0 TSval=2121326579 TSecr=4279456018
   44 1612291035.145748915 192.168.2.254 → 192.168.1.254 HTTP 540 GET /1.php HTTP/1.1 
   45 1612291035.145799489 192.168.1.254 → 192.168.2.254 TCP 66 80 → 40926 [ACK] Seq=20318 Ack=1897 Win=64128 Len=0 TSval=4279458034 TSecr=2121328593
   46 1612291035.148536248 192.168.1.254 → 192.168.2.254 TCP 1514 HTTP/1.1 200 OK  [TCP segment of a reassembled PDU]
   47 1612291035.148552526 192.168.1.254 → 192.168.2.254 TCP 1514 80 → 40926 [ACK] Seq=21766 Ack=1897 Win=64128 Len=1448 TSval=4279458037 TSecr=2121328593 [TCP segment of a reassembled PDU]
   48 1612291035.148557415 192.168.1.254 → 192.168.2.254 TCP 1514 80 → 40926 [ACK] Seq=23214 Ack=1897 Win=64128 Len=1448 TSval=4279458037 TSecr=2121328593 [TCP segment of a reassembled PDU]
   49 1612291035.148561933 192.168.1.254 → 192.168.2.254 TCP 1514 80 → 40926 [ACK] Seq=24662 Ack=1897 Win=64128 Len=1448 TSval=4279458037 TSecr=2121328593 [TCP segment of a reassembled PDU]
   50 1612291035.148565878 192.168.1.254 → 192.168.2.254 HTTP 1045 HTTP/1.1 200 OK  (text/html)
   51 1612291035.150296193 192.168.2.254 → 192.168.1.254 TCP 66 40926 → 80 [ACK] Seq=1897 Ack=21766 Win=64128 Len=0 TSval=2121328598 TSecr=4279458037
   52 1612291035.150343618 192.168.2.254 → 192.168.1.254 TCP 66 40926 → 80 [ACK] Seq=1897 Ack=23214 Win=64128 Len=0 TSval=2121328598 TSecr=4279458037
   53 1612291035.150343711 192.168.2.254 → 192.168.1.254 TCP 66 40926 → 80 [ACK] Seq=1897 Ack=24662 Win=64128 Len=0 TSval=2121328598 TSecr=4279458037
   54 1612291035.150739359 192.168.2.254 → 192.168.1.254 TCP 66 40926 → 80 [ACK] Seq=1897 Ack=26110 Win=64128 Len=0 TSval=2121328598 TSecr=4279458037
   55 1612291035.150769933 192.168.2.254 → 192.168.1.254 TCP 66 40926 → 80 [ACK] Seq=1897 Ack=27089 Win=64128 Len=0 TSval=2121328599 TSecr=4279458037
   56 1612291035.739425174 192.168.2.254 → 192.168.1.254 HTTP 540 GET /1.php HTTP/1.1 
   57 1612291035.742254026 192.168.1.254 → 192.168.2.254 TCP 1514 HTTP/1.1 200 OK  [TCP segment of a reassembled PDU]
   58 1612291035.742270155 192.168.1.254 → 192.168.2.254 TCP 1514 80 → 40926 [ACK] Seq=28537 Ack=2371 Win=64128 Len=1448 TSval=4279458631 TSecr=2121329187 [TCP segment of a reassembled PDU]
   59 1612291035.742275081 192.168.1.254 → 192.168.2.254 TCP 1514 80 → 40926 [ACK] Seq=29985 Ack=2371 Win=64128 Len=1448 TSval=4279458631 TSecr=2121329187 [TCP segment of a reassembled PDU]
   60 1612291035.742279081 192.168.1.254 → 192.168.2.254 TCP 1514 80 → 40926 [ACK] Seq=31433 Ack=2371 Win=64128 Len=1448 TSval=4279458631 TSecr=2121329187 [TCP segment of a reassembled PDU]
   61 1612291035.742282859 192.168.1.254 → 192.168.2.254 HTTP 1034 HTTP/1.1 200 OK  (text/html)
   62 1612291035.743850396 192.168.2.254 → 192.168.1.254 TCP 66 40926 → 80 [ACK] Seq=2371 Ack=28537 Win=64128 Len=0 TSval=2121329191 TSecr=4279458631
   63 1612291035.743897933 192.168.2.254 → 192.168.1.254 TCP 66 40926 → 80 [ACK] Seq=2371 Ack=29985 Win=64128 Len=0 TSval=2121329192 TSecr=4279458631
   64 1612291035.743898026 192.168.2.254 → 192.168.1.254 TCP 66 40926 → 80 [ACK] Seq=2371 Ack=31433 Win=64128 Len=0 TSval=2121329192 TSecr=4279458631
   65 1612291035.744188118 192.168.2.254 → 192.168.1.254 TCP 66 40926 → 80 [ACK] Seq=2371 Ack=32881 Win=67072 Len=0 TSval=2121329192 TSecr=4279458631
   66 1612291035.744219581 192.168.2.254 → 192.168.1.254 TCP 66 40926 → 80 [ACK] Seq=2371 Ack=33849 Win=69888 Len=0 TSval=2121329192 TSecr=4279458631
   67 1612291036.196856525 192.168.2.254 → 192.168.1.254 HTTP 540 GET /1.php HTTP/1.1 
   68 1612291036.199581970 192.168.1.254 → 192.168.2.254 TCP 1514 HTTP/1.1 200 OK  [TCP segment of a reassembled PDU]
   69 1612291036.199597914 192.168.1.254 → 192.168.2.254 TCP 1514 80 → 40926 [ACK] Seq=35297 Ack=2845 Win=64128 Len=1448 TSval=4279459088 TSecr=2121329644 [TCP segment of a reassembled PDU]
   70 1612291036.199601970 192.168.1.254 → 192.168.2.254 TCP 1514 80 → 40926 [ACK] Seq=36745 Ack=2845 Win=64128 Len=1448 TSval=4279459088 TSecr=2121329644 [TCP segment of a reassembled PDU]
   71 1612291036.199606192 192.168.1.254 → 192.168.2.254 TCP 1514 80 → 40926 [ACK] Seq=38193 Ack=2845 Win=64128 Len=1448 TSval=4279459088 TSecr=2121329644 [TCP segment of a reassembled PDU]
   72 1612291036.199610322 192.168.1.254 → 192.168.2.254 HTTP 1054 HTTP/1.1 200 OK  (text/html)
   73 1612291036.201478322 192.168.2.254 → 192.168.1.254 TCP 66 40926 → 80 [ACK] Seq=2845 Ack=35297 Win=72832 Len=0 TSval=2121329649 TSecr=4279459088
   74 1612291036.201529303 192.168.2.254 → 192.168.1.254 TCP 66 40926 → 80 [ACK] Seq=2845 Ack=36745 Win=75776 Len=0 TSval=2121329649 TSecr=4279459088
   75 1612291036.201529377 192.168.2.254 → 192.168.1.254 TCP 66 40926 → 80 [ACK] Seq=2845 Ack=38193 Win=78592 Len=0 TSval=2121329649 TSecr=4279459088
   76 1612291036.201554099 192.168.2.254 → 192.168.1.254 TCP 66 40926 → 80 [ACK] Seq=2845 Ack=39641 Win=81536 Len=0 TSval=2121329649 TSecr=4279459088
   77 1612291036.201554192 192.168.2.254 → 192.168.1.254 TCP 66 40926 → 80 [ACK] Seq=2845 Ack=40629 Win=84480 Len=0 TSval=2121329649 TSecr=4279459088
   78 1612291036.825580747 192.168.2.254 → 192.168.1.254 HTTP 540 GET /1.php HTTP/1.1 
   79 1612291036.828454562 192.168.1.254 → 192.168.2.254 TCP 1514 HTTP/1.1 200 OK  [TCP segment of a reassembled PDU]
   80 1612291036.828471692 192.168.1.254 → 192.168.2.254 TCP 1514 80 → 40926 [ACK] Seq=42077 Ack=3319 Win=64128 Len=1448 TSval=4279459717 TSecr=2121330273 [TCP segment of a reassembled PDU]
   81 1612291036.828475858 192.168.1.254 → 192.168.2.254 TCP 1514 80 → 40926 [ACK] Seq=43525 Ack=3319 Win=64128 Len=1448 TSval=4279459717 TSecr=2121330273 [TCP segment of a reassembled PDU]
   82 1612291036.828479784 192.168.1.254 → 192.168.2.254 TCP 1514 80 → 40926 [ACK] Seq=44973 Ack=3319 Win=64128 Len=1448 TSval=4279459717 TSecr=2121330273 [TCP segment of a reassembled PDU]
   83 1612291036.828484210 192.168.1.254 → 192.168.2.254 HTTP 1039 HTTP/1.1 200 OK  (text/html)
   84 1612291036.829721803 192.168.2.254 → 192.168.1.254 TCP 66 40926 → 80 [ACK] Seq=3319 Ack=42077 Win=87296 Len=0 TSval=2121330277 TSecr=4279459717
   85 1612291036.829763747 192.168.2.254 → 192.168.1.254 TCP 66 40926 → 80 [ACK] Seq=3319 Ack=43525 Win=90240 Len=0 TSval=2121330278 TSecr=4279459717
   86 1612291036.829964525 192.168.2.254 → 192.168.1.254 TCP 66 40926 → 80 [ACK] Seq=3319 Ack=44973 Win=93056 Len=0 TSval=2121330278 TSecr=4279459717
   87 1612291036.829994284 192.168.2.254 → 192.168.1.254 TCP 66 40926 → 80 [ACK] Seq=3319 Ack=46421 Win=96000 Len=0 TSval=2121330278 TSecr=4279459717
   88 1612291036.830012525 192.168.2.254 → 192.168.1.254 TCP 66 40926 → 80 [ACK] Seq=3319 Ack=47394 Win=98944 Len=0 TSval=2121330278 TSecr=4279459717
   89 1612291037.320640247 192.168.2.254 → 192.168.1.254 HTTP 540 GET /1.php HTTP/1.1 
   90 1612291037.323456099 192.168.1.254 → 192.168.2.254 TCP 1514 HTTP/1.1 200 OK  [TCP segment of a reassembled PDU]
   91 1612291037.323471673 192.168.1.254 → 192.168.2.254 TCP 1514 80 → 40926 [ACK] Seq=48842 Ack=3793 Win=64128 Len=1448 TSval=4279460212 TSecr=2121330768 [TCP segment of a reassembled PDU]
   92 1612291037.323475839 192.168.1.254 → 192.168.2.254 TCP 1514 80 → 40926 [ACK] Seq=50290 Ack=3793 Win=64128 Len=1448 TSval=4279460212 TSecr=2121330768 [TCP segment of a reassembled PDU]
   93 1612291037.323479673 192.168.1.254 → 192.168.2.254 TCP 1514 80 → 40926 [ACK] Seq=51738 Ack=3793 Win=64128 Len=1448 TSval=4279460212 TSecr=2121330768 [TCP segment of a reassembled PDU]
   94 1612291037.323483395 192.168.1.254 → 192.168.2.254 HTTP 1047 HTTP/1.1 200 OK  (text/html)
   95 1612291037.325227025 192.168.2.254 → 192.168.1.254 TCP 66 40926 → 80 [ACK] Seq=3793 Ack=48842 Win=101760 Len=0 TSval=2121330773 TSecr=4279460212
   96 1612291037.325270654 192.168.2.254 → 192.168.1.254 TCP 66 40926 → 80 [ACK] Seq=3793 Ack=50290 Win=104704 Len=0 TSval=2121330773 TSecr=4279460212
   97 1612291037.325270747 192.168.2.254 → 192.168.1.254 TCP 66 40926 → 80 [ACK] Seq=3793 Ack=51738 Win=107648 Len=0 TSval=2121330773 TSecr=4279460212
   98 1612291037.325671136 192.168.2.254 → 192.168.1.254 TCP 66 40926 → 80 [ACK] Seq=3793 Ack=53186 Win=110464 Len=0 TSval=2121330773 TSecr=4279460212
   99 1612291037.325698376 192.168.2.254 → 192.168.1.254 TCP 66 40926 → 80 [ACK] Seq=3793 Ack=54167 Win=113408 Len=0 TSval=2121330774 TSecr=4279460212
  100 1612291038.015274191 192.168.2.254 → 192.168.1.254 HTTP 540 GET /1.php HTTP/1.1 
