    1 1612283592.468908129 192.168.102.148 → 192.168.9.100 TCP 66 44112 → 80 [ACK] Seq=1 Ack=1 Win=501 Len=0 TSval=2461621935 TSecr=2753145743
    2 1612283592.468966277 192.168.9.100 → 192.168.102.148 TCP 66 [TCP ACKed unseen segment] 80 → 44112 [ACK] Seq=1 Ack=2 Win=506 Len=0 TSval=2753190744 TSecr=2461576975
    3 1612283595.005999683 192.168.102.148 → 192.168.9.100 TCP 66 [TCP Previous segment not captured] 44112 → 80 [FIN, ACK] Seq=2 Ack=1 Win=501 Len=0 TSval=2461624472 TSecr=2753190744
    4 1612283595.006061701 192.168.9.100 → 192.168.102.148 TCP 66 [TCP ACKed unseen segment] 80 → 44112 [ACK] Seq=1 Ack=3 Win=506 Len=0 TSval=2753193282 TSecr=2461624472
    5 1612283595.006839998 192.168.102.148 → 192.168.9.100 TCP 74 44134 → 80 [SYN] Seq=0 Win=64240 Len=0 MSS=1460 SACK_PERM=1 TSval=2461624473 TSecr=0 WS=128
    6 1612283595.006886868 192.168.9.100 → 192.168.102.148 TCP 74 80 → 44134 [SYN, ACK] Seq=0 Ack=1 Win=65160 Len=0 MSS=1460 SACK_PERM=1 TSval=2753193282 TSecr=2461624473 WS=128
    7 1612283595.007410942 192.168.102.148 → 192.168.9.100 TCP 66 44134 → 80 [ACK] Seq=1 Ack=1 Win=64256 Len=0 TSval=2461624473 TSecr=2753193282
    8 1612283595.011506127 192.168.102.148 → 192.168.9.100 HTTP 547 GET /1.php HTTP/1.1 
    9 1612283595.011568831 192.168.9.100 → 192.168.102.148 TCP 66 80 → 44134 [ACK] Seq=1 Ack=482 Win=64768 Len=0 TSval=2753193287 TSecr=2461624475
   10 1612283595.014408942 192.168.9.100 → 192.168.102.148 TCP 1514 HTTP/1.1 200 OK  [TCP segment of a reassembled PDU]
   11 1612283595.014424164 192.168.9.100 → 192.168.102.148 TCP 1514 80 → 44134 [ACK] Seq=1449 Ack=482 Win=64768 Len=1448 TSval=2753193290 TSecr=2461624475 [TCP segment of a reassembled PDU]
   12 1612283595.014429442 192.168.9.100 → 192.168.102.148 TCP 1514 80 → 44134 [ACK] Seq=2897 Ack=482 Win=64768 Len=1448 TSval=2753193290 TSecr=2461624475 [TCP segment of a reassembled PDU]
   13 1612283595.014433498 192.168.9.100 → 192.168.102.148 TCP 1514 80 → 44134 [PSH, ACK] Seq=4345 Ack=482 Win=64768 Len=1448 TSval=2753193290 TSecr=2461624475 [TCP segment of a reassembled PDU]
   14 1612283595.014627794 192.168.9.100 → 192.168.102.148 HTTP 1034 HTTP/1.1 200 OK  (text/html)
   15 1612283595.016727553 192.168.102.148 → 192.168.9.100 TCP 66 44134 → 80 [ACK] Seq=482 Ack=1449 Win=64128 Len=0 TSval=2461624483 TSecr=2753193290
   16 1612283595.016764627 192.168.102.148 → 192.168.9.100 TCP 66 44134 → 80 [ACK] Seq=482 Ack=2897 Win=64128 Len=0 TSval=2461624483 TSecr=2753193290
   17 1612283595.016969109 192.168.102.148 → 192.168.9.100 TCP 66 44134 → 80 [ACK] Seq=482 Ack=4345 Win=64128 Len=0 TSval=2461624483 TSecr=2753193290
   18 1612283595.017011905 192.168.102.148 → 192.168.9.100 TCP 66 44134 → 80 [ACK] Seq=482 Ack=5793 Win=64128 Len=0 TSval=2461624483 TSecr=2753193290
   19 1612283595.017036090 192.168.102.148 → 192.168.9.100 TCP 66 44134 → 80 [ACK] Seq=482 Ack=6761 Win=64128 Len=0 TSval=2461624483 TSecr=2753193290
   20 1612283597.767568829 192.168.102.148 → 192.168.9.100 HTTP 547 GET /1.php HTTP/1.1 
   21 1612283597.767623589 192.168.9.100 → 192.168.102.148 TCP 66 80 → 44134 [ACK] Seq=6761 Ack=963 Win=64384 Len=0 TSval=2753196043 TSecr=2461627233
   22 1612283597.770556385 192.168.9.100 → 192.168.102.148 TCP 1514 HTTP/1.1 200 OK  [TCP segment of a reassembled PDU]
   23 1612283597.770573274 192.168.9.100 → 192.168.102.148 TCP 1514 80 → 44134 [ACK] Seq=8209 Ack=963 Win=64384 Len=1448 TSval=2753196046 TSecr=2461627233 [TCP segment of a reassembled PDU]
   24 1612283597.770578070 192.168.9.100 → 192.168.102.148 TCP 1514 80 → 44134 [ACK] Seq=9657 Ack=963 Win=64384 Len=1448 TSval=2753196046 TSecr=2461627233 [TCP segment of a reassembled PDU]
   25 1612283597.770582144 192.168.9.100 → 192.168.102.148 TCP 1514 80 → 44134 [ACK] Seq=11105 Ack=963 Win=64384 Len=1448 TSval=2753196046 TSecr=2461627233 [TCP segment of a reassembled PDU]
   26 1612283597.770586089 192.168.9.100 → 192.168.102.148 HTTP 1044 HTTP/1.1 200 OK  (text/html)
   27 1612283597.772695477 192.168.102.148 → 192.168.9.100 TCP 66 44134 → 80 [ACK] Seq=963 Ack=8209 Win=64128 Len=0 TSval=2461627238 TSecr=2753196046
   28 1612283597.772748144 192.168.102.148 → 192.168.9.100 TCP 66 44134 → 80 [ACK] Seq=963 Ack=9657 Win=64128 Len=0 TSval=2461627238 TSecr=2753196046
   29 1612283597.772748237 192.168.102.148 → 192.168.9.100 TCP 66 44134 → 80 [ACK] Seq=963 Ack=11105 Win=64128 Len=0 TSval=2461627239 TSecr=2753196046
   30 1612283597.772981126 192.168.102.148 → 192.168.9.100 TCP 66 44134 → 80 [ACK] Seq=963 Ack=12553 Win=64128 Len=0 TSval=2461627239 TSecr=2753196046
   31 1612283597.773024496 192.168.102.148 → 192.168.9.100 TCP 66 44134 → 80 [ACK] Seq=963 Ack=13531 Win=64128 Len=0 TSval=2461627239 TSecr=2753196046
   32 1612283600.497621272 192.168.102.148 → 192.168.9.100 HTTP 547 GET /1.php HTTP/1.1 
   33 1612283600.497674698 192.168.9.100 → 192.168.102.148 TCP 66 80 → 44134 [ACK] Seq=13531 Ack=1444 Win=64128 Len=0 TSval=2753198773 TSecr=2461629963
   34 1612283600.500483828 192.168.9.100 → 192.168.102.148 TCP 1514 HTTP/1.1 200 OK  [TCP segment of a reassembled PDU]
   35 1612283600.500498994 192.168.9.100 → 192.168.102.148 TCP 1514 80 → 44134 [ACK] Seq=14979 Ack=1444 Win=64128 Len=1448 TSval=2753198776 TSecr=2461629963 [TCP segment of a reassembled PDU]
   36 1612283600.500504031 192.168.9.100 → 192.168.102.148 TCP 1514 80 → 44134 [ACK] Seq=16427 Ack=1444 Win=64128 Len=1448 TSval=2753198776 TSecr=2461629963 [TCP segment of a reassembled PDU]
   37 1612283600.500508087 192.168.9.100 → 192.168.102.148 TCP 1514 80 → 44134 [ACK] Seq=17875 Ack=1444 Win=64128 Len=1448 TSval=2753198776 TSecr=2461629963 [TCP segment of a reassembled PDU]
   38 1612283600.500511957 192.168.9.100 → 192.168.102.148 HTTP 1057 HTTP/1.1 200 OK  (text/html)
   39 1612283600.501724642 192.168.102.148 → 192.168.9.100 TCP 66 44134 → 80 [ACK] Seq=1444 Ack=14979 Win=64128 Len=0 TSval=2461629968 TSecr=2753198776
   40 1612283600.501851605 192.168.102.148 → 192.168.9.100 TCP 66 44134 → 80 [ACK] Seq=1444 Ack=17875 Win=61312 Len=0 TSval=2461629968 TSecr=2753198776
   41 1612283600.501949976 192.168.102.148 → 192.168.9.100 TCP 66 44134 → 80 [ACK] Seq=1444 Ack=19323 Win=59904 Len=0 TSval=2461629968 TSecr=2753198776
   42 1612283600.502055179 192.168.102.148 → 192.168.9.100 TCP 66 44134 → 80 [ACK] Seq=1444 Ack=20314 Win=59008 Len=0 TSval=2461629968 TSecr=2753198776
   43 1612283605.505139751 192.168.9.100 → 192.168.102.148 TCP 66 80 → 44134 [FIN, ACK] Seq=20314 Ack=1444 Win=64128 Len=0 TSval=2753203781 TSecr=2461629968
   44 1612283605.548681121 192.168.102.148 → 192.168.9.100 TCP 66 44134 → 80 [ACK] Seq=1444 Ack=20315 Win=64128 Len=0 TSval=2461635015 TSecr=2753203781
   45 1612283628.411854033 192.168.102.148 → 192.168.9.100 TCP 74 44136 → 80 [SYN] Seq=0 Win=64240 Len=0 MSS=1460 SACK_PERM=1 TSval=2461657877 TSecr=0 WS=128
   46 1612283628.411920904 192.168.9.100 → 192.168.102.148 TCP 74 80 → 44136 [SYN, ACK] Seq=0 Ack=1 Win=65160 Len=0 MSS=1460 SACK_PERM=1 TSval=2753226687 TSecr=2461657877 WS=128
   47 1612283628.415501163 192.168.102.148 → 192.168.9.100 TCP 66 44136 → 80 [ACK] Seq=1 Ack=1 Win=64256 Len=0 TSval=2461657879 TSecr=2753226687
   48 1612283628.415586700 192.168.102.148 → 192.168.9.100 HTTP 547 GET /1.php HTTP/1.1 
   49 1612283628.415644237 192.168.9.100 → 192.168.102.148 TCP 66 80 → 44136 [ACK] Seq=1 Ack=482 Win=64768 Len=0 TSval=2753226691 TSecr=2461657880
   50 1612283628.418576181 192.168.9.100 → 192.168.102.148 TCP 1514 HTTP/1.1 200 OK  [TCP segment of a reassembled PDU]
   51 1612283628.418591978 192.168.9.100 → 192.168.102.148 TCP 1514 80 → 44136 [ACK] Seq=1449 Ack=482 Win=64768 Len=1448 TSval=2753226694 TSecr=2461657880 [TCP segment of a reassembled PDU]
   52 1612283628.418596478 192.168.9.100 → 192.168.102.148 TCP 1514 80 → 44136 [ACK] Seq=2897 Ack=482 Win=64768 Len=1448 TSval=2753226694 TSecr=2461657880 [TCP segment of a reassembled PDU]
   53 1612283628.418600552 192.168.9.100 → 192.168.102.148 TCP 1514 80 → 44136 [ACK] Seq=4345 Ack=482 Win=64768 Len=1448 TSval=2753226694 TSecr=2461657880 [TCP segment of a reassembled PDU]
   54 1612283628.418605385 192.168.9.100 → 192.168.102.148 HTTP 1027 HTTP/1.1 200 OK  (text/html)
   55 1612283628.419905552 192.168.102.148 → 192.168.9.100 TCP 66 44136 → 80 [ACK] Seq=482 Ack=1449 Win=64128 Len=0 TSval=2461657886 TSecr=2753226694
   56 1612283628.420197478 192.168.102.148 → 192.168.9.100 TCP 66 44136 → 80 [ACK] Seq=482 Ack=2897 Win=64128 Len=0 TSval=2461657886 TSecr=2753226694
   57 1612283628.420232107 192.168.102.148 → 192.168.9.100 TCP 66 44136 → 80 [ACK] Seq=482 Ack=4345 Win=64128 Len=0 TSval=2461657886 TSecr=2753226694
   58 1612283628.420256311 192.168.102.148 → 192.168.9.100 TCP 66 44136 → 80 [ACK] Seq=482 Ack=5793 Win=64128 Len=0 TSval=2461657886 TSecr=2753226694
   59 1612283628.420321867 192.168.102.148 → 192.168.9.100 TCP 66 44136 → 80 [ACK] Seq=482 Ack=6754 Win=64128 Len=0 TSval=2461657886 TSecr=2753226694
   60 1612283633.423841975 192.168.9.100 → 192.168.102.148 TCP 66 80 → 44136 [FIN, ACK] Seq=6754 Ack=482 Win=64768 Len=0 TSval=2753231699 TSecr=2461657886
   61 1612283633.468499030 192.168.102.148 → 192.168.9.100 TCP 66 44136 → 80 [ACK] Seq=482 Ack=6755 Win=64128 Len=0 TSval=2461662935 TSecr=2753231699
   62 1612283678.468605837 192.168.102.148 → 192.168.9.100 TCP 66 [TCP Keep-Alive] 44136 → 80 [ACK] Seq=481 Ack=6755 Win=64128 Len=0 TSval=2461707935 TSecr=2753231699
   63 1612283678.468664485 192.168.9.100 → 192.168.102.148 TCP 66 [TCP Keep-Alive ACK] 80 → 44136 [ACK] Seq=6755 Ack=482 Win=64768 Len=0 TSval=2753276744 TSecr=2461662935
   64 1612283701.824347045 192.168.102.148 → 192.168.9.100 TCP 66 44136 → 80 [FIN, ACK] Seq=482 Ack=6755 Win=64128 Len=0 TSval=2461731290 TSecr=2753276744
   65 1612283701.824401415 192.168.9.100 → 192.168.102.148 TCP 54 80 → 44136 [RST] Seq=6755 Win=0 Len=0
   66 1612283701.824920804 192.168.102.148 → 192.168.9.100 TCP 74 44138 → 80 [SYN] Seq=0 Win=64240 Len=0 MSS=1460 SACK_PERM=1 TSval=2461731291 TSecr=0 WS=128
   67 1612283701.824953508 192.168.9.100 → 192.168.102.148 TCP 74 80 → 44138 [SYN, ACK] Seq=0 Ack=1 Win=65160 Len=0 MSS=1460 SACK_PERM=1 TSval=2753300100 TSecr=2461731291 WS=128
   68 1612283701.825736193 192.168.102.148 → 192.168.9.100 TCP 66 44138 → 80 [ACK] Seq=1 Ack=1 Win=64256 Len=0 TSval=2461731292 TSecr=2753300100
   69 1612283701.826684489 192.168.102.148 → 192.168.9.100 HTTP 547 GET /1.php HTTP/1.1 
   70 1612283701.826733767 192.168.9.100 → 192.168.102.148 TCP 66 80 → 44138 [ACK] Seq=1 Ack=482 Win=64768 Len=0 TSval=2753300102 TSecr=2461731293
   71 1612283701.829635304 192.168.9.100 → 192.168.102.148 TCP 1514 HTTP/1.1 200 OK  [TCP segment of a reassembled PDU]
   72 1612283701.829650564 192.168.9.100 → 192.168.102.148 TCP 1514 80 → 44138 [ACK] Seq=1449 Ack=482 Win=64768 Len=1448 TSval=2753300105 TSecr=2461731293 [TCP segment of a reassembled PDU]
   73 1612283701.829654989 192.168.9.100 → 192.168.102.148 TCP 1514 80 → 44138 [ACK] Seq=2897 Ack=482 Win=64768 Len=1448 TSval=2753300105 TSecr=2461731293 [TCP segment of a reassembled PDU]
   74 1612283701.829658860 192.168.9.100 → 192.168.102.148 TCP 1514 80 → 44138 [ACK] Seq=4345 Ack=482 Win=64768 Len=1448 TSval=2753300105 TSecr=2461731293 [TCP segment of a reassembled PDU]
   75 1612283701.829662712 192.168.9.100 → 192.168.102.148 HTTP 1018 HTTP/1.1 200 OK  (text/html)
   76 1612283701.831518804 192.168.102.148 → 192.168.9.100 TCP 66 44138 → 80 [ACK] Seq=482 Ack=1449 Win=64128 Len=0 TSval=2461731297 TSecr=2753300105
   77 1612283701.831611823 192.168.102.148 → 192.168.9.100 TCP 66 44138 → 80 [ACK] Seq=482 Ack=2897 Win=64128 Len=0 TSval=2461731298 TSecr=2753300105
   78 1612283701.831611915 192.168.102.148 → 192.168.9.100 TCP 66 44138 → 80 [ACK] Seq=482 Ack=4345 Win=64128 Len=0 TSval=2461731298 TSecr=2753300105
   79 1612283701.831713730 192.168.102.148 → 192.168.9.100 TCP 66 44138 → 80 [ACK] Seq=482 Ack=5793 Win=64128 Len=0 TSval=2461731298 TSecr=2753300105
   80 1612283701.831753434 192.168.102.148 → 192.168.9.100 TCP 66 44138 → 80 [ACK] Seq=482 Ack=6745 Win=64128 Len=0 TSval=2461731298 TSecr=2753300105
   81 1612283706.833744061 192.168.9.100 → 192.168.102.148 TCP 66 80 → 44138 [FIN, ACK] Seq=6745 Ack=482 Win=64768 Len=0 TSval=2753305109 TSecr=2461731298
   82 1612283706.878377412 192.168.102.148 → 192.168.9.100 TCP 66 44138 → 80 [ACK] Seq=482 Ack=6746 Win=64128 Len=0 TSval=2461736345 TSecr=2753305109
   83 1612283712.645902761 192.168.102.148 → 192.168.9.100 TCP 66 44138 → 80 [FIN, ACK] Seq=482 Ack=6746 Win=64128 Len=0 TSval=2461742112 TSecr=2753305109
   84 1612283712.645968335 192.168.9.100 → 192.168.102.148 TCP 66 80 → 44138 [ACK] Seq=6746 Ack=483 Win=64768 Len=0 TSval=2753310921 TSecr=2461742112
   85 1612283712.646469205 192.168.102.148 → 192.168.9.100 TCP 74 44140 → 80 [SYN] Seq=0 Win=64240 Len=0 MSS=1460 SACK_PERM=1 TSval=2461742113 TSecr=0 WS=128
   86 1612283712.646502520 192.168.9.100 → 192.168.102.148 TCP 74 80 → 44140 [SYN, ACK] Seq=0 Ack=1 Win=65160 Len=0 MSS=1460 SACK_PERM=1 TSval=2753310922 TSecr=2461742113 WS=128
   87 1612283712.647288668 192.168.102.148 → 192.168.9.100 TCP 66 44140 → 80 [ACK] Seq=1 Ack=1 Win=64256 Len=0 TSval=2461742114 TSecr=2753310922
   88 1612283712.648304927 192.168.102.148 → 192.168.9.100 HTTP 547 GET /1.php HTTP/1.1 
   89 1612283712.648359557 192.168.9.100 → 192.168.102.148 TCP 66 80 → 44140 [ACK] Seq=1 Ack=482 Win=64768 Len=0 TSval=2753310924 TSecr=2461742114
   90 1612283712.651318761 192.168.9.100 → 192.168.102.148 TCP 1514 HTTP/1.1 200 OK  [TCP segment of a reassembled PDU]
   91 1612283712.651335390 192.168.9.100 → 192.168.102.148 TCP 1514 80 → 44140 [ACK] Seq=1449 Ack=482 Win=64768 Len=1448 TSval=2753310927 TSecr=2461742114 [TCP segment of a reassembled PDU]
   92 1612283712.651339835 192.168.9.100 → 192.168.102.148 TCP 1514 80 → 44140 [ACK] Seq=2897 Ack=482 Win=64768 Len=1448 TSval=2753310927 TSecr=2461742114 [TCP segment of a reassembled PDU]
   93 1612283712.651343779 192.168.9.100 → 192.168.102.148 TCP 1514 80 → 44140 [ACK] Seq=4345 Ack=482 Win=64768 Len=1448 TSval=2753310927 TSecr=2461742114 [TCP segment of a reassembled PDU]
   94 1612283712.651347853 192.168.9.100 → 192.168.102.148 HTTP 1038 HTTP/1.1 200 OK  (text/html)
   95 1612283712.652777779 192.168.102.148 → 192.168.9.100 TCP 66 44140 → 80 [ACK] Seq=482 Ack=1449 Win=64128 Len=0 TSval=2461742119 TSecr=2753310927
   96 1612283712.653066705 192.168.102.148 → 192.168.9.100 TCP 66 44140 → 80 [ACK] Seq=482 Ack=2897 Win=64128 Len=0 TSval=2461742119 TSecr=2753310927
   97 1612283712.653106520 192.168.102.148 → 192.168.9.100 TCP 66 44140 → 80 [ACK] Seq=482 Ack=4345 Win=64128 Len=0 TSval=2461742119 TSecr=2753310927
   98 1612283712.653150113 192.168.102.148 → 192.168.9.100 TCP 66 44140 → 80 [ACK] Seq=482 Ack=5793 Win=64128 Len=0 TSval=2461742119 TSecr=2753310927
   99 1612283712.653173539 192.168.102.148 → 192.168.9.100 TCP 66 44140 → 80 [ACK] Seq=482 Ack=6765 Win=64128 Len=0 TSval=2461742119 TSecr=2753310927
  100 1612283717.655133887 192.168.9.100 → 192.168.102.148 TCP 66 80 → 44140 [FIN, ACK] Seq=6765 Ack=482 Win=64768 Len=0 TSval=2753315931 TSecr=2461742119
