    1 1612290935.905193508 192.168.2.254 → 192.168.1.254 TCP 74 40896 → 80 [SYN] Seq=0 Win=64240 Len=0 MSS=1460 SACK_PERM=1 TSval=2121237534 TSecr=0 WS=128
    2 1612290935.905849291 192.168.1.254 → 192.168.2.254 TCP 74 80 → 40896 [SYN, ACK] Seq=0 Ack=1 Win=65160 Len=0 MSS=1460 SACK_PERM=1 TSval=4279366975 TSecr=2121237534 WS=128
    3 1612290935.906100854 192.168.2.254 → 192.168.1.254 TCP 66 40896 → 80 [ACK] Seq=1 Ack=1 Win=64256 Len=0 TSval=2121237535 TSecr=4279366975
    4 1612290935.907441326 192.168.2.254 → 192.168.1.254 HTTP 627 GET / HTTP/1.1 
    5 1612290935.908100130 192.168.1.254 → 192.168.2.254 TCP 66 80 → 40896 [ACK] Seq=1 Ack=562 Win=64640 Len=0 TSval=4279366977 TSecr=2121237536
    6 1612290935.909919457 192.168.1.254 → 192.168.2.254 TCP 1514 HTTP/1.1 200 OK  [TCP segment of a reassembled PDU]
    7 1612290935.910162375 192.168.2.254 → 192.168.1.254 TCP 66 40896 → 80 [ACK] Seq=562 Ack=1449 Win=64128 Len=0 TSval=2121237539 TSecr=4279366979
    8 1612290935.909935655 192.168.1.254 → 192.168.2.254 TCP 1514 80 → 40896 [ACK] Seq=1449 Ack=562 Win=64640 Len=1448 TSval=4279366979 TSecr=2121237536 [TCP segment of a reassembled PDU]
    9 1612290935.910276958 192.168.2.254 → 192.168.1.254 TCP 66 40896 → 80 [ACK] Seq=562 Ack=2897 Win=64128 Len=0 TSval=2121237539 TSecr=4279366979
   10 1612290935.909938936 192.168.1.254 → 192.168.2.254 HTTP 552 HTTP/1.1 200 OK  (text/html)
   11 1612290935.910324771 192.168.2.254 → 192.168.1.254 TCP 66 40896 → 80 [ACK] Seq=562 Ack=3383 Win=64128 Len=0 TSval=2121237539 TSecr=4279366979
   12 1612290937.052537285 192.168.2.254 → 192.168.1.254 HTTP 627 GET / HTTP/1.1 
   13 1612290937.053230047 192.168.1.254 → 192.168.2.254 TCP 66 80 → 40896 [ACK] Seq=3383 Ack=1123 Win=64128 Len=0 TSval=4279368123 TSecr=2121238682
   14 1612290937.054935520 192.168.1.254 → 192.168.2.254 TCP 1514 HTTP/1.1 200 OK  [TCP segment of a reassembled PDU]
   15 1612290937.055139739 192.168.2.254 → 192.168.1.254 TCP 66 40896 → 80 [ACK] Seq=1123 Ack=4831 Win=64128 Len=0 TSval=2121238684 TSecr=4279368124
   16 1612290937.055200677 192.168.1.254 → 192.168.2.254 TCP 1514 80 → 40896 [ACK] Seq=4831 Ack=1123 Win=64128 Len=1448 TSval=4279368124 TSecr=2121238682 [TCP segment of a reassembled PDU]
   17 1612290937.055328125 192.168.2.254 → 192.168.1.254 TCP 66 40896 → 80 [ACK] Seq=1123 Ack=6279 Win=64128 Len=0 TSval=2121238684 TSecr=4279368124
   18 1612290937.055204270 192.168.1.254 → 192.168.2.254 HTTP 551 HTTP/1.1 200 OK  (text/html)
   19 1612290937.055376510 192.168.2.254 → 192.168.1.254 TCP 66 40896 → 80 [ACK] Seq=1123 Ack=6764 Win=64128 Len=0 TSval=2121238684 TSecr=4279368124
   20 1612290939.772856269 192.168.2.254 → 192.168.1.254 HTTP 627 GET / HTTP/1.1 
   21 1612290939.773607833 192.168.1.254 → 192.168.2.254 TCP 66 80 → 40896 [ACK] Seq=6764 Ack=1684 Win=64128 Len=0 TSval=4279370843 TSecr=2121241402
   22 1612290939.775308671 192.168.1.254 → 192.168.2.254 TCP 1514 HTTP/1.1 200 OK  [TCP segment of a reassembled PDU]
   23 1612290939.775465650 192.168.2.254 → 192.168.1.254 TCP 66 40896 → 80 [ACK] Seq=1684 Ack=8212 Win=64128 Len=0 TSval=2121241404 TSecr=4279370844
   24 1612290939.775318723 192.168.1.254 → 192.168.2.254 TCP 1514 80 → 40896 [ACK] Seq=8212 Ack=1684 Win=64128 Len=1448 TSval=4279370844 TSecr=2121241402 [TCP segment of a reassembled PDU]
   25 1612290939.775535494 192.168.2.254 → 192.168.1.254 TCP 66 40896 → 80 [ACK] Seq=1684 Ack=9660 Win=64128 Len=0 TSval=2121241405 TSecr=4279370844
   26 1612290939.775322525 192.168.1.254 → 192.168.2.254 HTTP 551 HTTP/1.1 200 OK  (text/html)
   27 1612290939.775577526 192.168.2.254 → 192.168.1.254 TCP 66 40896 → 80 [ACK] Seq=1684 Ack=10145 Win=64128 Len=0 TSval=2121241405 TSecr=4279370844
   28 1612290942.500722302 192.168.2.254 → 192.168.1.254 HTTP 627 GET / HTTP/1.1 
   29 1612290942.501499544 192.168.1.254 → 192.168.2.254 TCP 66 80 → 40896 [ACK] Seq=10145 Ack=2245 Win=64128 Len=0 TSval=4279373571 TSecr=2121244130
   30 1612290942.503279392 192.168.1.254 → 192.168.2.254 TCP 1514 HTTP/1.1 200 OK  [TCP segment of a reassembled PDU]
   31 1612290942.503489549 192.168.2.254 → 192.168.1.254 TCP 66 40896 → 80 [ACK] Seq=2245 Ack=11593 Win=64128 Len=0 TSval=2121244132 TSecr=4279373572
   32 1612290942.503293194 192.168.1.254 → 192.168.2.254 TCP 1514 80 → 40896 [ACK] Seq=11593 Ack=2245 Win=64128 Len=1448 TSval=4279373572 TSecr=2121244130 [TCP segment of a reassembled PDU]
   33 1612290942.503607674 192.168.2.254 → 192.168.1.254 TCP 66 40896 → 80 [ACK] Seq=2245 Ack=13041 Win=64128 Len=0 TSval=2121244133 TSecr=4279373572
   34 1612290942.503296267 192.168.1.254 → 192.168.2.254 HTTP 551 HTTP/1.1 200 OK  (text/html)
   35 1612290942.503662518 192.168.2.254 → 192.168.1.254 TCP 66 40896 → 80 [ACK] Seq=2245 Ack=13526 Win=64128 Len=0 TSval=2121244133 TSecr=4279373572
   36 1612290943.785289427 192.168.2.254 → 192.168.1.254 HTTP 627 GET / HTTP/1.1 
   37 1612290943.787701672 192.168.1.254 → 192.168.2.254 TCP 1514 HTTP/1.1 200 OK  [TCP segment of a reassembled PDU]
   38 1612290943.787977402 192.168.2.254 → 192.168.1.254 TCP 66 40896 → 80 [ACK] Seq=2806 Ack=14974 Win=64128 Len=0 TSval=2121245417 TSecr=4279374857
   39 1612290943.787714381 192.168.1.254 → 192.168.2.254 TCP 1514 80 → 40896 [ACK] Seq=14974 Ack=2806 Win=64128 Len=1448 TSval=4279374857 TSecr=2121245414 [TCP segment of a reassembled PDU]
   40 1612290943.788191309 192.168.2.254 → 192.168.1.254 TCP 66 40896 → 80 [ACK] Seq=2806 Ack=16422 Win=64128 Len=0 TSval=2121245417 TSecr=4279374857
   41 1612290943.787717401 192.168.1.254 → 192.168.2.254 HTTP 551 HTTP/1.1 200 OK  (text/html)
   42 1612290943.788242924 192.168.2.254 → 192.168.1.254 TCP 66 40896 → 80 [ACK] Seq=2806 Ack=16907 Win=64128 Len=0 TSval=2121245417 TSecr=4279374857
   43 1612290945.149371585 192.168.2.254 → 192.168.1.254 HTTP 627 GET / HTTP/1.1 
   44 1612290945.151961122 192.168.1.254 → 192.168.2.254 TCP 1514 HTTP/1.1 200 OK  [TCP segment of a reassembled PDU]
   45 1612290945.152377321 192.168.2.254 → 192.168.1.254 TCP 66 40896 → 80 [ACK] Seq=3367 Ack=18355 Win=67072 Len=0 TSval=2121246781 TSecr=4279376221
   46 1612290945.151983518 192.168.1.254 → 192.168.2.254 TCP 1514 80 → 40896 [ACK] Seq=18355 Ack=3367 Win=64128 Len=1448 TSval=4279376221 TSecr=2121246778 [TCP segment of a reassembled PDU]
   47 1612290945.152548207 192.168.2.254 → 192.168.1.254 TCP 66 40896 → 80 [ACK] Seq=3367 Ack=19803 Win=69888 Len=0 TSval=2121246782 TSecr=4279376221
   48 1612290945.151987268 192.168.1.254 → 192.168.2.254 HTTP 551 HTTP/1.1 200 OK  (text/html)
   49 1612290945.152611436 192.168.2.254 → 192.168.1.254 TCP 66 40896 → 80 [ACK] Seq=3367 Ack=20288 Win=72832 Len=0 TSval=2121246782 TSecr=4279376221
   50 1612290946.353340392 192.168.2.254 → 192.168.1.254 HTTP 627 GET / HTTP/1.1 
   51 1612290946.355755085 192.168.1.254 → 192.168.2.254 TCP 1514 HTTP/1.1 200 OK  [TCP segment of a reassembled PDU]
   52 1612290946.356283524 192.168.2.254 → 192.168.1.254 TCP 66 40896 → 80 [ACK] Seq=3928 Ack=21736 Win=75776 Len=0 TSval=2121247985 TSecr=4279377425
   53 1612290946.355770710 192.168.1.254 → 192.168.2.254 TCP 1514 80 → 40896 [ACK] Seq=21736 Ack=3928 Win=64128 Len=1448 TSval=4279377425 TSecr=2121247982 [TCP segment of a reassembled PDU]
   54 1612290946.356398264 192.168.2.254 → 192.168.1.254 TCP 66 40896 → 80 [ACK] Seq=3928 Ack=23184 Win=76800 Len=0 TSval=2121247985 TSecr=4279377425
   55 1612290946.355774148 192.168.1.254 → 192.168.2.254 HTTP 551 HTTP/1.1 200 OK  (text/html)
   56 1612290946.356447483 192.168.2.254 → 192.168.1.254 TCP 66 40896 → 80 [ACK] Seq=3928 Ack=23669 Win=76800 Len=0 TSval=2121247986 TSecr=4279377425
   57 1612290947.724330743 192.168.2.254 → 192.168.1.254 HTTP 627 GET / HTTP/1.1 
   58 1612290947.726700436 192.168.1.254 → 192.168.2.254 TCP 1514 HTTP/1.1 200 OK  [TCP segment of a reassembled PDU]
   59 1612290947.726991791 192.168.2.254 → 192.168.1.254 TCP 66 40896 → 80 [ACK] Seq=4489 Ack=25117 Win=76800 Len=0 TSval=2121249356 TSecr=4279378796
   60 1612290947.727136739 192.168.1.254 → 192.168.2.254 TCP 1514 80 → 40896 [ACK] Seq=25117 Ack=4489 Win=64128 Len=1448 TSval=4279378796 TSecr=2121249353 [TCP segment of a reassembled PDU]
   61 1612290947.727325802 192.168.2.254 → 192.168.1.254 TCP 66 40896 → 80 [ACK] Seq=4489 Ack=26565 Win=76800 Len=0 TSval=2121249356 TSecr=4279378796
   62 1612290947.727142208 192.168.1.254 → 192.168.2.254 HTTP 551 HTTP/1.1 200 OK  (text/html)
   63 1612290947.727374865 192.168.2.254 → 192.168.1.254 TCP 66 40896 → 80 [ACK] Seq=4489 Ack=27050 Win=76416 Len=0 TSval=2121249356 TSecr=4279378796
   64 1612290951.151564537 192.168.2.254 → 192.168.1.254 HTTP 627 GET / HTTP/1.1 
   65 1612290951.154035845 192.168.1.254 → 192.168.2.254 TCP 1514 HTTP/1.1 200 OK  [TCP segment of a reassembled PDU]
   66 1612290951.154214804 192.168.2.254 → 192.168.1.254 TCP 66 40896 → 80 [ACK] Seq=5050 Ack=28498 Win=76800 Len=0 TSval=2121252783 TSecr=4279382223
   67 1612290951.154044074 192.168.1.254 → 192.168.2.254 TCP 1514 80 → 40896 [ACK] Seq=28498 Ack=5050 Win=64128 Len=1448 TSval=4279382223 TSecr=2121252781 [TCP segment of a reassembled PDU]
   68 1612290951.154274856 192.168.2.254 → 192.168.1.254 TCP 66 40896 → 80 [ACK] Seq=5050 Ack=29946 Win=76800 Len=0 TSval=2121252783 TSecr=4279382223
   69 1612290951.154046262 192.168.1.254 → 192.168.2.254 HTTP 551 HTTP/1.1 200 OK  (text/html)
   70 1612290951.154306419 192.168.2.254 → 192.168.1.254 TCP 66 40896 → 80 [ACK] Seq=5050 Ack=30431 Win=76800 Len=0 TSval=2121252783 TSecr=4279382223
   71 1612290952.545201922 192.168.2.254 → 192.168.1.254 HTTP 627 GET / HTTP/1.1 
   72 1612290952.547476927 192.168.1.254 → 192.168.2.254 TCP 1514 HTTP/1.1 200 OK  [TCP segment of a reassembled PDU]
   73 1612290952.547641667 192.168.2.254 → 192.168.1.254 TCP 66 40896 → 80 [ACK] Seq=5611 Ack=31879 Win=76800 Len=0 TSval=2121254177 TSecr=4279383616
   74 1612290952.547762449 192.168.1.254 → 192.168.2.254 TCP 1514 80 → 40896 [ACK] Seq=31879 Ack=5611 Win=64128 Len=1448 TSval=4279383616 TSecr=2121254174 [TCP segment of a reassembled PDU]
   75 1612290952.547909845 192.168.2.254 → 192.168.1.254 TCP 66 40896 → 80 [ACK] Seq=5611 Ack=33327 Win=76800 Len=0 TSval=2121254177 TSecr=4279383616
   76 1612290952.547765938 192.168.1.254 → 192.168.2.254 HTTP 551 HTTP/1.1 200 OK  (text/html)
   77 1612290952.547974689 192.168.2.254 → 192.168.1.254 TCP 66 40896 → 80 [ACK] Seq=5611 Ack=33812 Win=76800 Len=0 TSval=2121254177 TSecr=4279383616
   78 1612290953.819930637 192.168.2.254 → 192.168.1.254 HTTP 627 GET / HTTP/1.1 
   79 1612290953.822431164 192.168.1.254 → 192.168.2.254 TCP 1514 HTTP/1.1 200 OK  [TCP segment of a reassembled PDU]
   80 1612290953.822776529 192.168.2.254 → 192.168.1.254 TCP 66 40896 → 80 [ACK] Seq=6172 Ack=35260 Win=76800 Len=0 TSval=2121255452 TSecr=4279384891
   81 1612290953.822448820 192.168.1.254 → 192.168.2.254 TCP 1514 80 → 40896 [ACK] Seq=35260 Ack=6172 Win=64128 Len=1448 TSval=4279384891 TSecr=2121255449 [TCP segment of a reassembled PDU]
   82 1612290953.823103822 192.168.2.254 → 192.168.1.254 TCP 66 40896 → 80 [ACK] Seq=6172 Ack=36708 Win=76800 Len=0 TSval=2121255452 TSecr=4279384891
   83 1612290953.822452466 192.168.1.254 → 192.168.2.254 HTTP 551 HTTP/1.1 200 OK  (text/html)
   84 1612290953.823156166 192.168.2.254 → 192.168.1.254 TCP 66 40896 → 80 [ACK] Seq=6172 Ack=37193 Win=76800 Len=0 TSval=2121255452 TSecr=4279384891
   85 1612290956.805313847 192.168.2.254 → 192.168.1.254 HTTP 627 GET / HTTP/1.1 
   86 1612290956.807907863 192.168.1.254 → 192.168.2.254 TCP 1514 HTTP/1.1 200 OK  [TCP segment of a reassembled PDU]
   87 1612290956.808223541 192.168.2.254 → 192.168.1.254 TCP 66 40896 → 80 [ACK] Seq=6733 Ack=38641 Win=76800 Len=0 TSval=2121258437 TSecr=4279387877
   88 1612290956.807925207 192.168.1.254 → 192.168.2.254 TCP 1514 80 → 40896 [ACK] Seq=38641 Ack=6733 Win=64128 Len=1448 TSval=4279387877 TSecr=2121258434 [TCP segment of a reassembled PDU]
   89 1612290956.808336510 192.168.2.254 → 192.168.1.254 TCP 66 40896 → 80 [ACK] Seq=6733 Ack=40089 Win=76800 Len=0 TSval=2121258437 TSecr=4279387877
   90 1612290956.807928489 192.168.1.254 → 192.168.2.254 HTTP 551 HTTP/1.1 200 OK  (text/html)
   91 1612290956.808388646 192.168.2.254 → 192.168.1.254 TCP 66 40896 → 80 [ACK] Seq=6733 Ack=40574 Win=76800 Len=0 TSval=2121258437 TSecr=4279387877
   92 1612290958.334253168 192.168.2.254 → 192.168.1.254 HTTP 627 GET / HTTP/1.1 
   93 1612290958.336886456 192.168.1.254 → 192.168.2.254 TCP 1514 HTTP/1.1 200 OK  [TCP segment of a reassembled PDU]
   94 1612290958.337133800 192.168.2.254 → 192.168.1.254 TCP 66 40896 → 80 [ACK] Seq=7294 Ack=42022 Win=76800 Len=0 TSval=2121259966 TSecr=4279389406
   95 1612290958.336899685 192.168.1.254 → 192.168.2.254 TCP 1514 80 → 40896 [ACK] Seq=42022 Ack=7294 Win=64128 Len=1448 TSval=4279389406 TSecr=2121259963 [TCP segment of a reassembled PDU]
   96 1612290958.337223800 192.168.2.254 → 192.168.1.254 TCP 66 40896 → 80 [ACK] Seq=7294 Ack=43470 Win=76800 Len=0 TSval=2121259966 TSecr=4279389406
   97 1612290958.336902706 192.168.1.254 → 192.168.2.254 HTTP 551 HTTP/1.1 200 OK  (text/html)
   98 1612290958.337272603 192.168.2.254 → 192.168.1.254 TCP 66 40896 → 80 [ACK] Seq=7294 Ack=43955 Win=76800 Len=0 TSval=2121259966 TSecr=4279389406
   99 1612290959.896570903 192.168.2.254 → 192.168.1.254 HTTP 627 GET / HTTP/1.1 
  100 1612290959.898991273 192.168.1.254 → 192.168.2.254 TCP 1514 HTTP/1.1 200 OK  [TCP segment of a reassembled PDU]
