    1 1612290684.627158312 192.168.2.254 → 192.168.1.254 TCP 66 40800 → 80 [FIN, ACK] Seq=1 Ack=1 Win=501 Len=0 TSval=2120986256 TSecr=4279077554
    2 1612290684.627764147 192.168.1.254 → 192.168.2.254 TCP 66 80 → 40800 [ACK] Seq=1 Ack=2 Win=504 Len=0 TSval=4279115698 TSecr=2120986256
    3 1612290684.627799355 192.168.2.254 → 192.168.1.254 TCP 74 40822 → 80 [SYN] Seq=0 Win=64240 Len=0 MSS=1460 SACK_PERM=1 TSval=2120986257 TSecr=0 WS=128
    4 1612290684.628174616 192.168.1.254 → 192.168.2.254 TCP 74 80 → 40822 [SYN, ACK] Seq=0 Ack=1 Win=65160 Len=0 MSS=1460 SACK_PERM=1 TSval=4279115698 TSecr=2120986257 WS=128
    5 1612290684.628327169 192.168.2.254 → 192.168.1.254 TCP 66 40822 → 80 [ACK] Seq=1 Ack=1 Win=64256 Len=0 TSval=2120986257 TSecr=4279115698
    6 1612290684.631444364 192.168.2.254 → 192.168.1.254 HTTP 627 GET / HTTP/1.1 
    7 1612290684.632016084 192.168.1.254 → 192.168.2.254 TCP 66 80 → 40822 [ACK] Seq=1 Ack=562 Win=64640 Len=0 TSval=4279115702 TSecr=2120986260
    8 1612290684.633923172 192.168.1.254 → 192.168.2.254 TCP 1514 HTTP/1.1 200 OK  [TCP segment of a reassembled PDU]
    9 1612290684.634114422 192.168.2.254 → 192.168.1.254 TCP 66 40822 → 80 [ACK] Seq=562 Ack=1449 Win=64128 Len=0 TSval=2120986263 TSecr=4279115703
   10 1612290684.633938172 192.168.1.254 → 192.168.2.254 TCP 1514 80 → 40822 [ACK] Seq=1449 Ack=562 Win=64640 Len=1448 TSval=4279115703 TSecr=2120986260 [TCP segment of a reassembled PDU]
   11 1612290684.634216245 192.168.2.254 → 192.168.1.254 TCP 66 40822 → 80 [ACK] Seq=562 Ack=2897 Win=64128 Len=0 TSval=2120986263 TSecr=4279115703
   12 1612290684.633941401 192.168.1.254 → 192.168.2.254 HTTP 552 HTTP/1.1 200 OK  (text/html)
   13 1612290684.634261141 192.168.2.254 → 192.168.1.254 TCP 66 40822 → 80 [ACK] Seq=562 Ack=3383 Win=64128 Len=0 TSval=2120986263 TSecr=4279115703
   14 1612290689.481471810 192.168.2.254 → 192.168.1.254 HTTP 540 GET /1.php HTTP/1.1 
   15 1612290689.482201655 192.168.1.254 → 192.168.2.254 TCP 66 80 → 40822 [ACK] Seq=3383 Ack=1036 Win=64256 Len=0 TSval=4279120552 TSecr=2120991110
   16 1612290689.485500830 192.168.1.254 → 192.168.2.254 TCP 1514 HTTP/1.1 200 OK  [TCP segment of a reassembled PDU]
   17 1612290689.485852914 192.168.2.254 → 192.168.1.254 TCP 66 40822 → 80 [ACK] Seq=1036 Ack=4831 Win=64128 Len=0 TSval=2120991115 TSecr=4279120555
   18 1612290689.485509163 192.168.1.254 → 192.168.2.254 TCP 1514 80 → 40822 [ACK] Seq=4831 Ack=1036 Win=64256 Len=1448 TSval=4279120555 TSecr=2120991110 [TCP segment of a reassembled PDU]
   19 1612290689.486005831 192.168.2.254 → 192.168.1.254 TCP 66 40822 → 80 [ACK] Seq=1036 Ack=6279 Win=64128 Len=0 TSval=2120991115 TSecr=4279120555
   20 1612290689.486125102 192.168.1.254 → 192.168.2.254 TCP 1514 80 → 40822 [ACK] Seq=6279 Ack=1036 Win=64256 Len=1448 TSval=4279120555 TSecr=2120991110 [TCP segment of a reassembled PDU]
   21 1612290689.486304946 192.168.2.254 → 192.168.1.254 TCP 66 40822 → 80 [ACK] Seq=1036 Ack=7727 Win=64128 Len=0 TSval=2120991115 TSecr=4279120555
   22 1612290689.486133279 192.168.1.254 → 192.168.2.254 TCP 1514 80 → 40822 [ACK] Seq=7727 Ack=1036 Win=64256 Len=1448 TSval=4279120555 TSecr=2120991110 [TCP segment of a reassembled PDU]
   23 1612290689.486363332 192.168.2.254 → 192.168.1.254 TCP 66 40822 → 80 [ACK] Seq=1036 Ack=9175 Win=64128 Len=0 TSval=2120991115 TSecr=4279120555
   24 1612290689.486137758 192.168.1.254 → 192.168.2.254 HTTP 1027 HTTP/1.1 200 OK  (text/html)
   25 1612290689.486415571 192.168.2.254 → 192.168.1.254 TCP 66 40822 → 80 [ACK] Seq=1036 Ack=10136 Win=64128 Len=0 TSval=2120991115 TSecr=4279120555
   26 1612290693.641971831 192.168.2.254 → 192.168.1.254 HTTP 627 GET / HTTP/1.1 
   27 1612290693.642707353 192.168.1.254 → 192.168.2.254 TCP 66 80 → 40822 [ACK] Seq=10136 Ack=1597 Win=64128 Len=0 TSval=4279124713 TSecr=2120995271
   28 1612290693.644543504 192.168.1.254 → 192.168.2.254 TCP 1514 HTTP/1.1 200 OK  [TCP segment of a reassembled PDU]
   29 1612290693.644743504 192.168.2.254 → 192.168.1.254 TCP 66 40822 → 80 [ACK] Seq=1597 Ack=11584 Win=64128 Len=0 TSval=2120995274 TSecr=4279124714
   30 1612290693.644554910 192.168.1.254 → 192.168.2.254 TCP 1514 80 → 40822 [ACK] Seq=11584 Ack=1597 Win=64128 Len=1448 TSval=4279124714 TSecr=2120995271 [TCP segment of a reassembled PDU]
   31 1612290693.644880692 192.168.2.254 → 192.168.1.254 TCP 66 40822 → 80 [ACK] Seq=1597 Ack=13032 Win=64128 Len=0 TSval=2120995274 TSecr=4279124714
   32 1612290693.644558347 192.168.1.254 → 192.168.2.254 HTTP 551 HTTP/1.1 200 OK  (text/html)
   33 1612290693.644937932 192.168.2.254 → 192.168.1.254 TCP 66 40822 → 80 [ACK] Seq=1597 Ack=13517 Win=64128 Len=0 TSval=2120995274 TSecr=4279124714
   34 1612290696.115517518 192.168.2.254 → 192.168.1.254 HTTP 540 GET /1.php HTTP/1.1 
   35 1612290696.116203874 192.168.1.254 → 192.168.2.254 TCP 66 80 → 40822 [ACK] Seq=13517 Ack=2071 Win=64128 Len=0 TSval=4279127186 TSecr=2120997745
   36 1612290696.119740081 192.168.1.254 → 192.168.2.254 TCP 1514 HTTP/1.1 200 OK  [TCP segment of a reassembled PDU]
   37 1612290696.119976279 192.168.2.254 → 192.168.1.254 TCP 66 40822 → 80 [ACK] Seq=2071 Ack=14965 Win=64128 Len=0 TSval=2120997749 TSecr=4279127189
   38 1612290696.119746435 192.168.1.254 → 192.168.2.254 TCP 1514 80 → 40822 [ACK] Seq=14965 Ack=2071 Win=64128 Len=1448 TSval=4279127189 TSecr=2120997745 [TCP segment of a reassembled PDU]
   39 1612290696.120049560 192.168.2.254 → 192.168.1.254 TCP 66 40822 → 80 [ACK] Seq=2071 Ack=16413 Win=64128 Len=0 TSval=2120997749 TSecr=4279127189
   40 1612290696.119750914 192.168.1.254 → 192.168.2.254 TCP 1514 80 → 40822 [ACK] Seq=16413 Ack=2071 Win=64128 Len=1448 TSval=4279127189 TSecr=2120997745 [TCP segment of a reassembled PDU]
   41 1612290696.120114352 192.168.2.254 → 192.168.1.254 TCP 66 40822 → 80 [ACK] Seq=2071 Ack=17861 Win=64128 Len=0 TSval=2120997749 TSecr=4279127189
   42 1612290696.120177686 192.168.1.254 → 192.168.2.254 TCP 1514 80 → 40822 [ACK] Seq=17861 Ack=2071 Win=64128 Len=1448 TSval=4279127189 TSecr=2120997745 [TCP segment of a reassembled PDU]
   43 1612290696.120279978 192.168.2.254 → 192.168.1.254 TCP 66 40822 → 80 [ACK] Seq=2071 Ack=19309 Win=64128 Len=0 TSval=2120997749 TSecr=4279127189
   44 1612290696.120182634 192.168.1.254 → 192.168.2.254 HTTP 1022 HTTP/1.1 200 OK  (text/html)
   45 1612290696.120329092 192.168.2.254 → 192.168.1.254 TCP 66 40822 → 80 [ACK] Seq=2071 Ack=20265 Win=64128 Len=0 TSval=2120997749 TSecr=4279127189
   46 1612290701.124574927 192.168.1.254 → 192.168.2.254 TCP 66 80 → 40822 [FIN, ACK] Seq=20265 Ack=2071 Win=64128 Len=0 TSval=4279132195 TSecr=2120997749
   47 1612290701.169516596 192.168.2.254 → 192.168.1.254 TCP 66 40822 → 80 [ACK] Seq=2071 Ack=20266 Win=64128 Len=0 TSval=2121002799 TSecr=4279132195
   48 1612290701.990882148 192.168.2.254 → 192.168.1.254 TCP 66 40822 → 80 [FIN, ACK] Seq=2071 Ack=20266 Win=64128 Len=0 TSval=2121003620 TSecr=4279132195
   49 1612290701.991454701 192.168.1.254 → 192.168.2.254 TCP 66 80 → 40822 [ACK] Seq=20266 Ack=2072 Win=64128 Len=0 TSval=4279133062 TSecr=2121003620
   50 1612290701.991771577 192.168.2.254 → 192.168.1.254 TCP 74 40824 → 80 [SYN] Seq=0 Win=64240 Len=0 MSS=1460 SACK_PERM=1 TSval=2121003621 TSecr=0 WS=128
   51 1612290701.992255172 192.168.1.254 → 192.168.2.254 TCP 74 80 → 40824 [SYN, ACK] Seq=0 Ack=1 Win=65160 Len=0 MSS=1460 SACK_PERM=1 TSval=4279133062 TSecr=2121003621 WS=128
   52 1612290701.992573923 192.168.2.254 → 192.168.1.254 TCP 66 40824 → 80 [ACK] Seq=1 Ack=1 Win=64256 Len=0 TSval=2121003622 TSecr=4279133062
   53 1612290701.994032103 192.168.2.254 → 192.168.1.254 HTTP 627 GET / HTTP/1.1 
   54 1612290701.994677053 192.168.1.254 → 192.168.2.254 TCP 66 80 → 40824 [ACK] Seq=1 Ack=562 Win=64640 Len=0 TSval=4279133065 TSecr=2121003623
   55 1612290701.996481640 192.168.1.254 → 192.168.2.254 TCP 1514 HTTP/1.1 200 OK  [TCP segment of a reassembled PDU]
   56 1612290701.996721901 192.168.2.254 → 192.168.1.254 TCP 66 40824 → 80 [ACK] Seq=562 Ack=1449 Win=64128 Len=0 TSval=2121003626 TSecr=4279133066
   57 1612290701.996492995 192.168.1.254 → 192.168.2.254 TCP 1514 80 → 40824 [ACK] Seq=1449 Ack=562 Win=64640 Len=1448 TSval=4279133066 TSecr=2121003623 [TCP segment of a reassembled PDU]
   58 1612290701.996836068 192.168.2.254 → 192.168.1.254 TCP 66 40824 → 80 [ACK] Seq=562 Ack=2897 Win=64128 Len=0 TSval=2121003626 TSecr=4279133066
   59 1612290701.996498411 192.168.1.254 → 192.168.2.254 HTTP 552 HTTP/1.1 200 OK  (text/html)
   60 1612290701.996888933 192.168.2.254 → 192.168.1.254 TCP 66 40824 → 80 [ACK] Seq=562 Ack=3383 Win=64128 Len=0 TSval=2121003626 TSecr=4279133066
   61 1612290707.001262945 192.168.1.254 → 192.168.2.254 TCP 66 80 → 40824 [FIN, ACK] Seq=3383 Ack=562 Win=64640 Len=0 TSval=4279138071 TSecr=2121003626
   62 1612290707.049514987 192.168.2.254 → 192.168.1.254 TCP 66 40824 → 80 [ACK] Seq=562 Ack=3384 Win=64128 Len=0 TSval=2121008679 TSecr=4279138071
   63 1612290710.582487314 192.168.2.254 → 192.168.1.254 TCP 66 40824 → 80 [FIN, ACK] Seq=562 Ack=3384 Win=64128 Len=0 TSval=2121012212 TSecr=4279138071
   64 1612290710.583154764 192.168.1.254 → 192.168.2.254 TCP 66 80 → 40824 [ACK] Seq=3384 Ack=563 Win=64640 Len=0 TSval=4279141653 TSecr=2121012212
   65 1612290710.583494713 192.168.2.254 → 192.168.1.254 TCP 74 40826 → 80 [SYN] Seq=0 Win=64240 Len=0 MSS=1460 SACK_PERM=1 TSval=2121012213 TSecr=0 WS=128
   66 1612290710.584025495 192.168.1.254 → 192.168.2.254 TCP 74 80 → 40826 [SYN, ACK] Seq=0 Ack=1 Win=65160 Len=0 MSS=1460 SACK_PERM=1 TSval=4279141654 TSecr=2121012213 WS=128
   67 1612290710.584257579 192.168.2.254 → 192.168.1.254 TCP 66 40826 → 80 [ACK] Seq=1 Ack=1 Win=64256 Len=0 TSval=2121012213 TSecr=4279141654
   68 1612290710.585665968 192.168.2.254 → 192.168.1.254 HTTP 540 GET /1.php HTTP/1.1 
   69 1612290710.586264146 192.168.1.254 → 192.168.2.254 TCP 66 80 → 40826 [ACK] Seq=1 Ack=475 Win=64768 Len=0 TSval=4279141656 TSecr=2121012215
   70 1612290710.589776030 192.168.1.254 → 192.168.2.254 TCP 1514 HTTP/1.1 200 OK  [TCP segment of a reassembled PDU]
   71 1612290710.590160197 192.168.2.254 → 192.168.1.254 TCP 66 40826 → 80 [ACK] Seq=475 Ack=1449 Win=64128 Len=0 TSval=2121012219 TSecr=4279141659
   72 1612290710.589834155 192.168.1.254 → 192.168.2.254 TCP 1514 80 → 40826 [ACK] Seq=1449 Ack=475 Win=64768 Len=1448 TSval=4279141659 TSecr=2121012215 [TCP segment of a reassembled PDU]
   73 1612290710.590268635 192.168.2.254 → 192.168.1.254 TCP 66 40826 → 80 [ACK] Seq=475 Ack=2897 Win=64128 Len=0 TSval=2121012219 TSecr=4279141659
   74 1612290710.589837436 192.168.1.254 → 192.168.2.254 TCP 1514 80 → 40826 [ACK] Seq=2897 Ack=475 Win=64768 Len=1448 TSval=4279141659 TSecr=2121012215 [TCP segment of a reassembled PDU]
   75 1612290710.590326396 192.168.2.254 → 192.168.1.254 TCP 66 40826 → 80 [ACK] Seq=475 Ack=4345 Win=64128 Len=0 TSval=2121012219 TSecr=4279141659
   76 1612290710.589842176 192.168.1.254 → 192.168.2.254 TCP 1514 80 → 40826 [ACK] Seq=4345 Ack=475 Win=64768 Len=1448 TSval=4279141659 TSecr=2121012215 [TCP segment of a reassembled PDU]
   77 1612290710.590407385 192.168.2.254 → 192.168.1.254 TCP 66 40826 → 80 [ACK] Seq=475 Ack=5793 Win=64128 Len=0 TSval=2121012219 TSecr=4279141659
   78 1612290710.590458531 192.168.1.254 → 192.168.2.254 HTTP 1020 HTTP/1.1 200 OK  (text/html)
   79 1612290710.590693896 192.168.2.254 → 192.168.1.254 TCP 66 40826 → 80 [ACK] Seq=475 Ack=6747 Win=64128 Len=0 TSval=2121012220 TSecr=4279141659
   80 1612290715.591865817 192.168.1.254 → 192.168.2.254 TCP 66 80 → 40826 [FIN, ACK] Seq=6747 Ack=475 Win=64768 Len=0 TSval=4279146662 TSecr=2121012220
   81 1612290715.639495462 192.168.2.254 → 192.168.1.254 TCP 66 40826 → 80 [ACK] Seq=475 Ack=6748 Win=64128 Len=0 TSval=2121017269 TSecr=4279146662
   82 1612290716.524057102 192.168.2.254 → 192.168.1.254 TCP 66 40826 → 80 [FIN, ACK] Seq=475 Ack=6748 Win=64128 Len=0 TSval=2121018153 TSecr=4279146662
   83 1612290716.524609968 192.168.1.254 → 192.168.2.254 TCP 66 80 → 40826 [ACK] Seq=6748 Ack=476 Win=64768 Len=0 TSval=4279147595 TSecr=2121018153
   84 1612290716.524660437 192.168.2.254 → 192.168.1.254 TCP 74 40828 → 80 [SYN] Seq=0 Win=64240 Len=0 MSS=1460 SACK_PERM=1 TSval=2121018154 TSecr=0 WS=128
   85 1612290716.525055437 192.168.1.254 → 192.168.2.254 TCP 74 80 → 40828 [SYN, ACK] Seq=0 Ack=1 Win=65160 Len=0 MSS=1460 SACK_PERM=1 TSval=4279147595 TSecr=2121018154 WS=128
   86 1612290716.525184448 192.168.2.254 → 192.168.1.254 TCP 66 40828 → 80 [ACK] Seq=1 Ack=1 Win=64256 Len=0 TSval=2121018154 TSecr=4279147595
   87 1612290716.525920231 192.168.2.254 → 192.168.1.254 HTTP 540 GET /1.php HTTP/1.1 
   88 1612290716.526392576 192.168.1.254 → 192.168.2.254 TCP 66 80 → 40828 [ACK] Seq=1 Ack=475 Win=64768 Len=0 TSval=4279147596 TSecr=2121018155
   89 1612290716.529712688 192.168.1.254 → 192.168.2.254 TCP 1514 HTTP/1.1 200 OK  [TCP segment of a reassembled PDU]
   90 1612290716.529999616 192.168.2.254 → 192.168.1.254 TCP 66 40828 → 80 [ACK] Seq=475 Ack=1449 Win=64128 Len=0 TSval=2121018159 TSecr=4279147599
   91 1612290716.529716126 192.168.1.254 → 192.168.2.254 TCP 1514 80 → 40828 [ACK] Seq=1449 Ack=475 Win=64768 Len=1448 TSval=4279147599 TSecr=2121018155 [TCP segment of a reassembled PDU]
   92 1612290716.530104356 192.168.2.254 → 192.168.1.254 TCP 66 40828 → 80 [ACK] Seq=475 Ack=2897 Win=64128 Len=0 TSval=2121018159 TSecr=4279147599
   93 1612290716.530239148 192.168.1.254 → 192.168.2.254 TCP 1514 80 → 40828 [ACK] Seq=2897 Ack=475 Win=64768 Len=1448 TSval=4279147599 TSecr=2121018155 [TCP segment of a reassembled PDU]
   94 1612290716.530333263 192.168.2.254 → 192.168.1.254 TCP 66 40828 → 80 [ACK] Seq=475 Ack=4345 Win=64128 Len=0 TSval=2121018159 TSecr=4279147599
   95 1612290716.530244981 192.168.1.254 → 192.168.2.254 TCP 1514 80 → 40828 [ACK] Seq=4345 Ack=475 Win=64768 Len=1448 TSval=4279147599 TSecr=2121018155 [TCP segment of a reassembled PDU]
   96 1612290716.530358731 192.168.2.254 → 192.168.1.254 TCP 66 40828 → 80 [ACK] Seq=475 Ack=5793 Win=64128 Len=0 TSval=2121018159 TSecr=4279147599
   97 1612290716.530246960 192.168.1.254 → 192.168.2.254 HTTP 1046 HTTP/1.1 200 OK  (text/html)
   98 1612290716.530384148 192.168.2.254 → 192.168.1.254 TCP 66 40828 → 80 [ACK] Seq=475 Ack=6773 Win=64128 Len=0 TSval=2121018159 TSecr=4279147599
   99 1612290721.531231901 192.168.1.254 → 192.168.2.254 TCP 66 80 → 40828 [FIN, ACK] Seq=6773 Ack=475 Win=64768 Len=0 TSval=4279152601 TSecr=2121018159
  100 1612290721.579467954 192.168.2.254 → 192.168.1.254 TCP 66 40828 → 80 [ACK] Seq=475 Ack=6774 Win=64128 Len=0 TSval=2121023209 TSecr=4279152601
