    1 1612283584.269553445 192.168.2.254 → 192.168.102.153 TCP 66 44112 → 8000 [ACK] Seq=1 Ack=1 Win=501 Len=0 TSval=2461621935 TSecr=2753145743
    2 1612283584.270731156 192.168.102.153 → 192.168.2.254 TCP 66 [TCP ACKed unseen segment] 8000 → 44112 [ACK] Seq=1 Ack=2 Win=506 Len=0 TSval=2753190744 TSecr=2461576975
    3 1612283586.806786212 192.168.2.254 → 192.168.102.153 TCP 66 [TCP Previous segment not captured] 44112 → 8000 [FIN, ACK] Seq=2 Ack=1 Win=501 Len=0 TSval=2461624472 TSecr=2753190744
    4 1612283586.807610172 192.168.102.153 → 192.168.2.254 TCP 66 [TCP ACKed unseen segment] 8000 → 44112 [ACK] Seq=1 Ack=3 Win=506 Len=0 TSval=2753193282 TSecr=2461624472
    5 1612283586.807786162 192.168.2.254 → 192.168.102.153 TCP 74 44134 → 8000 [SYN] Seq=0 Win=64240 Len=0 MSS=1460 SACK_PERM=1 TSval=2461624473 TSecr=0 WS=128
    6 1612283586.808348715 192.168.102.153 → 192.168.2.254 TCP 74 8000 → 44134 [SYN, ACK] Seq=0 Ack=1 Win=65160 Len=0 MSS=1460 SACK_PERM=1 TSval=2753193282 TSecr=2461624473 WS=128
    7 1612283586.808445070 192.168.2.254 → 192.168.102.153 TCP 66 44134 → 8000 [ACK] Seq=1 Ack=1 Win=64256 Len=0 TSval=2461624473 TSecr=2753193282
    8 1612283586.809689448 192.168.2.254 → 192.168.102.153 HTTP 547 GET /1.php HTTP/1.1 
    9 1612283586.813114456 192.168.102.153 → 192.168.2.254 TCP 66 8000 → 44134 [ACK] Seq=1 Ack=482 Win=64768 Len=0 TSval=2753193287 TSecr=2461624475
   10 1612283586.817202487 192.168.102.153 → 192.168.2.254 TCP 1514 HTTP/1.1 200 OK  [TCP segment of a reassembled PDU]
   11 1612283586.817507696 192.168.2.254 → 192.168.102.153 TCP 66 44134 → 8000 [ACK] Seq=482 Ack=1449 Win=64128 Len=0 TSval=2461624483 TSecr=2753193290
   12 1612283586.817210976 192.168.102.153 → 192.168.2.254 TCP 1514 8000 → 44134 [ACK] Seq=1449 Ack=482 Win=64768 Len=1448 TSval=2753193290 TSecr=2461624475 [TCP segment of a reassembled PDU]
   13 1612283586.817613425 192.168.2.254 → 192.168.102.153 TCP 66 44134 → 8000 [ACK] Seq=482 Ack=2897 Win=64128 Len=0 TSval=2461624483 TSecr=2753193290
   14 1612283586.817764623 192.168.102.153 → 192.168.2.254 TCP 1514 8000 → 44134 [ACK] Seq=2897 Ack=482 Win=64768 Len=1448 TSval=2753193290 TSecr=2461624475 [TCP segment of a reassembled PDU]
   15 1612283586.817878946 192.168.2.254 → 192.168.102.153 TCP 66 44134 → 8000 [ACK] Seq=482 Ack=4345 Win=64128 Len=0 TSval=2461624483 TSecr=2753193290
   16 1612283586.817770040 192.168.102.153 → 192.168.2.254 TCP 1514 8000 → 44134 [PSH, ACK] Seq=4345 Ack=482 Win=64768 Len=1448 TSval=2753193290 TSecr=2461624475 [TCP segment of a reassembled PDU]
   17 1612283586.817938686 192.168.2.254 → 192.168.102.153 TCP 66 44134 → 8000 [ACK] Seq=482 Ack=5793 Win=64128 Len=0 TSval=2461624483 TSecr=2753193290
   18 1612283586.817774519 192.168.102.153 → 192.168.2.254 HTTP 1034 HTTP/1.1 200 OK  (text/html)
   19 1612283586.817987853 192.168.2.254 → 192.168.102.153 TCP 66 44134 → 8000 [ACK] Seq=482 Ack=6761 Win=64128 Len=0 TSval=2461624483 TSecr=2753193290
   20 1612283589.568137169 192.168.2.254 → 192.168.102.153 HTTP 547 GET /1.php HTTP/1.1 
   21 1612283589.569281859 192.168.102.153 → 192.168.2.254 TCP 66 8000 → 44134 [ACK] Seq=6761 Ack=963 Win=64384 Len=0 TSval=2753196043 TSecr=2461627233
   22 1612283589.572933586 192.168.102.153 → 192.168.2.254 TCP 1514 HTTP/1.1 200 OK  [TCP segment of a reassembled PDU]
   23 1612283589.573260410 192.168.2.254 → 192.168.102.153 TCP 66 44134 → 8000 [ACK] Seq=963 Ack=8209 Win=64128 Len=0 TSval=2461627238 TSecr=2753196046
   24 1612283589.572967284 192.168.102.153 → 192.168.2.254 TCP 1514 8000 → 44134 [ACK] Seq=8209 Ack=963 Win=64384 Len=1448 TSval=2753196046 TSecr=2461627233 [TCP segment of a reassembled PDU]
   25 1612283589.573417702 192.168.2.254 → 192.168.102.153 TCP 66 44134 → 8000 [ACK] Seq=963 Ack=9657 Win=64128 Len=0 TSval=2461627238 TSecr=2753196046
   26 1612283589.572971764 192.168.102.153 → 192.168.2.254 TCP 1514 8000 → 44134 [ACK] Seq=9657 Ack=963 Win=64384 Len=1448 TSval=2753196046 TSecr=2461627233 [TCP segment of a reassembled PDU]
   27 1612283589.573494004 192.168.2.254 → 192.168.102.153 TCP 66 44134 → 8000 [ACK] Seq=963 Ack=11105 Win=64128 Len=0 TSval=2461627239 TSecr=2753196046
   28 1612283589.573692442 192.168.102.153 → 192.168.2.254 TCP 1514 8000 → 44134 [ACK] Seq=11105 Ack=963 Win=64384 Len=1448 TSval=2753196046 TSecr=2461627233 [TCP segment of a reassembled PDU]
   29 1612283589.573917182 192.168.2.254 → 192.168.102.153 TCP 66 44134 → 8000 [ACK] Seq=963 Ack=12553 Win=64128 Len=0 TSval=2461627239 TSecr=2753196046
   30 1612283589.573701349 192.168.102.153 → 192.168.2.254 HTTP 1044 HTTP/1.1 200 OK  (text/html)
   31 1612283589.573979995 192.168.2.254 → 192.168.102.153 TCP 66 44134 → 8000 [ACK] Seq=963 Ack=13531 Win=64128 Len=0 TSval=2461627239 TSecr=2753196046
   32 1612283590.189547192 192.168.2.254 → 192.168.102.153 TCP 66 44110 → 8000 [FIN, ACK] Seq=1 Ack=1 Win=501 Len=0 TSval=2461627855 TSecr=2753114654
   33 1612283592.298095915 192.168.2.254 → 192.168.102.153 HTTP 547 GET /1.php HTTP/1.1 
   34 1612283592.299208991 192.168.102.153 → 192.168.2.254 TCP 66 8000 → 44134 [ACK] Seq=13531 Ack=1444 Win=64128 Len=0 TSval=2753198773 TSecr=2461629963
   35 1612283592.302592020 192.168.102.153 → 192.168.2.254 TCP 1514 HTTP/1.1 200 OK  [TCP segment of a reassembled PDU]
   36 1612283592.302747281 192.168.2.254 → 192.168.102.153 TCP 66 44134 → 8000 [ACK] Seq=1444 Ack=14979 Win=64128 Len=0 TSval=2461629968 TSecr=2753198776
   37 1612283592.302801656 192.168.102.153 → 192.168.2.254 TCP 1514 8000 → 44134 [ACK] Seq=14979 Ack=1444 Win=64128 Len=1448 TSval=2753198776 TSecr=2461629963 [TCP segment of a reassembled PDU]
   38 1612283592.302804625 192.168.102.153 → 192.168.2.254 TCP 1514 8000 → 44134 [ACK] Seq=16427 Ack=1444 Win=64128 Len=1448 TSval=2753198776 TSecr=2461629963 [TCP segment of a reassembled PDU]
   39 1612283592.302921135 192.168.2.254 → 192.168.102.153 TCP 66 44134 → 8000 [ACK] Seq=1444 Ack=17875 Win=61312 Len=0 TSval=2461629968 TSecr=2753198776
   40 1612283592.302931552 192.168.102.153 → 192.168.2.254 TCP 1514 8000 → 44134 [ACK] Seq=17875 Ack=1444 Win=64128 Len=1448 TSval=2753198776 TSecr=2461629963 [TCP segment of a reassembled PDU]
   41 1612283592.303022646 192.168.2.254 → 192.168.102.153 TCP 66 44134 → 8000 [ACK] Seq=1444 Ack=19323 Win=59904 Len=0 TSval=2461629968 TSecr=2753198776
   42 1612283592.303044625 192.168.102.153 → 192.168.2.254 HTTP 1057 HTTP/1.1 200 OK  (text/html)
   43 1612283592.303099313 192.168.2.254 → 192.168.102.153 TCP 66 44134 → 8000 [ACK] Seq=1444 Ack=20314 Win=59008 Len=0 TSval=2461629968 TSecr=2753198776
   44 1612283597.306834365 192.168.102.153 → 192.168.2.254 TCP 66 8000 → 44134 [FIN, ACK] Seq=20314 Ack=1444 Win=64128 Len=0 TSval=2753203781 TSecr=2461629968
   45 1612283597.349551185 192.168.2.254 → 192.168.102.153 TCP 66 44134 → 8000 [ACK] Seq=1444 Ack=20315 Win=64128 Len=0 TSval=2461635015 TSecr=2753203781
   46 1612283620.211711461 192.168.2.254 → 192.168.102.153 TCP 66 44134 → 8000 [FIN, ACK] Seq=1444 Ack=20315 Win=64128 Len=0 TSval=2461657877 TSecr=2753203781
   47 1612283620.212370108 192.168.2.254 → 192.168.102.153 TCP 74 44136 → 8000 [SYN] Seq=0 Win=64240 Len=0 MSS=1460 SACK_PERM=1 TSval=2461657877 TSecr=0 WS=128
   48 1612283620.213557871 192.168.102.153 → 192.168.2.254 TCP 74 8000 → 44136 [SYN, ACK] Seq=0 Ack=1 Win=65160 Len=0 MSS=1460 SACK_PERM=1 TSval=2753226687 TSecr=2461657877 WS=128
   49 1612283620.213812872 192.168.2.254 → 192.168.102.153 TCP 66 44136 → 8000 [ACK] Seq=1 Ack=1 Win=64256 Len=0 TSval=2461657879 TSecr=2753226687
   50 1612283620.214782718 192.168.2.254 → 192.168.102.153 HTTP 547 GET /1.php HTTP/1.1 
   51 1612283620.217201943 192.168.102.153 → 192.168.2.254 TCP 66 8000 → 44136 [ACK] Seq=1 Ack=482 Win=64768 Len=0 TSval=2753226691 TSecr=2461657880
   52 1612283620.220699295 192.168.102.153 → 192.168.2.254 TCP 1514 HTTP/1.1 200 OK  [TCP segment of a reassembled PDU]
   53 1612283620.220870858 192.168.2.254 → 192.168.102.153 TCP 66 44136 → 8000 [ACK] Seq=482 Ack=1449 Win=64128 Len=0 TSval=2461657886 TSecr=2753226694
   54 1612283620.221026900 192.168.102.153 → 192.168.2.254 TCP 1514 8000 → 44136 [ACK] Seq=1449 Ack=482 Win=64768 Len=1448 TSval=2753226694 TSecr=2461657880 [TCP segment of a reassembled PDU]
   55 1612283620.221191275 192.168.2.254 → 192.168.102.153 TCP 66 44136 → 8000 [ACK] Seq=482 Ack=2897 Win=64128 Len=0 TSval=2461657886 TSecr=2753226694
   56 1612283620.221031847 192.168.102.153 → 192.168.2.254 TCP 1514 8000 → 44136 [ACK] Seq=2897 Ack=482 Win=64768 Len=1448 TSval=2753226694 TSecr=2461657880 [TCP segment of a reassembled PDU]
   57 1612283620.221235598 192.168.2.254 → 192.168.102.153 TCP 66 44136 → 8000 [ACK] Seq=482 Ack=4345 Win=64128 Len=0 TSval=2461657886 TSecr=2753226694
   58 1612283620.221036327 192.168.102.153 → 192.168.2.254 TCP 1514 8000 → 44136 [ACK] Seq=4345 Ack=482 Win=64768 Len=1448 TSval=2753226694 TSecr=2461657880 [TCP segment of a reassembled PDU]
   59 1612283620.221284973 192.168.2.254 → 192.168.102.153 TCP 66 44136 → 8000 [ACK] Seq=482 Ack=5793 Win=64128 Len=0 TSval=2461657886 TSecr=2753226694
   60 1612283620.221321171 192.168.102.153 → 192.168.2.254 HTTP 1027 HTTP/1.1 200 OK  (text/html)
   61 1612283620.221408984 192.168.2.254 → 192.168.102.153 TCP 66 44136 → 8000 [ACK] Seq=482 Ack=6754 Win=64128 Len=0 TSval=2461657886 TSecr=2753226694
   62 1612283620.429543699 192.168.2.254 → 192.168.102.153 TCP 66 [TCP Retransmission] 44134 → 8000 [FIN, ACK] Seq=1444 Ack=20315 Win=64128 Len=0 TSval=2461658095 TSecr=2753203781
   63 1612283620.649623859 192.168.2.254 → 192.168.102.153 TCP 66 [TCP Retransmission] 44134 → 8000 [FIN, ACK] Seq=1444 Ack=20315 Win=64128 Len=0 TSval=2461658315 TSecr=2753203781
   64 1612283621.079602384 192.168.2.254 → 192.168.102.153 TCP 66 [TCP Retransmission] 44134 → 8000 [FIN, ACK] Seq=1444 Ack=20315 Win=64128 Len=0 TSval=2461658745 TSecr=2753203781
   65 1612283621.949522270 192.168.2.254 → 192.168.102.153 TCP 66 [TCP Retransmission] 44134 → 8000 [FIN, ACK] Seq=1444 Ack=20315 Win=64128 Len=0 TSval=2461659615 TSecr=2753203781
   66 1612283623.709517715 192.168.2.254 → 192.168.102.153 TCP 66 [TCP Retransmission] 44134 → 8000 [FIN, ACK] Seq=1444 Ack=20315 Win=64128 Len=0 TSval=2461661375 TSecr=2753203781
   67 1612283625.225550703 192.168.102.153 → 192.168.2.254 TCP 66 8000 → 44136 [FIN, ACK] Seq=6754 Ack=482 Win=64768 Len=0 TSval=2753231699 TSecr=2461657886
   68 1612283625.269486433 192.168.2.254 → 192.168.102.153 TCP 66 44136 → 8000 [ACK] Seq=482 Ack=6755 Win=64128 Len=0 TSval=2461662935 TSecr=2753231699
   69 1612283627.149528623 192.168.2.254 → 192.168.102.153 TCP 66 [TCP Retransmission] 44134 → 8000 [FIN, ACK] Seq=1444 Ack=20315 Win=64128 Len=0 TSval=2461664815 TSecr=2753203781
   70 1612283634.349528232 192.168.2.254 → 192.168.102.153 TCP 66 [TCP Retransmission] 44134 → 8000 [FIN, ACK] Seq=1444 Ack=20315 Win=64128 Len=0 TSval=2461672015 TSecr=2753203781
   71 1612283648.429513616 192.168.2.254 → 192.168.102.153 TCP 66 [TCP Retransmission] 44134 → 8000 [FIN, ACK] Seq=1444 Ack=20315 Win=64128 Len=0 TSval=2461686095 TSecr=2753203781
   72 1612283670.269501456 192.168.2.254 → 192.168.102.153 TCP 66 [TCP Keep-Alive] 44136 → 8000 [ACK] Seq=481 Ack=6755 Win=64128 Len=0 TSval=2461707935 TSecr=2753231699
   73 1612283670.270290312 192.168.102.153 → 192.168.2.254 TCP 66 [TCP Keep-Alive ACK] 8000 → 44136 [ACK] Seq=6755 Ack=482 Win=64768 Len=0 TSval=2753276744 TSecr=2461662935
   74 1612283673.063737178 b8:27:eb:50:08:2f → ff:ff:ff:ff:ff:ff ARP 42 Gratuitous ARP for 192.168.2.254 (Request)
   75 1612283675.066042368 b8:27:eb:50:08:2f → ff:ff:ff:ff:ff:ff ARP 42 Gratuitous ARP for 192.168.2.254 (Request)
   76 1612283675.949518953 192.168.2.254 → 192.168.102.153 TCP 66 [TCP Retransmission] 44134 → 8000 [FIN, ACK] Seq=1444 Ack=20315 Win=64128 Len=0 TSval=2461713615 TSecr=2753203781
   77 1612283693.625292699 192.168.2.254 → 192.168.102.153 TCP 66 44136 → 8000 [FIN, ACK] Seq=482 Ack=6755 Win=64128 Len=0 TSval=2461731290 TSecr=2753276744
   78 1612283693.625987701 192.168.2.254 → 192.168.102.153 TCP 74 44138 → 8000 [SYN] Seq=0 Win=64240 Len=0 MSS=1460 SACK_PERM=1 TSval=2461731291 TSecr=0 WS=128
   79 1612283693.626165149 192.168.102.153 → 192.168.2.254 TCP 60 8000 → 44136 [RST] Seq=6755 Win=0 Len=0
   80 1612283693.626645255 192.168.102.153 → 192.168.2.254 TCP 74 8000 → 44138 [SYN, ACK] Seq=0 Ack=1 Win=65160 Len=0 MSS=1460 SACK_PERM=1 TSval=2753300100 TSecr=2461731291 WS=128
   81 1612283693.626862755 192.168.2.254 → 192.168.102.153 TCP 66 44138 → 8000 [ACK] Seq=1 Ack=1 Win=64256 Len=0 TSval=2461731292 TSecr=2753300100
   82 1612283693.627662601 192.168.2.254 → 192.168.102.153 HTTP 547 GET /1.php HTTP/1.1 
   83 1612283693.628374217 192.168.102.153 → 192.168.2.254 TCP 66 8000 → 44138 [ACK] Seq=1 Ack=482 Win=64768 Len=0 TSval=2753300102 TSecr=2461731293
   84 1612283693.632162039 192.168.102.153 → 192.168.2.254 TCP 1514 HTTP/1.1 200 OK  [TCP segment of a reassembled PDU]
   85 1612283693.632521467 192.168.2.254 → 192.168.102.153 TCP 66 44138 → 8000 [ACK] Seq=482 Ack=1449 Win=64128 Len=0 TSval=2461731297 TSecr=2753300105
   86 1612283693.632224174 192.168.102.153 → 192.168.2.254 TCP 1514 8000 → 44138 [ACK] Seq=1449 Ack=482 Win=64768 Len=1448 TSval=2753300105 TSecr=2461731293 [TCP segment of a reassembled PDU]
   87 1612283693.632632613 192.168.2.254 → 192.168.102.153 TCP 66 44138 → 8000 [ACK] Seq=482 Ack=2897 Win=64128 Len=0 TSval=2461731298 TSecr=2753300105
   88 1612283693.632227664 192.168.102.153 → 192.168.2.254 TCP 1514 8000 → 44138 [ACK] Seq=2897 Ack=482 Win=64768 Len=1448 TSval=2753300105 TSecr=2461731293 [TCP segment of a reassembled PDU]
   89 1612283693.632678134 192.168.2.254 → 192.168.102.153 TCP 66 44138 → 8000 [ACK] Seq=482 Ack=4345 Win=64128 Len=0 TSval=2461731298 TSecr=2753300105
   90 1612283693.632727300 192.168.102.153 → 192.168.2.254 TCP 1514 8000 → 44138 [ACK] Seq=4345 Ack=482 Win=64768 Len=1448 TSval=2753300105 TSecr=2461731293 [TCP segment of a reassembled PDU]
   91 1612283693.632869228 192.168.2.254 → 192.168.102.153 TCP 66 44138 → 8000 [ACK] Seq=482 Ack=5793 Win=64128 Len=0 TSval=2461731298 TSecr=2753300105
   92 1612283693.632735321 192.168.102.153 → 192.168.2.254 HTTP 1018 HTTP/1.1 200 OK  (text/html)
   93 1612283693.632917613 192.168.2.254 → 192.168.102.153 TCP 66 44138 → 8000 [ACK] Seq=482 Ack=6745 Win=64128 Len=0 TSval=2461731298 TSecr=2753300105
   94 1612283698.635568600 192.168.102.153 → 192.168.2.254 TCP 66 8000 → 44138 [FIN, ACK] Seq=6745 Ack=482 Win=64768 Len=0 TSval=2753305109 TSecr=2461731298
   95 1612283698.679488549 192.168.2.254 → 192.168.102.153 TCP 66 44138 → 8000 [ACK] Seq=482 Ack=6746 Win=64128 Len=0 TSval=2461736345 TSecr=2753305109
   96 1612283704.446861254 192.168.2.254 → 192.168.102.153 TCP 66 44138 → 8000 [FIN, ACK] Seq=482 Ack=6746 Win=64128 Len=0 TSval=2461742112 TSecr=2753305109
   97 1612283704.447565943 192.168.2.254 → 192.168.102.153 TCP 74 44140 → 8000 [SYN] Seq=0 Win=64240 Len=0 MSS=1460 SACK_PERM=1 TSval=2461742113 TSecr=0 WS=128
   98 1612283704.447735267 192.168.102.153 → 192.168.2.254 TCP 66 8000 → 44138 [ACK] Seq=6746 Ack=483 Win=64768 Len=0 TSval=2753310921 TSecr=2461742112
   99 1612283704.448364539 192.168.102.153 → 192.168.2.254 TCP 74 8000 → 44140 [SYN, ACK] Seq=0 Ack=1 Win=65160 Len=0 MSS=1460 SACK_PERM=1 TSval=2753310922 TSecr=2461742113 WS=128
  100 1612283704.448496675 192.168.2.254 → 192.168.102.153 TCP 66 44140 → 8000 [ACK] Seq=1 Ack=1 Win=64256 Len=0 TSval=2461742114 TSecr=2753310922
