    1 1612291809.468512153 192.168.2.254 → 192.168.1.254 TCP 74 41006 → 80 [SYN] Seq=0 Win=64240 Len=0 MSS=1460 SACK_PERM=1 TSval=2122102918 TSecr=0 WS=128
    2 1612291809.469201109 192.168.1.254 → 192.168.2.254 TCP 74 80 → 41006 [SYN, ACK] Seq=0 Ack=1 Win=65160 Len=0 MSS=1460 SACK_PERM=1 TSval=4280232357 TSecr=2122102918 WS=128
    3 1612291809.469561888 192.168.2.254 → 192.168.1.254 TCP 66 41006 → 80 [ACK] Seq=1 Ack=1 Win=64256 Len=0 TSval=2122102919 TSecr=4280232357
    4 1612291809.471026413 192.168.2.254 → 192.168.1.254 HTTP 540 GET /1.php HTTP/1.1 
    5 1612291809.471867607 192.168.1.254 → 192.168.2.254 TCP 66 80 → 41006 [ACK] Seq=1 Ack=475 Win=64768 Len=0 TSval=4280232360 TSecr=2122102921
    6 1612291809.475702901 192.168.1.254 → 192.168.2.254 TCP 1514 HTTP/1.1 200 OK  [TCP segment of a reassembled PDU]
    7 1612291809.476047067 192.168.2.254 → 192.168.1.254 TCP 66 41006 → 80 [ACK] Seq=475 Ack=1449 Win=64128 Len=0 TSval=2122102926 TSecr=4280232363
    8 1612291809.475715766 192.168.1.254 → 192.168.2.254 TCP 1514 80 → 41006 [ACK] Seq=1449 Ack=475 Win=64768 Len=1448 TSval=4280232363 TSecr=2122102921 [TCP segment of a reassembled PDU]
    9 1612291809.476207066 192.168.2.254 → 192.168.1.254 TCP 66 41006 → 80 [ACK] Seq=475 Ack=2897 Win=64128 Len=0 TSval=2122102926 TSecr=4280232363
   10 1612291809.475719203 192.168.1.254 → 192.168.2.254 TCP 1514 80 → 41006 [ACK] Seq=2897 Ack=475 Win=64768 Len=1448 TSval=4280232363 TSecr=2122102921 [TCP segment of a reassembled PDU]
   11 1612291809.476265243 192.168.2.254 → 192.168.1.254 TCP 66 41006 → 80 [ACK] Seq=475 Ack=4345 Win=64128 Len=0 TSval=2122102926 TSecr=4280232363
   12 1612291809.476491908 192.168.1.254 → 192.168.2.254 TCP 1514 80 → 41006 [ACK] Seq=4345 Ack=475 Win=64768 Len=1448 TSval=4280232363 TSecr=2122102921 [TCP segment of a reassembled PDU]
   13 1612291809.476687689 192.168.2.254 → 192.168.1.254 TCP 66 41006 → 80 [ACK] Seq=475 Ack=5793 Win=64128 Len=0 TSval=2122102926 TSecr=4280232363
   14 1612291809.476500814 192.168.1.254 → 192.168.2.254 HTTP 1027 HTTP/1.1 200 OK  (text/html)
   15 1612291809.476755813 192.168.2.254 → 192.168.1.254 TCP 66 41006 → 80 [ACK] Seq=475 Ack=6754 Win=64128 Len=0 TSval=2122102926 TSecr=4280232363
   16 1612291812.318876349 192.168.2.254 → 192.168.1.254 HTTP 540 GET /1.php HTTP/1.1 
   17 1612291812.319587596 192.168.1.254 → 192.168.2.254 TCP 66 80 → 41006 [ACK] Seq=6754 Ack=949 Win=64384 Len=0 TSval=4280235207 TSecr=2122105768
   18 1612291812.322813050 192.168.1.254 → 192.168.2.254 TCP 1514 HTTP/1.1 200 OK  [TCP segment of a reassembled PDU]
   19 1612291812.323004195 192.168.2.254 → 192.168.1.254 TCP 66 41006 → 80 [ACK] Seq=949 Ack=8202 Win=64128 Len=0 TSval=2122105773 TSecr=4280235210
   20 1612291812.322819664 192.168.1.254 → 192.168.2.254 TCP 1514 80 → 41006 [ACK] Seq=8202 Ack=949 Win=64384 Len=1448 TSval=4280235210 TSecr=2122105768 [TCP segment of a reassembled PDU]
   21 1612291812.323107996 192.168.2.254 → 192.168.1.254 TCP 66 41006 → 80 [ACK] Seq=949 Ack=9650 Win=64128 Len=0 TSval=2122105773 TSecr=4280235210
   22 1612291812.323232162 192.168.1.254 → 192.168.2.254 TCP 1514 80 → 41006 [ACK] Seq=9650 Ack=949 Win=64384 Len=1448 TSval=4280235210 TSecr=2122105768 [TCP segment of a reassembled PDU]
   23 1612291812.323340339 192.168.2.254 → 192.168.1.254 TCP 66 41006 → 80 [ACK] Seq=949 Ack=11098 Win=64128 Len=0 TSval=2122105773 TSecr=4280235210
   24 1612291812.323237475 192.168.1.254 → 192.168.2.254 TCP 1514 80 → 41006 [ACK] Seq=11098 Ack=949 Win=64384 Len=1448 TSval=4280235210 TSecr=2122105768 [TCP segment of a reassembled PDU]
   25 1612291812.323384401 192.168.2.254 → 192.168.1.254 TCP 66 41006 → 80 [ACK] Seq=949 Ack=12546 Win=64128 Len=0 TSval=2122105773 TSecr=4280235210
   26 1612291812.323241954 192.168.1.254 → 192.168.2.254 HTTP 1030 HTTP/1.1 200 OK  (text/html)
   27 1612291812.323431849 192.168.2.254 → 192.168.1.254 TCP 66 41006 → 80 [ACK] Seq=949 Ack=13510 Win=64128 Len=0 TSval=2122105773 TSecr=4280235210
   28 1612291816.715389093 192.168.2.254 → 192.168.1.254 HTTP 540 GET /1.php HTTP/1.1 
   29 1612291816.716057424 192.168.1.254 → 192.168.2.254 TCP 66 80 → 41006 [ACK] Seq=13510 Ack=1423 Win=64128 Len=0 TSval=4280239604 TSecr=2122110165
   30 1612291816.719622255 192.168.1.254 → 192.168.2.254 TCP 1514 HTTP/1.1 200 OK  [TCP segment of a reassembled PDU]
   31 1612291816.719860275 192.168.2.254 → 192.168.1.254 TCP 66 41006 → 80 [ACK] Seq=1423 Ack=14958 Win=64128 Len=0 TSval=2122110169 TSecr=4280239607
   32 1612291816.719633453 192.168.1.254 → 192.168.2.254 TCP 1514 80 → 41006 [ACK] Seq=14958 Ack=1423 Win=64128 Len=1448 TSval=4280239607 TSecr=2122110165 [TCP segment of a reassembled PDU]
   33 1612291816.720014753 192.168.2.254 → 192.168.1.254 TCP 66 41006 → 80 [ACK] Seq=1423 Ack=16406 Win=64128 Len=0 TSval=2122110170 TSecr=4280239607
   34 1612291816.719646525 192.168.1.254 → 192.168.2.254 TCP 1514 80 → 41006 [ACK] Seq=16406 Ack=1423 Win=64128 Len=1448 TSval=4280239607 TSecr=2122110165 [TCP segment of a reassembled PDU]
   35 1612291816.720082930 192.168.2.254 → 192.168.1.254 TCP 66 41006 → 80 [ACK] Seq=1423 Ack=17854 Win=64128 Len=0 TSval=2122110170 TSecr=4280239607
   36 1612291816.719650015 192.168.1.254 → 192.168.2.254 TCP 1514 80 → 41006 [ACK] Seq=17854 Ack=1423 Win=64128 Len=1448 TSval=4280239607 TSecr=2122110165 [TCP segment of a reassembled PDU]
   37 1612291816.720134128 192.168.2.254 → 192.168.1.254 TCP 66 41006 → 80 [ACK] Seq=1423 Ack=19302 Win=64128 Len=0 TSval=2122110170 TSecr=4280239607
   38 1612291816.719655171 192.168.1.254 → 192.168.2.254 HTTP 1039 HTTP/1.1 200 OK  (text/html)
   39 1612291816.720188919 192.168.2.254 → 192.168.1.254 TCP 66 41006 → 80 [ACK] Seq=1423 Ack=20275 Win=64128 Len=0 TSval=2122110170 TSecr=4280239607
   40 1612291821.724095997 192.168.1.254 → 192.168.2.254 TCP 66 80 → 41006 [FIN, ACK] Seq=20275 Ack=1423 Win=64128 Len=0 TSval=4280244612 TSecr=2122110170
   41 1612291821.768947494 192.168.2.254 → 192.168.1.254 TCP 66 41006 → 80 [ACK] Seq=1423 Ack=20276 Win=64128 Len=0 TSval=2122115219 TSecr=4280244612
   42 1612291823.351511541 192.168.2.254 → 192.168.1.254 TCP 66 41006 → 80 [FIN, ACK] Seq=1423 Ack=20276 Win=64128 Len=0 TSval=2122116801 TSecr=4280244612
   43 1612291823.352083570 192.168.1.254 → 192.168.2.254 TCP 66 80 → 41006 [ACK] Seq=20276 Ack=1424 Win=64128 Len=0 TSval=4280246240 TSecr=2122116801
   44 1612291823.352178101 192.168.2.254 → 192.168.1.254 TCP 74 41008 → 80 [SYN] Seq=0 Win=64240 Len=0 MSS=1460 SACK_PERM=1 TSval=2122116802 TSecr=0 WS=128
   45 1612291823.352651329 192.168.1.254 → 192.168.2.254 TCP 74 80 → 41008 [SYN, ACK] Seq=0 Ack=1 Win=65160 Len=0 MSS=1460 SACK_PERM=1 TSval=4280246241 TSecr=2122116802 WS=128
   46 1612291823.352895183 192.168.2.254 → 192.168.1.254 TCP 66 41008 → 80 [ACK] Seq=1 Ack=1 Win=64256 Len=0 TSval=2122116802 TSecr=4280246241
   47 1612291823.354749657 192.168.2.254 → 192.168.1.254 HTTP 540 GET /1.php HTTP/1.1 
   48 1612291823.355401270 192.168.1.254 → 192.168.2.254 TCP 66 80 → 41008 [ACK] Seq=1 Ack=475 Win=64768 Len=0 TSval=4280246243 TSecr=2122116804
   49 1612291823.358767668 192.168.1.254 → 192.168.2.254 TCP 1514 HTTP/1.1 200 OK  [TCP segment of a reassembled PDU]
   50 1612291823.359088448 192.168.2.254 → 192.168.1.254 TCP 66 41008 → 80 [ACK] Seq=475 Ack=1449 Win=64128 Len=0 TSval=2122116809 TSecr=4280246246
   51 1612291823.358774386 192.168.1.254 → 192.168.2.254 TCP 1514 80 → 41008 [ACK] Seq=1449 Ack=475 Win=64768 Len=1448 TSval=4280246246 TSecr=2122116804 [TCP segment of a reassembled PDU]
   52 1612291823.359191573 192.168.2.254 → 192.168.1.254 TCP 66 41008 → 80 [ACK] Seq=475 Ack=2897 Win=64128 Len=0 TSval=2122116809 TSecr=4280246246
   53 1612291823.359355374 192.168.1.254 → 192.168.2.254 TCP 1514 80 → 41008 [ACK] Seq=2897 Ack=475 Win=64768 Len=1448 TSval=4280246246 TSecr=2122116804 [TCP segment of a reassembled PDU]
   54 1612291823.359524905 192.168.2.254 → 192.168.1.254 TCP 66 41008 → 80 [ACK] Seq=475 Ack=4345 Win=64128 Len=0 TSval=2122116809 TSecr=4280246246
   55 1612291823.359362458 192.168.1.254 → 192.168.2.254 TCP 1514 80 → 41008 [ACK] Seq=4345 Ack=475 Win=64768 Len=1448 TSval=4280246246 TSecr=2122116804 [TCP segment of a reassembled PDU]
   56 1612291823.359559801 192.168.2.254 → 192.168.1.254 TCP 66 41008 → 80 [ACK] Seq=475 Ack=5793 Win=64128 Len=0 TSval=2122116809 TSecr=4280246246
   57 1612291823.359364645 192.168.1.254 → 192.168.2.254 HTTP 1026 HTTP/1.1 200 OK  (text/html)
   58 1612291823.359626936 192.168.2.254 → 192.168.1.254 TCP 66 41008 → 80 [ACK] Seq=475 Ack=6753 Win=63232 Len=0 TSval=2122116809 TSecr=4280246246
   59 1612291826.842133054 192.168.2.254 → 192.168.1.254 HTTP 540 GET /1.php HTTP/1.1 
   60 1612291826.842761698 192.168.1.254 → 192.168.2.254 TCP 66 80 → 41008 [ACK] Seq=6753 Ack=949 Win=64384 Len=0 TSval=4280249731 TSecr=2122120292
   61 1612291826.845881329 192.168.1.254 → 192.168.2.254 TCP 1514 HTTP/1.1 200 OK  [TCP segment of a reassembled PDU]
   62 1612291826.845998047 192.168.2.254 → 192.168.1.254 TCP 66 41008 → 80 [ACK] Seq=949 Ack=8201 Win=64128 Len=0 TSval=2122120296 TSecr=4280249733
   63 1612291826.846042526 192.168.1.254 → 192.168.2.254 TCP 1514 80 → 41008 [ACK] Seq=8201 Ack=949 Win=64384 Len=1448 TSval=4280249733 TSecr=2122120292 [TCP segment of a reassembled PDU]
   64 1612291826.846111276 192.168.2.254 → 192.168.1.254 TCP 66 41008 → 80 [ACK] Seq=949 Ack=9649 Win=64128 Len=0 TSval=2122120296 TSecr=4280249733
   65 1612291826.846044766 192.168.1.254 → 192.168.2.254 TCP 1514 80 → 41008 [ACK] Seq=9649 Ack=949 Win=64384 Len=1448 TSval=4280249733 TSecr=2122120292 [TCP segment of a reassembled PDU]
   66 1612291826.846169349 192.168.2.254 → 192.168.1.254 TCP 66 41008 → 80 [ACK] Seq=949 Ack=11097 Win=62720 Len=0 TSval=2122120296 TSecr=4280249733
   67 1612291826.846166797 192.168.1.254 → 192.168.2.254 TCP 1514 80 → 41008 [ACK] Seq=11097 Ack=949 Win=64384 Len=1448 TSval=4280249733 TSecr=2122120292 [TCP segment of a reassembled PDU]
   68 1612291826.846238203 192.168.2.254 → 192.168.1.254 TCP 66 41008 → 80 [ACK] Seq=949 Ack=12545 Win=61312 Len=0 TSval=2122120296 TSecr=4280249733
   69 1612291826.846257891 192.168.1.254 → 192.168.2.254 HTTP 1073 HTTP/1.1 200 OK  (text/html)
   70 1612291826.846299141 192.168.2.254 → 192.168.1.254 TCP 66 41008 → 80 [ACK] Seq=949 Ack=13552 Win=60416 Len=0 TSval=2122120296 TSecr=4280249733
   71 1612291829.529699699 192.168.2.254 → 192.168.1.254 HTTP 540 GET /1.php HTTP/1.1 
   72 1612291829.530392042 192.168.1.254 → 192.168.2.254 TCP 66 80 → 41008 [ACK] Seq=13552 Ack=1423 Win=64128 Len=0 TSval=4280252418 TSecr=2122122979
   73 1612291829.533624745 192.168.1.254 → 192.168.2.254 TCP 1514 HTTP/1.1 200 OK  [TCP segment of a reassembled PDU]
   74 1612291829.533910265 192.168.2.254 → 192.168.1.254 TCP 66 41008 → 80 [ACK] Seq=1423 Ack=15000 Win=64128 Len=0 TSval=2122122983 TSecr=4280252421
   75 1612291829.533630943 192.168.1.254 → 192.168.2.254 TCP 1514 80 → 41008 [ACK] Seq=15000 Ack=1423 Win=64128 Len=1448 TSval=4280252421 TSecr=2122122979 [TCP segment of a reassembled PDU]
   76 1612291829.533992557 192.168.2.254 → 192.168.1.254 TCP 66 41008 → 80 [ACK] Seq=1423 Ack=16448 Win=64128 Len=0 TSval=2122122984 TSecr=4280252421
   77 1612291829.534104327 192.168.1.254 → 192.168.2.254 TCP 1514 80 → 41008 [ACK] Seq=16448 Ack=1423 Win=64128 Len=1448 TSval=4280252421 TSecr=2122122979 [TCP segment of a reassembled PDU]
   78 1612291829.534285890 192.168.2.254 → 192.168.1.254 TCP 66 41008 → 80 [ACK] Seq=1423 Ack=17896 Win=64128 Len=0 TSval=2122122984 TSecr=4280252421
   79 1612291829.534110577 192.168.1.254 → 192.168.2.254 TCP 1514 80 → 41008 [ACK] Seq=17896 Ack=1423 Win=64128 Len=1448 TSval=4280252421 TSecr=2122122979 [TCP segment of a reassembled PDU]
   80 1612291829.534355108 192.168.2.254 → 192.168.1.254 TCP 66 41008 → 80 [ACK] Seq=1423 Ack=19344 Win=64128 Len=0 TSval=2122122984 TSecr=4280252421
   81 1612291829.534113025 192.168.1.254 → 192.168.2.254 HTTP 1070 HTTP/1.1 200 OK  (text/html)
   82 1612291829.534388858 192.168.2.254 → 192.168.1.254 TCP 66 41008 → 80 [ACK] Seq=1423 Ack=20348 Win=64128 Len=0 TSval=2122122984 TSecr=4280252421
   83 1612291832.061327909 192.168.2.254 → 192.168.1.254 HTTP 540 GET /1.php HTTP/1.1 
   84 1612291832.062005982 192.168.1.254 → 192.168.2.254 TCP 66 80 → 41008 [ACK] Seq=20348 Ack=1897 Win=64128 Len=0 TSval=4280254950 TSecr=2122125511
   85 1612291832.065289157 192.168.1.254 → 192.168.2.254 TCP 1514 HTTP/1.1 200 OK  [TCP segment of a reassembled PDU]
   86 1612291832.065589730 192.168.2.254 → 192.168.1.254 TCP 66 41008 → 80 [ACK] Seq=1897 Ack=21796 Win=64128 Len=0 TSval=2122125515 TSecr=4280254953
   87 1612291832.065292907 192.168.1.254 → 192.168.2.254 TCP 1514 80 → 41008 [ACK] Seq=21796 Ack=1897 Win=64128 Len=1448 TSval=4280254953 TSecr=2122125511 [TCP segment of a reassembled PDU]
   88 1612291832.065698115 192.168.2.254 → 192.168.1.254 TCP 66 41008 → 80 [ACK] Seq=1897 Ack=23244 Win=64128 Len=0 TSval=2122125515 TSecr=4280254953
   89 1612291832.065810823 192.168.1.254 → 192.168.2.254 TCP 1514 80 → 41008 [ACK] Seq=23244 Ack=1897 Win=64128 Len=1448 TSval=4280254953 TSecr=2122125511 [TCP segment of a reassembled PDU]
   90 1612291832.065906865 192.168.2.254 → 192.168.1.254 TCP 66 41008 → 80 [ACK] Seq=1897 Ack=24692 Win=64128 Len=0 TSval=2122125515 TSecr=4280254953
   91 1612291832.065816292 192.168.1.254 → 192.168.2.254 TCP 1514 80 → 41008 [ACK] Seq=24692 Ack=1897 Win=64128 Len=1448 TSval=4280254953 TSecr=2122125511 [TCP segment of a reassembled PDU]
   92 1612291832.065932177 192.168.2.254 → 192.168.1.254 TCP 66 41008 → 80 [ACK] Seq=1897 Ack=26140 Win=64128 Len=0 TSval=2122125516 TSecr=4280254953
   93 1612291832.065818427 192.168.1.254 → 192.168.2.254 HTTP 1048 HTTP/1.1 200 OK  (text/html)
   94 1612291832.065956761 192.168.2.254 → 192.168.1.254 TCP 66 41008 → 80 [ACK] Seq=1897 Ack=27122 Win=64128 Len=0 TSval=2122125516 TSecr=4280254953
   95 1612291834.446191429 192.168.2.254 → 192.168.1.254 HTTP 540 GET /1.php HTTP/1.1 
   96 1612291834.449956687 192.168.1.254 → 192.168.2.254 TCP 1514 HTTP/1.1 200 OK  [TCP segment of a reassembled PDU]
   97 1612291834.450193249 192.168.2.254 → 192.168.1.254 TCP 66 41008 → 80 [ACK] Seq=2371 Ack=28570 Win=64128 Len=0 TSval=2122127900 TSecr=4280257337
   98 1612291834.449963458 192.168.1.254 → 192.168.2.254 TCP 1514 80 → 41008 [ACK] Seq=28570 Ack=2371 Win=64128 Len=1448 TSval=4280257337 TSecr=2122127896 [TCP segment of a reassembled PDU]
   99 1612291834.450287989 192.168.2.254 → 192.168.1.254 TCP 66 41008 → 80 [ACK] Seq=2371 Ack=30018 Win=64128 Len=0 TSval=2122127900 TSecr=4280257337
  100 1612291834.450409655 192.168.1.254 → 192.168.2.254 TCP 1514 80 → 41008 [ACK] Seq=30018 Ack=2371 Win=64128 Len=1448 TSval=4280257337 TSecr=2122127896 [TCP segment of a reassembled PDU]
