    1 1612283440.392257442 192.168.102.148 → 192.168.9.100 TCP 74 44102 → 80 [SYN] Seq=0 Win=64240 Len=0 MSS=1460 SACK_PERM=1 TSval=2461469857 TSecr=0 WS=128
    2 1612283440.392323349 192.168.9.100 → 192.168.102.148 TCP 74 80 → 44102 [SYN, ACK] Seq=0 Ack=1 Win=65160 Len=0 MSS=1460 SACK_PERM=1 TSval=2753038668 TSecr=2461469857 WS=128
    3 1612283440.393746405 192.168.102.148 → 192.168.9.100 TCP 66 44102 → 80 [ACK] Seq=1 Ack=1 Win=64256 Len=0 TSval=2461469859 TSecr=2753038668
    4 1612283440.397099219 192.168.102.148 → 192.168.9.100 HTTP 547 GET /1.php HTTP/1.1 
    5 1612283440.397177756 192.168.9.100 → 192.168.102.148 TCP 66 80 → 44102 [ACK] Seq=1 Ack=482 Win=64768 Len=0 TSval=2753038673 TSecr=2461469863
    6 1612283440.411565608 192.168.9.100 → 192.168.102.148 TCP 1514 HTTP/1.1 200 OK  [TCP segment of a reassembled PDU]
    7 1612283440.411583386 192.168.9.100 → 192.168.102.148 TCP 1514 80 → 44102 [ACK] Seq=1449 Ack=482 Win=64768 Len=1448 TSval=2753038687 TSecr=2461469863 [TCP segment of a reassembled PDU]
    8 1612283440.411588090 192.168.9.100 → 192.168.102.148 TCP 1514 80 → 44102 [ACK] Seq=2897 Ack=482 Win=64768 Len=1448 TSval=2753038687 TSecr=2461469863 [TCP segment of a reassembled PDU]
    9 1612283440.411592238 192.168.9.100 → 192.168.102.148 TCP 1514 80 → 44102 [PSH, ACK] Seq=4345 Ack=482 Win=64768 Len=1448 TSval=2753038687 TSecr=2461469863 [TCP segment of a reassembled PDU]
   10 1612283440.411801719 192.168.9.100 → 192.168.102.148 HTTP 1029 HTTP/1.1 200 OK  (text/html)
   11 1612283440.415755756 192.168.102.148 → 192.168.9.100 TCP 66 44102 → 80 [ACK] Seq=482 Ack=1449 Win=64128 Len=0 TSval=2461469881 TSecr=2753038687
   12 1612283440.415796590 192.168.102.148 → 192.168.9.100 TCP 66 44102 → 80 [ACK] Seq=482 Ack=2897 Win=64128 Len=0 TSval=2461469881 TSecr=2753038687
   13 1612283440.415796682 192.168.102.148 → 192.168.9.100 TCP 66 44102 → 80 [ACK] Seq=482 Ack=4345 Win=64128 Len=0 TSval=2461469881 TSecr=2753038687
   14 1612283440.416019293 192.168.102.148 → 192.168.9.100 TCP 66 44102 → 80 [ACK] Seq=482 Ack=5793 Win=64128 Len=0 TSval=2461469882 TSecr=2753038687
   15 1612283440.416059330 192.168.102.148 → 192.168.9.100 TCP 66 44102 → 80 [ACK] Seq=482 Ack=6756 Win=64128 Len=0 TSval=2461469882 TSecr=2753038687
   16 1612283445.415131661 192.168.9.100 → 192.168.102.148 TCP 66 80 → 44102 [FIN, ACK] Seq=6756 Ack=482 Win=64768 Len=0 TSval=2753043691 TSecr=2461469882
   17 1612283445.458838587 192.168.102.148 → 192.168.9.100 TCP 66 44102 → 80 [ACK] Seq=482 Ack=6757 Win=64128 Len=0 TSval=2461474925 TSecr=2753043691
   18 1612283484.346075082 192.168.102.148 → 192.168.9.100 TCP 74 44104 → 80 [SYN] Seq=0 Win=64240 Len=0 MSS=1460 SACK_PERM=1 TSval=2461513812 TSecr=0 WS=128
   19 1612283484.346137323 192.168.9.100 → 192.168.102.148 TCP 74 80 → 44104 [SYN, ACK] Seq=0 Ack=1 Win=65160 Len=0 MSS=1460 SACK_PERM=1 TSval=2753082622 TSecr=2461513812 WS=128
   20 1612283484.347002638 192.168.102.148 → 192.168.9.100 TCP 66 44104 → 80 [ACK] Seq=1 Ack=1 Win=64256 Len=0 TSval=2461513813 TSecr=2753082622
   21 1612283484.349094452 192.168.102.148 → 192.168.9.100 HTTP 547 GET /1.php HTTP/1.1 
   22 1612283484.349142452 192.168.9.100 → 192.168.102.148 TCP 66 80 → 44104 [ACK] Seq=1 Ack=482 Win=64768 Len=0 TSval=2753082625 TSecr=2461513815
   23 1612283484.352089064 192.168.9.100 → 192.168.102.148 TCP 1514 HTTP/1.1 200 OK  [TCP segment of a reassembled PDU]
   24 1612283484.352103582 192.168.9.100 → 192.168.102.148 TCP 1514 80 → 44104 [ACK] Seq=1449 Ack=482 Win=64768 Len=1448 TSval=2753082628 TSecr=2461513815 [TCP segment of a reassembled PDU]
   25 1612283484.352108249 192.168.9.100 → 192.168.102.148 TCP 1514 80 → 44104 [ACK] Seq=2897 Ack=482 Win=64768 Len=1448 TSval=2753082628 TSecr=2461513815 [TCP segment of a reassembled PDU]
   26 1612283484.352112471 192.168.9.100 → 192.168.102.148 TCP 1514 80 → 44104 [ACK] Seq=4345 Ack=482 Win=64768 Len=1448 TSval=2753082628 TSecr=2461513815 [TCP segment of a reassembled PDU]
   27 1612283484.352117341 192.168.9.100 → 192.168.102.148 HTTP 1033 HTTP/1.1 200 OK  (text/html)
   28 1612283484.354093786 192.168.102.148 → 192.168.9.100 TCP 66 44104 → 80 [ACK] Seq=482 Ack=1449 Win=64128 Len=0 TSval=2461513820 TSecr=2753082628
   29 1612283484.354133527 192.168.102.148 → 192.168.9.100 TCP 66 44104 → 80 [ACK] Seq=482 Ack=2897 Win=64128 Len=0 TSval=2461513820 TSecr=2753082628
   30 1612283484.354150193 192.168.102.148 → 192.168.9.100 TCP 66 44104 → 80 [ACK] Seq=482 Ack=4345 Win=64128 Len=0 TSval=2461513820 TSecr=2753082628
   31 1612283484.354333878 192.168.102.148 → 192.168.9.100 TCP 66 44104 → 80 [ACK] Seq=482 Ack=5793 Win=64128 Len=0 TSval=2461513820 TSecr=2753082628
   32 1612283484.354363804 192.168.102.148 → 192.168.9.100 TCP 66 44104 → 80 [ACK] Seq=482 Ack=6760 Win=64128 Len=0 TSval=2461513820 TSecr=2753082628
   33 1612283489.357341301 192.168.9.100 → 192.168.102.148 TCP 66 80 → 44104 [FIN, ACK] Seq=6760 Ack=482 Win=64768 Len=0 TSval=2753087633 TSecr=2461513820
   34 1612283489.398695690 192.168.102.148 → 192.168.9.100 TCP 66 44104 → 80 [ACK] Seq=482 Ack=6761 Win=64128 Len=0 TSval=2461518865 TSecr=2753087633
   35 1612283497.679148093 192.168.102.148 → 192.168.9.100 TCP 66 44104 → 80 [FIN, ACK] Seq=482 Ack=6761 Win=64128 Len=0 TSval=2461527145 TSecr=2753087633
   36 1612283497.679200611 192.168.9.100 → 192.168.102.148 TCP 66 80 → 44104 [ACK] Seq=6761 Ack=483 Win=64768 Len=0 TSval=2753095955 TSecr=2461527145
   37 1612283497.680842037 192.168.102.148 → 192.168.9.100 TCP 74 44106 → 80 [SYN] Seq=0 Win=64240 Len=0 MSS=1460 SACK_PERM=1 TSval=2461527147 TSecr=0 WS=128
   38 1612283497.680879093 192.168.9.100 → 192.168.102.148 TCP 74 80 → 44106 [SYN, ACK] Seq=0 Ack=1 Win=65160 Len=0 MSS=1460 SACK_PERM=1 TSval=2753095956 TSecr=2461527147 WS=128
   39 1612283497.681599815 192.168.102.148 → 192.168.9.100 TCP 66 44106 → 80 [ACK] Seq=1 Ack=1 Win=64256 Len=0 TSval=2461527147 TSecr=2753095956
   40 1612283497.683306537 192.168.102.148 → 192.168.9.100 HTTP 634 GET / HTTP/1.1 
   41 1612283497.683364407 192.168.9.100 → 192.168.102.148 TCP 66 80 → 44106 [ACK] Seq=1 Ack=569 Win=64640 Len=0 TSval=2753095959 TSecr=2461527149
   42 1612283497.684792870 192.168.9.100 → 192.168.102.148 TCP 1514 HTTP/1.1 200 OK  [TCP segment of a reassembled PDU]
   43 1612283497.684807259 192.168.9.100 → 192.168.102.148 TCP 1514 80 → 44106 [ACK] Seq=1449 Ack=569 Win=64640 Len=1448 TSval=2753095960 TSecr=2461527149 [TCP segment of a reassembled PDU]
   44 1612283497.684811630 192.168.9.100 → 192.168.102.148 HTTP 552 HTTP/1.1 200 OK  (text/html)
   45 1612283497.686597185 192.168.102.148 → 192.168.9.100 TCP 66 44106 → 80 [ACK] Seq=569 Ack=1449 Win=64128 Len=0 TSval=2461527152 TSecr=2753095960
   46 1612283497.686636444 192.168.102.148 → 192.168.9.100 TCP 66 44106 → 80 [ACK] Seq=569 Ack=2897 Win=64128 Len=0 TSval=2461527152 TSecr=2753095960
   47 1612283497.686654704 192.168.102.148 → 192.168.9.100 TCP 66 44106 → 80 [ACK] Seq=569 Ack=3383 Win=64128 Len=0 TSval=2461527152 TSecr=2753095960
   48 1612283502.690026738 192.168.9.100 → 192.168.102.148 TCP 66 80 → 44106 [FIN, ACK] Seq=3383 Ack=569 Win=64640 Len=0 TSval=2753100965 TSecr=2461527152
   49 1612283502.738801312 192.168.102.148 → 192.168.9.100 TCP 66 44106 → 80 [ACK] Seq=569 Ack=3384 Win=64128 Len=0 TSval=2461532205 TSecr=2753100965
   50 1612283503.182169552 192.168.102.148 → 192.168.9.100 TCP 66 44106 → 80 [FIN, ACK] Seq=569 Ack=3384 Win=64128 Len=0 TSval=2461532648 TSecr=2753100965
   51 1612283503.182214849 192.168.9.100 → 192.168.102.148 TCP 66 80 → 44106 [ACK] Seq=3384 Ack=570 Win=64640 Len=0 TSval=2753101458 TSecr=2461532648
   52 1612283503.182775941 192.168.102.148 → 192.168.9.100 TCP 74 44108 → 80 [SYN] Seq=0 Win=64240 Len=0 MSS=1460 SACK_PERM=1 TSval=2461532649 TSecr=0 WS=128
   53 1612283503.182814163 192.168.9.100 → 192.168.102.148 TCP 74 80 → 44108 [SYN, ACK] Seq=0 Ack=1 Win=65160 Len=0 MSS=1460 SACK_PERM=1 TSval=2753101458 TSecr=2461532649 WS=128
   54 1612283503.183451108 192.168.102.148 → 192.168.9.100 TCP 66 44108 → 80 [ACK] Seq=1 Ack=1 Win=64256 Len=0 TSval=2461532649 TSecr=2753101458
   55 1612283503.185700182 192.168.102.148 → 192.168.9.100 HTTP 547 GET /1.php HTTP/1.1 
   56 1612283503.185749367 192.168.9.100 → 192.168.102.148 TCP 66 80 → 44108 [ACK] Seq=1 Ack=482 Win=64768 Len=0 TSval=2753101461 TSecr=2461532651
   57 1612283503.188671812 192.168.9.100 → 192.168.102.148 TCP 1514 HTTP/1.1 200 OK  [TCP segment of a reassembled PDU]
   58 1612283503.188687867 192.168.9.100 → 192.168.102.148 TCP 1514 80 → 44108 [ACK] Seq=1449 Ack=482 Win=64768 Len=1448 TSval=2753101464 TSecr=2461532651 [TCP segment of a reassembled PDU]
   59 1612283503.188692256 192.168.9.100 → 192.168.102.148 TCP 1514 80 → 44108 [ACK] Seq=2897 Ack=482 Win=64768 Len=1448 TSval=2753101464 TSecr=2461532651 [TCP segment of a reassembled PDU]
   60 1612283503.188696534 192.168.9.100 → 192.168.102.148 TCP 1514 80 → 44108 [ACK] Seq=4345 Ack=482 Win=64768 Len=1448 TSval=2753101464 TSecr=2461532651 [TCP segment of a reassembled PDU]
   61 1612283503.188700312 192.168.9.100 → 192.168.102.148 HTTP 1048 HTTP/1.1 200 OK  (text/html)
   62 1612283503.190844849 192.168.102.148 → 192.168.9.100 TCP 66 44108 → 80 [ACK] Seq=482 Ack=1449 Win=64128 Len=0 TSval=2461532656 TSecr=2753101464
   63 1612283503.190883034 192.168.102.148 → 192.168.9.100 TCP 66 44108 → 80 [ACK] Seq=482 Ack=2897 Win=64128 Len=0 TSval=2461532656 TSecr=2753101464
   64 1612283503.190898626 192.168.102.148 → 192.168.9.100 TCP 66 44108 → 80 [ACK] Seq=482 Ack=4345 Win=64128 Len=0 TSval=2461532657 TSecr=2753101464
   65 1612283503.191460756 192.168.102.148 → 192.168.9.100 TCP 66 44108 → 80 [ACK] Seq=482 Ack=5793 Win=64128 Len=0 TSval=2461532657 TSecr=2753101464
   66 1612283503.191489756 192.168.102.148 → 192.168.9.100 TCP 66 44108 → 80 [ACK] Seq=482 Ack=6775 Win=64128 Len=0 TSval=2461532657 TSecr=2753101464
   67 1612283508.193498364 192.168.9.100 → 192.168.102.148 TCP 66 80 → 44108 [FIN, ACK] Seq=6775 Ack=482 Win=64768 Len=0 TSval=2753106469 TSecr=2461532657
   68 1612283508.238863642 192.168.102.148 → 192.168.9.100 TCP 66 44108 → 80 [ACK] Seq=482 Ack=6776 Win=64128 Len=0 TSval=2461537705 TSecr=2753106469
   69 1612283508.430667660 192.168.102.148 → 192.168.9.100 TCP 66 44108 → 80 [FIN, ACK] Seq=482 Ack=6776 Win=64128 Len=0 TSval=2461537896 TSecr=2753106469
   70 1612283508.430710642 192.168.9.100 → 192.168.102.148 TCP 66 80 → 44108 [ACK] Seq=6776 Ack=483 Win=64768 Len=0 TSval=2753106706 TSecr=2461537896
   71 1612283508.431392271 192.168.102.148 → 192.168.9.100 TCP 74 44110 → 80 [SYN] Seq=0 Win=64240 Len=0 MSS=1460 SACK_PERM=1 TSval=2461537897 TSecr=0 WS=128
   72 1612283508.431433068 192.168.9.100 → 192.168.102.148 TCP 74 80 → 44110 [SYN, ACK] Seq=0 Ack=1 Win=65160 Len=0 MSS=1460 SACK_PERM=1 TSval=2753106707 TSecr=2461537897 WS=128
   73 1612283508.432399679 192.168.102.148 → 192.168.9.100 TCP 66 44110 → 80 [ACK] Seq=1 Ack=1 Win=64256 Len=0 TSval=2461537898 TSecr=2753106707
   74 1612283508.434186679 192.168.102.148 → 192.168.9.100 HTTP 634 GET / HTTP/1.1 
   75 1612283508.434227660 192.168.9.100 → 192.168.102.148 TCP 66 80 → 44110 [ACK] Seq=1 Ack=569 Win=64640 Len=0 TSval=2753106710 TSecr=2461537900
   76 1612283508.435580753 192.168.9.100 → 192.168.102.148 TCP 1514 HTTP/1.1 200 OK  [TCP segment of a reassembled PDU]
   77 1612283508.435594642 192.168.9.100 → 192.168.102.148 TCP 1514 80 → 44110 [ACK] Seq=1449 Ack=569 Win=64640 Len=1448 TSval=2753106711 TSecr=2461537900 [TCP segment of a reassembled PDU]
   78 1612283508.435600160 192.168.9.100 → 192.168.102.148 HTTP 552 HTTP/1.1 200 OK  (text/html)
   79 1612283508.437455216 192.168.102.148 → 192.168.9.100 TCP 66 44110 → 80 [ACK] Seq=569 Ack=1449 Win=64128 Len=0 TSval=2461537903 TSecr=2753106711
   80 1612283508.437494308 192.168.102.148 → 192.168.9.100 TCP 66 44110 → 80 [ACK] Seq=569 Ack=2897 Win=64128 Len=0 TSval=2461537903 TSecr=2753106711
   81 1612283508.437515401 192.168.102.148 → 192.168.9.100 TCP 66 44110 → 80 [ACK] Seq=569 Ack=3383 Win=64128 Len=0 TSval=2461537903 TSecr=2753106711
   82 1612283511.370516455 192.168.102.148 → 192.168.9.100 HTTP 547 GET /1.php HTTP/1.1 
   83 1612283511.370568140 192.168.9.100 → 192.168.102.148 TCP 66 80 → 44110 [ACK] Seq=3383 Ack=1050 Win=64256 Len=0 TSval=2753109646 TSecr=2461540836
   84 1612283511.373310529 192.168.9.100 → 192.168.102.148 TCP 1514 HTTP/1.1 200 OK  [TCP segment of a reassembled PDU]
   85 1612283511.373324844 192.168.9.100 → 192.168.102.148 TCP 1514 80 → 44110 [ACK] Seq=4831 Ack=1050 Win=64256 Len=1448 TSval=2753109649 TSecr=2461540836 [TCP segment of a reassembled PDU]
   86 1612283511.373329344 192.168.9.100 → 192.168.102.148 TCP 1514 80 → 44110 [ACK] Seq=6279 Ack=1050 Win=64256 Len=1448 TSval=2753109649 TSecr=2461540836 [TCP segment of a reassembled PDU]
   87 1612283511.373333418 192.168.9.100 → 192.168.102.148 TCP 1514 80 → 44110 [ACK] Seq=7727 Ack=1050 Win=64256 Len=1448 TSval=2753109649 TSecr=2461540836 [TCP segment of a reassembled PDU]
   88 1612283511.373337196 192.168.9.100 → 192.168.102.148 HTTP 1078 HTTP/1.1 200 OK  (text/html)
   89 1612283511.375502529 192.168.102.148 → 192.168.9.100 TCP 66 44110 → 80 [ACK] Seq=1050 Ack=4831 Win=64128 Len=0 TSval=2461540841 TSecr=2753109649
   90 1612283511.375544677 192.168.102.148 → 192.168.9.100 TCP 66 44110 → 80 [ACK] Seq=1050 Ack=6279 Win=64128 Len=0 TSval=2461540841 TSecr=2753109649
   91 1612283511.375564103 192.168.102.148 → 192.168.9.100 TCP 66 44110 → 80 [ACK] Seq=1050 Ack=7727 Win=64128 Len=0 TSval=2461540841 TSecr=2753109649
   92 1612283511.375579881 192.168.102.148 → 192.168.9.100 TCP 66 44110 → 80 [ACK] Seq=1050 Ack=9175 Win=64128 Len=0 TSval=2461540841 TSecr=2753109649
   93 1612283511.375613140 192.168.102.148 → 192.168.9.100 TCP 66 44110 → 80 [ACK] Seq=1050 Ack=10187 Win=64128 Len=0 TSval=2461540841 TSecr=2753109649
   94 1612283516.378544063 192.168.9.100 → 192.168.102.148 TCP 66 80 → 44110 [FIN, ACK] Seq=10187 Ack=1050 Win=64256 Len=0 TSval=2753114654 TSecr=2461540841
   95 1612283516.428747656 192.168.102.148 → 192.168.9.100 TCP 66 44110 → 80 [ACK] Seq=1050 Ack=10188 Win=64128 Len=0 TSval=2461545895 TSecr=2753114654
   96 1612283542.456933584 192.168.102.148 → 192.168.9.100 TCP 74 44112 → 80 [SYN] Seq=0 Win=64240 Len=0 MSS=1460 SACK_PERM=1 TSval=2461571923 TSecr=0 WS=128
   97 1612283542.456994233 192.168.9.100 → 192.168.102.148 TCP 74 80 → 44112 [SYN, ACK] Seq=0 Ack=1 Win=65160 Len=0 MSS=1460 SACK_PERM=1 TSval=2753140732 TSecr=2461571923 WS=128
   98 1612283542.457660010 192.168.102.148 → 192.168.9.100 TCP 66 44112 → 80 [ACK] Seq=1 Ack=1 Win=64256 Len=0 TSval=2461571924 TSecr=2753140732
   99 1612283542.459358288 192.168.102.148 → 192.168.9.100 HTTP 547 GET /1.php HTTP/1.1 
  100 1612283542.459431955 192.168.9.100 → 192.168.102.148 TCP 66 80 → 44112 [ACK] Seq=1 Ack=482 Win=64768 Len=0 TSval=2753140735 TSecr=2461571925
