    1 1612291014.189506826 192.168.2.254 → 192.168.1.254 TCP 66 40896 → 80 [ACK] Seq=1 Ack=1 Win=600 Len=0 TSval=2121315819 TSecr=4279399751
    2 1612291014.190106879 192.168.1.254 → 192.168.2.254 TCP 66 [TCP ACKed unseen segment] 80 → 40896 [ACK] Seq=1 Ack=2 Win=501 Len=0 TSval=4279445259 TSecr=2121270359
    3 1612291023.864533273 192.168.2.254 → 192.168.1.254 TCP 66 [TCP Previous segment not captured] 40896 → 80 [FIN, ACK] Seq=2 Ack=1 Win=600 Len=0 TSval=2121325494 TSecr=4279445259
    4 1612291023.865078638 192.168.1.254 → 192.168.2.254 TCP 66 [TCP ACKed unseen segment] 80 → 40896 [ACK] Seq=1 Ack=3 Win=501 Len=0 TSval=4279454934 TSecr=2121325494
    5 1612291023.865254628 192.168.2.254 → 192.168.1.254 TCP 74 40926 → 80 [SYN] Seq=0 Win=64240 Len=0 MSS=1460 SACK_PERM=1 TSval=2121325494 TSecr=0 WS=128
    6 1612291023.865626296 192.168.1.254 → 192.168.2.254 TCP 74 80 → 40926 [SYN, ACK] Seq=0 Ack=1 Win=65160 Len=0 MSS=1460 SACK_PERM=1 TSval=4279454935 TSecr=2121325494 WS=128
    7 1612291023.865750515 192.168.2.254 → 192.168.1.254 TCP 66 40926 → 80 [ACK] Seq=1 Ack=1 Win=64256 Len=0 TSval=2121325495 TSecr=4279454935
    8 1612291023.866951039 192.168.2.254 → 192.168.1.254 HTTP 540 GET /1.php HTTP/1.1 
    9 1612291023.867586926 192.168.1.254 → 192.168.2.254 TCP 66 80 → 40926 [ACK] Seq=1 Ack=475 Win=64768 Len=0 TSval=4279454937 TSecr=2121325496
   10 1612291023.870958809 192.168.1.254 → 192.168.2.254 TCP 1514 HTTP/1.1 200 OK  [TCP segment of a reassembled PDU]
   11 1612291023.871192038 192.168.2.254 → 192.168.1.254 TCP 66 40926 → 80 [ACK] Seq=475 Ack=1449 Win=64128 Len=0 TSval=2121325500 TSecr=4279454940
   12 1612291023.870965215 192.168.1.254 → 192.168.2.254 TCP 1514 80 → 40926 [ACK] Seq=1449 Ack=475 Win=64768 Len=1448 TSval=4279454940 TSecr=2121325496 [TCP segment of a reassembled PDU]
   13 1612291023.871273757 192.168.2.254 → 192.168.1.254 TCP 66 40926 → 80 [ACK] Seq=475 Ack=2897 Win=64128 Len=0 TSval=2121325500 TSecr=4279454940
   14 1612291023.871405008 192.168.1.254 → 192.168.2.254 TCP 1514 80 → 40926 [ACK] Seq=2897 Ack=475 Win=64768 Len=1448 TSval=4279454940 TSecr=2121325496 [TCP segment of a reassembled PDU]
   15 1612291023.871522977 192.168.2.254 → 192.168.1.254 TCP 66 40926 → 80 [ACK] Seq=475 Ack=4345 Win=64128 Len=0 TSval=2121325501 TSecr=4279454940
   16 1612291023.871410060 192.168.1.254 → 192.168.2.254 TCP 1514 80 → 40926 [ACK] Seq=4345 Ack=475 Win=64768 Len=1448 TSval=4279454940 TSecr=2121325496 [TCP segment of a reassembled PDU]
   17 1612291023.871567716 192.168.2.254 → 192.168.1.254 TCP 66 40926 → 80 [ACK] Seq=475 Ack=5793 Win=64128 Len=0 TSval=2121325501 TSecr=4279454940
   18 1612291023.871416258 192.168.1.254 → 192.168.2.254 HTTP 1059 HTTP/1.1 200 OK  (text/html)
   19 1612291023.871618654 192.168.2.254 → 192.168.1.254 TCP 66 40926 → 80 [ACK] Seq=475 Ack=6786 Win=64128 Len=0 TSval=2121325501 TSecr=4279454940
   20 1612291024.414825209 192.168.2.254 → 192.168.1.254 HTTP 540 GET /1.php HTTP/1.1 
   21 1612291024.415640420 192.168.1.254 → 192.168.2.254 TCP 66 80 → 40926 [ACK] Seq=6786 Ack=949 Win=64384 Len=0 TSval=4279455485 TSecr=2121326044
   22 1612291024.418891834 192.168.1.254 → 192.168.2.254 TCP 1514 HTTP/1.1 200 OK  [TCP segment of a reassembled PDU]
   23 1612291024.419101730 192.168.2.254 → 192.168.1.254 TCP 66 40926 → 80 [ACK] Seq=949 Ack=8234 Win=64128 Len=0 TSval=2121326048 TSecr=4279455488
   24 1612291024.418898709 192.168.1.254 → 192.168.2.254 TCP 1514 80 → 40926 [ACK] Seq=8234 Ack=949 Win=64384 Len=1448 TSval=4279455488 TSecr=2121326044 [TCP segment of a reassembled PDU]
   25 1612291024.419215689 192.168.2.254 → 192.168.1.254 TCP 66 40926 → 80 [ACK] Seq=949 Ack=9682 Win=64128 Len=0 TSval=2121326048 TSecr=4279455488
   26 1612291024.419616992 192.168.1.254 → 192.168.2.254 TCP 1514 80 → 40926 [ACK] Seq=9682 Ack=949 Win=64384 Len=1448 TSval=4279455488 TSecr=2121326044 [TCP segment of a reassembled PDU]
   27 1612291024.419816211 192.168.2.254 → 192.168.1.254 TCP 66 40926 → 80 [ACK] Seq=949 Ack=11130 Win=64128 Len=0 TSval=2121326049 TSecr=4279455488
   28 1612291024.419622773 192.168.1.254 → 192.168.2.254 TCP 1514 80 → 40926 [ACK] Seq=11130 Ack=949 Win=64384 Len=1448 TSval=4279455488 TSecr=2121326044 [TCP segment of a reassembled PDU]
   29 1612291024.419868919 192.168.2.254 → 192.168.1.254 TCP 66 40926 → 80 [ACK] Seq=949 Ack=12578 Win=64128 Len=0 TSval=2121326049 TSecr=4279455488
   30 1612291024.419627252 192.168.1.254 → 192.168.2.254 HTTP 1035 HTTP/1.1 200 OK  (text/html)
   31 1612291024.419923034 192.168.2.254 → 192.168.1.254 TCP 66 40926 → 80 [ACK] Seq=949 Ack=13547 Win=64128 Len=0 TSval=2121326049 TSecr=4279455488
   32 1612291024.945770746 192.168.2.254 → 192.168.1.254 HTTP 540 GET /1.php HTTP/1.1 
   33 1612291024.946447414 192.168.1.254 → 192.168.2.254 TCP 66 80 → 40926 [ACK] Seq=13547 Ack=1423 Win=64128 Len=0 TSval=4279456016 TSecr=2121326575
   34 1612291024.949787995 192.168.1.254 → 192.168.2.254 TCP 1514 HTTP/1.1 200 OK  [TCP segment of a reassembled PDU]
   35 1612291024.949997370 192.168.2.254 → 192.168.1.254 TCP 66 40926 → 80 [ACK] Seq=1423 Ack=14995 Win=64128 Len=0 TSval=2121326579 TSecr=4279456018
   36 1612291024.949798047 192.168.1.254 → 192.168.2.254 TCP 1514 80 → 40926 [ACK] Seq=14995 Ack=1423 Win=64128 Len=1448 TSval=4279456018 TSecr=2121326575 [TCP segment of a reassembled PDU]
   37 1612291024.950073725 192.168.2.254 → 192.168.1.254 TCP 66 40926 → 80 [ACK] Seq=1423 Ack=16443 Win=64128 Len=0 TSval=2121326579 TSecr=4279456018
   38 1612291024.949801276 192.168.1.254 → 192.168.2.254 TCP 1514 80 → 40926 [ACK] Seq=16443 Ack=1423 Win=64128 Len=1448 TSval=4279456018 TSecr=2121326575 [TCP segment of a reassembled PDU]
   39 1612291024.950122944 192.168.2.254 → 192.168.1.254 TCP 66 40926 → 80 [ACK] Seq=1423 Ack=17891 Win=64128 Len=0 TSval=2121326579 TSecr=4279456018
   40 1612291024.950222423 192.168.1.254 → 192.168.2.254 TCP 1514 80 → 40926 [ACK] Seq=17891 Ack=1423 Win=64128 Len=1448 TSval=4279456018 TSecr=2121326575 [TCP segment of a reassembled PDU]
   41 1612291024.950319819 192.168.2.254 → 192.168.1.254 TCP 66 40926 → 80 [ACK] Seq=1423 Ack=19339 Win=64128 Len=0 TSval=2121326579 TSecr=4279456018
   42 1612291024.950227683 192.168.1.254 → 192.168.2.254 HTTP 1045 HTTP/1.1 200 OK  (text/html)
   43 1612291024.950372527 192.168.2.254 → 192.168.1.254 TCP 66 40926 → 80 [ACK] Seq=1423 Ack=20318 Win=64128 Len=0 TSval=2121326579 TSecr=4279456018
   44 1612291026.964389359 192.168.2.254 → 192.168.1.254 HTTP 540 GET /1.php HTTP/1.1 
   45 1612291026.965187226 192.168.1.254 → 192.168.2.254 TCP 66 80 → 40926 [ACK] Seq=20318 Ack=1897 Win=64128 Len=0 TSval=4279458034 TSecr=2121328593
   46 1612291026.968455671 192.168.1.254 → 192.168.2.254 TCP 1514 HTTP/1.1 200 OK  [TCP segment of a reassembled PDU]
   47 1612291026.968704578 192.168.2.254 → 192.168.1.254 TCP 66 40926 → 80 [ACK] Seq=1897 Ack=21766 Win=64128 Len=0 TSval=2121328598 TSecr=4279458037
   48 1612291026.968466817 192.168.1.254 → 192.168.2.254 TCP 1514 80 → 40926 [ACK] Seq=21766 Ack=1897 Win=64128 Len=1448 TSval=4279458037 TSecr=2121328593 [TCP segment of a reassembled PDU]
   49 1612291026.968899995 192.168.2.254 → 192.168.1.254 TCP 66 40926 → 80 [ACK] Seq=1897 Ack=23214 Win=64128 Len=0 TSval=2121328598 TSecr=4279458037
   50 1612291026.968472286 192.168.1.254 → 192.168.2.254 TCP 1514 80 → 40926 [ACK] Seq=23214 Ack=1897 Win=64128 Len=1448 TSval=4279458037 TSecr=2121328593 [TCP segment of a reassembled PDU]
   51 1612291026.968957495 192.168.2.254 → 192.168.1.254 TCP 66 40926 → 80 [ACK] Seq=1897 Ack=24662 Win=64128 Len=0 TSval=2121328598 TSecr=4279458037
   52 1612291026.969222235 192.168.1.254 → 192.168.2.254 TCP 1514 80 → 40926 [ACK] Seq=24662 Ack=1897 Win=64128 Len=1448 TSval=4279458037 TSecr=2121328593 [TCP segment of a reassembled PDU]
   53 1612291026.969501194 192.168.2.254 → 192.168.1.254 TCP 66 40926 → 80 [ACK] Seq=1897 Ack=26110 Win=64128 Len=0 TSval=2121328598 TSecr=4279458037
   54 1612291026.969230256 192.168.1.254 → 192.168.2.254 HTTP 1045 HTTP/1.1 200 OK  (text/html)
   55 1612291026.969561247 192.168.2.254 → 192.168.1.254 TCP 66 40926 → 80 [ACK] Seq=1897 Ack=27089 Win=64128 Len=0 TSval=2121328599 TSecr=4279458037
   56 1612291027.558083431 192.168.2.254 → 192.168.1.254 HTTP 540 GET /1.php HTTP/1.1 
   57 1612291027.562112659 192.168.1.254 → 192.168.2.254 TCP 1514 HTTP/1.1 200 OK  [TCP segment of a reassembled PDU]
   58 1612291027.562484743 192.168.2.254 → 192.168.1.254 TCP 66 40926 → 80 [ACK] Seq=2371 Ack=28537 Win=64128 Len=0 TSval=2121329191 TSecr=4279458631
   59 1612291027.562129482 192.168.1.254 → 192.168.2.254 TCP 1514 80 → 40926 [ACK] Seq=28537 Ack=2371 Win=64128 Len=1448 TSval=4279458631 TSecr=2121329187 [TCP segment of a reassembled PDU]
   60 1612291027.562571775 192.168.2.254 → 192.168.1.254 TCP 66 40926 → 80 [ACK] Seq=2371 Ack=29985 Win=64128 Len=0 TSval=2121329192 TSecr=4279458631
   61 1612291027.562132555 192.168.1.254 → 192.168.2.254 TCP 1514 80 → 40926 [ACK] Seq=29985 Ack=2371 Win=64128 Len=1448 TSval=4279458631 TSecr=2121329187 [TCP segment of a reassembled PDU]
   62 1612291027.562625317 192.168.2.254 → 192.168.1.254 TCP 66 40926 → 80 [ACK] Seq=2371 Ack=31433 Win=64128 Len=0 TSval=2121329192 TSecr=4279458631
   63 1612291027.562770942 192.168.1.254 → 192.168.2.254 TCP 1514 80 → 40926 [ACK] Seq=31433 Ack=2371 Win=64128 Len=1448 TSval=4279458631 TSecr=2121329187 [TCP segment of a reassembled PDU]
   64 1612291027.562946099 192.168.2.254 → 192.168.1.254 TCP 66 40926 → 80 [ACK] Seq=2371 Ack=32881 Win=67072 Len=0 TSval=2121329192 TSecr=4279458631
   65 1612291027.562779848 192.168.1.254 → 192.168.2.254 HTTP 1034 HTTP/1.1 200 OK  (text/html)
   66 1612291027.563054693 192.168.2.254 → 192.168.1.254 TCP 66 40926 → 80 [ACK] Seq=2371 Ack=33849 Win=69888 Len=0 TSval=2121329192 TSecr=4279458631
   67 1612291028.015385406 192.168.2.254 → 192.168.1.254 HTTP 540 GET /1.php HTTP/1.1 
   68 1612291028.019694687 192.168.1.254 → 192.168.2.254 TCP 1514 HTTP/1.1 200 OK  [TCP segment of a reassembled PDU]
   69 1612291028.020103438 192.168.2.254 → 192.168.1.254 TCP 66 40926 → 80 [ACK] Seq=2845 Ack=35297 Win=72832 Len=0 TSval=2121329649 TSecr=4279459088
   70 1612291028.019704010 192.168.1.254 → 192.168.2.254 TCP 1514 80 → 40926 [ACK] Seq=35297 Ack=2845 Win=64128 Len=1448 TSval=4279459088 TSecr=2121329644 [TCP segment of a reassembled PDU]
   71 1612291028.020221668 192.168.2.254 → 192.168.1.254 TCP 66 40926 → 80 [ACK] Seq=2845 Ack=36745 Win=75776 Len=0 TSval=2121329649 TSecr=4279459088
   72 1612291028.019710833 192.168.1.254 → 192.168.2.254 TCP 1514 80 → 40926 [ACK] Seq=36745 Ack=2845 Win=64128 Len=1448 TSval=4279459088 TSecr=2121329644 [TCP segment of a reassembled PDU]
   73 1612291028.020292397 192.168.2.254 → 192.168.1.254 TCP 66 40926 → 80 [ACK] Seq=2845 Ack=38193 Win=78592 Len=0 TSval=2121329649 TSecr=4279459088
   74 1612291028.019715469 192.168.1.254 → 192.168.2.254 TCP 1514 80 → 40926 [ACK] Seq=38193 Ack=2845 Win=64128 Len=1448 TSval=4279459088 TSecr=2121329644 [TCP segment of a reassembled PDU]
   75 1612291028.020346512 192.168.2.254 → 192.168.1.254 TCP 66 40926 → 80 [ACK] Seq=2845 Ack=39641 Win=81536 Len=0 TSval=2121329649 TSecr=4279459088
   76 1612291028.019720260 192.168.1.254 → 192.168.2.254 HTTP 1054 HTTP/1.1 200 OK  (text/html)
   77 1612291028.020446199 192.168.2.254 → 192.168.1.254 TCP 66 40926 → 80 [ACK] Seq=2845 Ack=40629 Win=84480 Len=0 TSval=2121329649 TSecr=4279459088
   78 1612291028.644304562 192.168.2.254 → 192.168.1.254 HTTP 540 GET /1.php HTTP/1.1 
   79 1612291028.648197123 192.168.1.254 → 192.168.2.254 TCP 1514 HTTP/1.1 200 OK  [TCP segment of a reassembled PDU]
   80 1612291028.648410092 192.168.2.254 → 192.168.1.254 TCP 66 40926 → 80 [ACK] Seq=3319 Ack=42077 Win=87296 Len=0 TSval=2121330277 TSecr=4279459717
   81 1612291028.648203581 192.168.1.254 → 192.168.2.254 TCP 1514 80 → 40926 [ACK] Seq=42077 Ack=3319 Win=64128 Len=1448 TSval=4279459717 TSecr=2121330273 [TCP segment of a reassembled PDU]
   82 1612291028.648537592 192.168.2.254 → 192.168.1.254 TCP 66 40926 → 80 [ACK] Seq=3319 Ack=43525 Win=90240 Len=0 TSval=2121330278 TSecr=4279459717
   83 1612291028.648690249 192.168.1.254 → 192.168.2.254 TCP 1514 80 → 40926 [ACK] Seq=43525 Ack=3319 Win=64128 Len=1448 TSval=4279459717 TSecr=2121330273 [TCP segment of a reassembled PDU]
   84 1612291028.648791968 192.168.2.254 → 192.168.1.254 TCP 66 40926 → 80 [ACK] Seq=3319 Ack=44973 Win=93056 Len=0 TSval=2121330278 TSecr=4279459717
   85 1612291028.648695041 192.168.1.254 → 192.168.2.254 TCP 1514 80 → 40926 [ACK] Seq=44973 Ack=3319 Win=64128 Len=1448 TSval=4279459717 TSecr=2121330273 [TCP segment of a reassembled PDU]
   86 1612291028.648844885 192.168.2.254 → 192.168.1.254 TCP 66 40926 → 80 [ACK] Seq=3319 Ack=46421 Win=96000 Len=0 TSval=2121330278 TSecr=4279459717
   87 1612291028.648699520 192.168.1.254 → 192.168.2.254 HTTP 1039 HTTP/1.1 200 OK  (text/html)
   88 1612291028.648894677 192.168.2.254 → 192.168.1.254 TCP 66 40926 → 80 [ACK] Seq=3319 Ack=47394 Win=98944 Len=0 TSval=2121330278 TSecr=4279459717
   89 1612291029.139260533 192.168.2.254 → 192.168.1.254 HTTP 540 GET /1.php HTTP/1.1 
   90 1612291029.143363824 192.168.1.254 → 192.168.2.254 TCP 1514 HTTP/1.1 200 OK  [TCP segment of a reassembled PDU]
   91 1612291029.143832002 192.168.2.254 → 192.168.1.254 TCP 66 40926 → 80 [ACK] Seq=3793 Ack=48842 Win=101760 Len=0 TSval=2121330773 TSecr=4279460212
   92 1612291029.143430699 192.168.1.254 → 192.168.2.254 TCP 1514 80 → 40926 [ACK] Seq=48842 Ack=3793 Win=64128 Len=1448 TSval=4279460212 TSecr=2121330768 [TCP segment of a reassembled PDU]
   93 1612291029.143968357 192.168.2.254 → 192.168.1.254 TCP 66 40926 → 80 [ACK] Seq=3793 Ack=50290 Win=104704 Len=0 TSval=2121330773 TSecr=4279460212
   94 1612291029.143434501 192.168.1.254 → 192.168.2.254 TCP 1514 80 → 40926 [ACK] Seq=50290 Ack=3793 Win=64128 Len=1448 TSval=4279460212 TSecr=2121330768 [TCP segment of a reassembled PDU]
   95 1612291029.144033617 192.168.2.254 → 192.168.1.254 TCP 66 40926 → 80 [ACK] Seq=3793 Ack=51738 Win=107648 Len=0 TSval=2121330773 TSecr=4279460212
   96 1612291029.144088982 192.168.1.254 → 192.168.2.254 TCP 1514 80 → 40926 [ACK] Seq=51738 Ack=3793 Win=64128 Len=1448 TSval=4279460212 TSecr=2121330768 [TCP segment of a reassembled PDU]
   97 1612291029.144414243 192.168.2.254 → 192.168.1.254 TCP 66 40926 → 80 [ACK] Seq=3793 Ack=53186 Win=110464 Len=0 TSval=2121330773 TSecr=4279460212
   98 1612291029.144095857 192.168.1.254 → 192.168.2.254 HTTP 1047 HTTP/1.1 200 OK  (text/html)
   99 1612291029.144488410 192.168.2.254 → 192.168.1.254 TCP 66 40926 → 80 [ACK] Seq=3793 Ack=54167 Win=113408 Len=0 TSval=2121330774 TSecr=4279460212
  100 1612291029.833990835 192.168.2.254 → 192.168.1.254 HTTP 540 GET /1.php HTTP/1.1 
