    1 1612290944.086702321 192.168.2.254 → 192.168.1.254 TCP 74 40896 → 80 [SYN] Seq=0 Win=64240 Len=0 MSS=1460 SACK_PERM=1 TSval=2121237534 TSecr=0 WS=128
    2 1612290944.086766136 192.168.1.254 → 192.168.2.254 TCP 74 80 → 40896 [SYN, ACK] Seq=0 Ack=1 Win=65160 Len=0 MSS=1460 SACK_PERM=1 TSval=4279366975 TSecr=2121237534 WS=128
    3 1612290944.087495432 192.168.2.254 → 192.168.1.254 TCP 66 40896 → 80 [ACK] Seq=1 Ack=1 Win=64256 Len=0 TSval=2121237535 TSecr=4279366975
    4 1612290944.088966858 192.168.2.254 → 192.168.1.254 HTTP 627 GET / HTTP/1.1 
    5 1612290944.089028654 192.168.1.254 → 192.168.2.254 TCP 66 80 → 40896 [ACK] Seq=1 Ack=562 Win=64640 Len=0 TSval=4279366977 TSecr=2121237536
    6 1612290944.090391154 192.168.1.254 → 192.168.2.254 TCP 1514 HTTP/1.1 200 OK  [TCP segment of a reassembled PDU]
    7 1612290944.090404932 192.168.1.254 → 192.168.2.254 TCP 1514 80 → 40896 [ACK] Seq=1449 Ack=562 Win=64640 Len=1448 TSval=4279366979 TSecr=2121237536 [TCP segment of a reassembled PDU]
    8 1612290944.090409506 192.168.1.254 → 192.168.2.254 HTTP 552 HTTP/1.1 200 OK  (text/html)
    9 1612290944.091680506 192.168.2.254 → 192.168.1.254 TCP 66 40896 → 80 [ACK] Seq=562 Ack=1449 Win=64128 Len=0 TSval=2121237539 TSecr=4279366979
   10 1612290944.091721247 192.168.2.254 → 192.168.1.254 TCP 66 40896 → 80 [ACK] Seq=562 Ack=2897 Win=64128 Len=0 TSval=2121237539 TSecr=4279366979
   11 1612290944.091721321 192.168.2.254 → 192.168.1.254 TCP 66 40896 → 80 [ACK] Seq=562 Ack=3383 Win=64128 Len=0 TSval=2121237539 TSecr=4279366979
   12 1612290945.234119987 192.168.2.254 → 192.168.1.254 HTTP 627 GET / HTTP/1.1 
   13 1612290945.234171172 192.168.1.254 → 192.168.2.254 TCP 66 80 → 40896 [ACK] Seq=3383 Ack=1123 Win=64128 Len=0 TSval=4279368123 TSecr=2121238682
   14 1612290945.235513598 192.168.1.254 → 192.168.2.254 TCP 1514 HTTP/1.1 200 OK  [TCP segment of a reassembled PDU]
   15 1612290945.235527098 192.168.1.254 → 192.168.2.254 TCP 1514 80 → 40896 [ACK] Seq=4831 Ack=1123 Win=64128 Len=1448 TSval=4279368124 TSecr=2121238682 [TCP segment of a reassembled PDU]
   16 1612290945.235531765 192.168.1.254 → 192.168.2.254 HTTP 551 HTTP/1.1 200 OK  (text/html)
   17 1612290945.236540913 192.168.2.254 → 192.168.1.254 TCP 66 40896 → 80 [ACK] Seq=1123 Ack=4831 Win=64128 Len=0 TSval=2121238684 TSecr=4279368124
   18 1612290945.236700635 192.168.2.254 → 192.168.1.254 TCP 66 40896 → 80 [ACK] Seq=1123 Ack=6279 Win=64128 Len=0 TSval=2121238684 TSecr=4279368124
   19 1612290945.236732617 192.168.2.254 → 192.168.1.254 TCP 66 40896 → 80 [ACK] Seq=1123 Ack=6764 Win=64128 Len=0 TSval=2121238684 TSecr=4279368124
   20 1612290947.954446559 192.168.2.254 → 192.168.1.254 HTTP 627 GET / HTTP/1.1 
   21 1612290947.954497189 192.168.1.254 → 192.168.2.254 TCP 66 80 → 40896 [ACK] Seq=6764 Ack=1684 Win=64128 Len=0 TSval=4279370843 TSecr=2121241402
   22 1612290947.955800745 192.168.1.254 → 192.168.2.254 TCP 1514 HTTP/1.1 200 OK  [TCP segment of a reassembled PDU]
   23 1612290947.955813707 192.168.1.254 → 192.168.2.254 TCP 1514 80 → 40896 [ACK] Seq=8212 Ack=1684 Win=64128 Len=1448 TSval=4279370844 TSecr=2121241402 [TCP segment of a reassembled PDU]
   24 1612290947.955818522 192.168.1.254 → 192.168.2.254 HTTP 551 HTTP/1.1 200 OK  (text/html)
   25 1612290947.956896467 192.168.2.254 → 192.168.1.254 TCP 66 40896 → 80 [ACK] Seq=1684 Ack=8212 Win=64128 Len=0 TSval=2121241404 TSecr=4279370844
   26 1612290947.956936689 192.168.2.254 → 192.168.1.254 TCP 66 40896 → 80 [ACK] Seq=1684 Ack=9660 Win=64128 Len=0 TSval=2121241405 TSecr=4279370844
   27 1612290947.956936763 192.168.2.254 → 192.168.1.254 TCP 66 40896 → 80 [ACK] Seq=1684 Ack=10145 Win=64128 Len=0 TSval=2121241405 TSecr=4279370844
   28 1612290950.682337595 192.168.2.254 → 192.168.1.254 HTTP 627 GET / HTTP/1.1 
   29 1612290950.682388373 192.168.1.254 → 192.168.2.254 TCP 66 80 → 40896 [ACK] Seq=10145 Ack=2245 Win=64128 Len=0 TSval=4279373571 TSecr=2121244130
   30 1612290950.683626317 192.168.1.254 → 192.168.2.254 TCP 1514 HTTP/1.1 200 OK  [TCP segment of a reassembled PDU]
   31 1612290950.683640132 192.168.1.254 → 192.168.2.254 TCP 1514 80 → 40896 [ACK] Seq=11593 Ack=2245 Win=64128 Len=1448 TSval=4279373572 TSecr=2121244130 [TCP segment of a reassembled PDU]
   32 1612290950.683644780 192.168.1.254 → 192.168.2.254 HTTP 551 HTTP/1.1 200 OK  (text/html)
   33 1612290950.685054780 192.168.2.254 → 192.168.1.254 TCP 66 40896 → 80 [ACK] Seq=2245 Ack=11593 Win=64128 Len=0 TSval=2121244132 TSecr=4279373572
   34 1612290950.685120410 192.168.2.254 → 192.168.1.254 TCP 66 40896 → 80 [ACK] Seq=2245 Ack=13041 Win=64128 Len=0 TSval=2121244133 TSecr=4279373572
   35 1612290950.685120502 192.168.2.254 → 192.168.1.254 TCP 66 40896 → 80 [ACK] Seq=2245 Ack=13526 Win=64128 Len=0 TSval=2121244133 TSecr=4279373572
   36 1612290951.966828483 192.168.2.254 → 192.168.1.254 HTTP 627 GET / HTTP/1.1 
   37 1612290951.968147668 192.168.1.254 → 192.168.2.254 TCP 1514 HTTP/1.1 200 OK  [TCP segment of a reassembled PDU]
   38 1612290951.968162557 192.168.1.254 → 192.168.2.254 TCP 1514 80 → 40896 [ACK] Seq=14974 Ack=2806 Win=64128 Len=1448 TSval=4279374857 TSecr=2121245414 [TCP segment of a reassembled PDU]
   39 1612290951.968167057 192.168.1.254 → 192.168.2.254 HTTP 551 HTTP/1.1 200 OK  (text/html)
   40 1612290951.969597279 192.168.2.254 → 192.168.1.254 TCP 66 40896 → 80 [ACK] Seq=2806 Ack=14974 Win=64128 Len=0 TSval=2121245417 TSecr=4279374857
   41 1612290951.969635168 192.168.2.254 → 192.168.1.254 TCP 66 40896 → 80 [ACK] Seq=2806 Ack=16422 Win=64128 Len=0 TSval=2121245417 TSecr=4279374857
   42 1612290951.969659890 192.168.2.254 → 192.168.1.254 TCP 66 40896 → 80 [ACK] Seq=2806 Ack=16907 Win=64128 Len=0 TSval=2121245417 TSecr=4279374857
   43 1612290953.331021778 192.168.2.254 → 192.168.1.254 HTTP 627 GET / HTTP/1.1 
   44 1612290953.332297612 192.168.1.254 → 192.168.2.254 TCP 1514 HTTP/1.1 200 OK  [TCP segment of a reassembled PDU]
   45 1612290953.332312315 192.168.1.254 → 192.168.2.254 TCP 1514 80 → 40896 [ACK] Seq=18355 Ack=3367 Win=64128 Len=1448 TSval=4279376221 TSecr=2121246778 [TCP segment of a reassembled PDU]
   46 1612290953.332316741 192.168.1.254 → 192.168.2.254 HTTP 551 HTTP/1.1 200 OK  (text/html)
   47 1612290953.334002797 192.168.2.254 → 192.168.1.254 TCP 66 40896 → 80 [ACK] Seq=3367 Ack=18355 Win=67072 Len=0 TSval=2121246781 TSecr=4279376221
   48 1612290953.334045667 192.168.2.254 → 192.168.1.254 TCP 66 40896 → 80 [ACK] Seq=3367 Ack=19803 Win=69888 Len=0 TSval=2121246782 TSecr=4279376221
   49 1612290953.334045760 192.168.2.254 → 192.168.1.254 TCP 66 40896 → 80 [ACK] Seq=3367 Ack=20288 Win=72832 Len=0 TSval=2121246782 TSecr=4279376221
   50 1612290954.534901833 192.168.2.254 → 192.168.1.254 HTTP 627 GET / HTTP/1.1 
   51 1612290954.536201296 192.168.1.254 → 192.168.2.254 TCP 1514 HTTP/1.1 200 OK  [TCP segment of a reassembled PDU]
   52 1612290954.536218129 192.168.1.254 → 192.168.2.254 TCP 1514 80 → 40896 [ACK] Seq=21736 Ack=3928 Win=64128 Len=1448 TSval=4279377425 TSecr=2121247982 [TCP segment of a reassembled PDU]
   53 1612290954.536222481 192.168.1.254 → 192.168.2.254 HTTP 551 HTTP/1.1 200 OK  (text/html)
   54 1612290954.537887259 192.168.2.254 → 192.168.1.254 TCP 66 40896 → 80 [ACK] Seq=3928 Ack=21736 Win=75776 Len=0 TSval=2121247985 TSecr=4279377425
   55 1612290954.537925537 192.168.2.254 → 192.168.1.254 TCP 66 40896 → 80 [ACK] Seq=3928 Ack=23184 Win=76800 Len=0 TSval=2121247985 TSecr=4279377425
   56 1612290954.537949055 192.168.2.254 → 192.168.1.254 TCP 66 40896 → 80 [ACK] Seq=3928 Ack=23669 Win=76800 Len=0 TSval=2121247986 TSecr=4279377425
   57 1612290955.905948610 192.168.2.254 → 192.168.1.254 HTTP 627 GET / HTTP/1.1 
   58 1612290955.907274888 192.168.1.254 → 192.168.2.254 TCP 1514 HTTP/1.1 200 OK  [TCP segment of a reassembled PDU]
   59 1612290955.907289758 192.168.1.254 → 192.168.2.254 TCP 1514 80 → 40896 [ACK] Seq=25117 Ack=4489 Win=64128 Len=1448 TSval=4279378796 TSecr=2121249353 [TCP segment of a reassembled PDU]
   60 1612290955.907294129 192.168.1.254 → 192.168.2.254 HTTP 551 HTTP/1.1 200 OK  (text/html)
   61 1612290955.908408240 192.168.2.254 → 192.168.1.254 TCP 66 40896 → 80 [ACK] Seq=4489 Ack=25117 Win=76800 Len=0 TSval=2121249356 TSecr=4279378796
   62 1612290955.908667943 192.168.2.254 → 192.168.1.254 TCP 66 40896 → 80 [ACK] Seq=4489 Ack=26565 Win=76800 Len=0 TSval=2121249356 TSecr=4279378796
   63 1612290955.908698314 192.168.2.254 → 192.168.1.254 TCP 66 40896 → 80 [ACK] Seq=4489 Ack=27050 Win=76416 Len=0 TSval=2121249356 TSecr=4279378796
   64 1612290959.333192571 192.168.2.254 → 192.168.1.254 HTTP 627 GET / HTTP/1.1 
   65 1612290959.334490590 192.168.1.254 → 192.168.2.254 TCP 1514 HTTP/1.1 200 OK  [TCP segment of a reassembled PDU]
   66 1612290959.334503793 192.168.1.254 → 192.168.2.254 TCP 1514 80 → 40896 [ACK] Seq=28498 Ack=5050 Win=64128 Len=1448 TSval=4279382223 TSecr=2121252781 [TCP segment of a reassembled PDU]
   67 1612290959.334508664 192.168.1.254 → 192.168.2.254 HTTP 551 HTTP/1.1 200 OK  (text/html)
   68 1612290959.335621701 192.168.2.254 → 192.168.1.254 TCP 66 40896 → 80 [ACK] Seq=5050 Ack=28498 Win=76800 Len=0 TSval=2121252783 TSecr=4279382223
   69 1612290959.335663386 192.168.2.254 → 192.168.1.254 TCP 66 40896 → 80 [ACK] Seq=5050 Ack=29946 Win=76800 Len=0 TSval=2121252783 TSecr=4279382223
   70 1612290959.335682090 192.168.2.254 → 192.168.1.254 TCP 66 40896 → 80 [ACK] Seq=5050 Ack=30431 Win=76800 Len=0 TSval=2121252783 TSecr=4279382223
   71 1612290960.726707996 192.168.2.254 → 192.168.1.254 HTTP 627 GET / HTTP/1.1 
   72 1612290960.728026496 192.168.1.254 → 192.168.2.254 TCP 1514 HTTP/1.1 200 OK  [TCP segment of a reassembled PDU]
   73 1612290960.728040811 192.168.1.254 → 192.168.2.254 TCP 1514 80 → 40896 [ACK] Seq=31879 Ack=5611 Win=64128 Len=1448 TSval=4279383616 TSecr=2121254174 [TCP segment of a reassembled PDU]
   74 1612290960.728045292 192.168.1.254 → 192.168.2.254 HTTP 551 HTTP/1.1 200 OK  (text/html)
   75 1612290960.728998663 192.168.2.254 → 192.168.1.254 TCP 66 40896 → 80 [ACK] Seq=5611 Ack=31879 Win=76800 Len=0 TSval=2121254177 TSecr=4279383616
   76 1612290960.729240718 192.168.2.254 → 192.168.1.254 TCP 66 40896 → 80 [ACK] Seq=5611 Ack=33327 Win=76800 Len=0 TSval=2121254177 TSecr=4279383616
   77 1612290960.729280052 192.168.2.254 → 192.168.1.254 TCP 66 40896 → 80 [ACK] Seq=5611 Ack=33812 Win=76800 Len=0 TSval=2121254177 TSecr=4279383616
   78 1612290962.001465699 192.168.2.254 → 192.168.1.254 HTTP 627 GET / HTTP/1.1 
   79 1612290962.002817125 192.168.1.254 → 192.168.2.254 TCP 1514 HTTP/1.1 200 OK  [TCP segment of a reassembled PDU]
   80 1612290962.002834292 192.168.1.254 → 192.168.2.254 TCP 1514 80 → 40896 [ACK] Seq=35260 Ack=6172 Win=64128 Len=1448 TSval=4279384891 TSecr=2121255449 [TCP segment of a reassembled PDU]
   81 1612290962.002838662 192.168.1.254 → 192.168.2.254 HTTP 551 HTTP/1.1 200 OK  (text/html)
   82 1612290962.004533162 192.168.2.254 → 192.168.1.254 TCP 66 40896 → 80 [ACK] Seq=6172 Ack=35260 Win=76800 Len=0 TSval=2121255452 TSecr=4279384891
   83 1612290962.004578940 192.168.2.254 → 192.168.1.254 TCP 66 40896 → 80 [ACK] Seq=6172 Ack=36708 Win=76800 Len=0 TSval=2121255452 TSecr=4279384891
   84 1612290962.004579032 192.168.2.254 → 192.168.1.254 TCP 66 40896 → 80 [ACK] Seq=6172 Ack=37193 Win=76800 Len=0 TSval=2121255452 TSecr=4279384891
   85 1612290964.986935123 192.168.2.254 → 192.168.1.254 HTTP 627 GET / HTTP/1.1 
   86 1612290964.988233327 192.168.1.254 → 192.168.2.254 TCP 1514 HTTP/1.1 200 OK  [TCP segment of a reassembled PDU]
   87 1612290964.988247586 192.168.1.254 → 192.168.2.254 TCP 1514 80 → 40896 [ACK] Seq=38641 Ack=6733 Win=64128 Len=1448 TSval=4279387877 TSecr=2121258434 [TCP segment of a reassembled PDU]
   88 1612290964.988252271 192.168.1.254 → 192.168.2.254 HTTP 551 HTTP/1.1 200 OK  (text/html)
   89 1612290964.989690586 192.168.2.254 → 192.168.1.254 TCP 66 40896 → 80 [ACK] Seq=6733 Ack=38641 Win=76800 Len=0 TSval=2121258437 TSecr=4279387877
   90 1612290964.989741531 192.168.2.254 → 192.168.1.254 TCP 66 40896 → 80 [ACK] Seq=6733 Ack=40089 Win=76800 Len=0 TSval=2121258437 TSecr=4279387877
   91 1612290964.989741623 192.168.2.254 → 192.168.1.254 TCP 66 40896 → 80 [ACK] Seq=6733 Ack=40574 Win=76800 Len=0 TSval=2121258437 TSecr=4279387877
   92 1612290966.515937937 192.168.2.254 → 192.168.1.254 HTTP 627 GET / HTTP/1.1 
   93 1612290966.517317752 192.168.1.254 → 192.168.2.254 TCP 1514 HTTP/1.1 200 OK  [TCP segment of a reassembled PDU]
   94 1612290966.517333493 192.168.1.254 → 192.168.2.254 TCP 1514 80 → 40896 [ACK] Seq=42022 Ack=7294 Win=64128 Len=1448 TSval=4279389406 TSecr=2121259963 [TCP segment of a reassembled PDU]
   95 1612290966.517337752 192.168.1.254 → 192.168.2.254 HTTP 551 HTTP/1.1 200 OK  (text/html)
   96 1612290966.518596622 192.168.2.254 → 192.168.1.254 TCP 66 40896 → 80 [ACK] Seq=7294 Ack=42022 Win=76800 Len=0 TSval=2121259966 TSecr=4279389406
   97 1612290966.518642419 192.168.2.254 → 192.168.1.254 TCP 66 40896 → 80 [ACK] Seq=7294 Ack=43470 Win=76800 Len=0 TSval=2121259966 TSecr=4279389406
   98 1612290966.518642493 192.168.2.254 → 192.168.1.254 TCP 66 40896 → 80 [ACK] Seq=7294 Ack=43955 Win=76800 Len=0 TSval=2121259966 TSecr=4279389406
   99 1612290968.078087158 192.168.2.254 → 192.168.1.254 HTTP 627 GET / HTTP/1.1 
  100 1612290968.079339047 192.168.1.254 → 192.168.2.254 TCP 1514 HTTP/1.1 200 OK  [TCP segment of a reassembled PDU]
