    1 1612290800.963399925 192.168.2.254 → 192.168.1.254 TCP 66 40830 → 80 [FIN, ACK] Seq=1 Ack=1 Win=501 Len=0 TSval=2121094410 TSecr=4279203420
    2 1612290800.963454647 192.168.1.254 → 192.168.2.254 TCP 66 80 → 40830 [ACK] Seq=1 Ack=2 Win=506 Len=0 TSval=4279223852 TSecr=2121094410
    3 1612290800.964966499 192.168.2.254 → 192.168.1.254 TCP 74 40852 → 80 [SYN] Seq=0 Win=64240 Len=0 MSS=1460 SACK_PERM=1 TSval=2121094412 TSecr=0 WS=128
    4 1612290800.965002980 192.168.1.254 → 192.168.2.254 TCP 74 80 → 40852 [SYN, ACK] Seq=0 Ack=1 Win=65160 Len=0 MSS=1460 SACK_PERM=1 TSval=4279223853 TSecr=2121094412 WS=128
    5 1612290800.965711943 192.168.2.254 → 192.168.1.254 TCP 66 40852 → 80 [ACK] Seq=1 Ack=1 Win=64256 Len=0 TSval=2121094413 TSecr=4279223853
    6 1612290800.968574999 192.168.2.254 → 192.168.1.254 HTTP 540 GET /1.php HTTP/1.1 
    7 1612290800.968625443 192.168.1.254 → 192.168.2.254 TCP 66 80 → 40852 [ACK] Seq=1 Ack=475 Win=64768 Len=0 TSval=4279223857 TSecr=2121094416
    8 1612290800.971519832 192.168.1.254 → 192.168.2.254 TCP 1514 HTTP/1.1 200 OK  [TCP segment of a reassembled PDU]
    9 1612290800.971534851 192.168.1.254 → 192.168.2.254 TCP 1514 80 → 40852 [ACK] Seq=1449 Ack=475 Win=64768 Len=1448 TSval=4279223860 TSecr=2121094416 [TCP segment of a reassembled PDU]
   10 1612290800.971539147 192.168.1.254 → 192.168.2.254 TCP 1514 80 → 40852 [ACK] Seq=2897 Ack=475 Win=64768 Len=1448 TSval=4279223860 TSecr=2121094416 [TCP segment of a reassembled PDU]
   11 1612290800.971543165 192.168.1.254 → 192.168.2.254 TCP 1514 80 → 40852 [ACK] Seq=4345 Ack=475 Win=64768 Len=1448 TSval=4279223860 TSecr=2121094416 [TCP segment of a reassembled PDU]
   12 1612290800.971546925 192.168.1.254 → 192.168.2.254 HTTP 1027 HTTP/1.1 200 OK  (text/html)
   13 1612290800.973090647 192.168.2.254 → 192.168.1.254 TCP 66 40852 → 80 [ACK] Seq=475 Ack=1449 Win=64128 Len=0 TSval=2121094420 TSecr=4279223860
   14 1612290800.973126462 192.168.2.254 → 192.168.1.254 TCP 66 40852 → 80 [ACK] Seq=475 Ack=2897 Win=64128 Len=0 TSval=2121094420 TSecr=4279223860
   15 1612290800.973144277 192.168.2.254 → 192.168.1.254 TCP 66 40852 → 80 [ACK] Seq=475 Ack=4345 Win=64128 Len=0 TSval=2121094420 TSecr=4279223860
   16 1612290800.973428091 192.168.2.254 → 192.168.1.254 TCP 66 40852 → 80 [ACK] Seq=475 Ack=5793 Win=64128 Len=0 TSval=2121094421 TSecr=4279223860
   17 1612290800.973468684 192.168.2.254 → 192.168.1.254 TCP 66 40852 → 80 [ACK] Seq=475 Ack=6754 Win=64128 Len=0 TSval=2121094421 TSecr=4279223860
   18 1612290803.887654775 192.168.2.254 → 192.168.1.254 HTTP 540 GET /1.php HTTP/1.1 
   19 1612290803.887704071 192.168.1.254 → 192.168.2.254 TCP 66 80 → 40852 [ACK] Seq=6754 Ack=949 Win=64384 Len=0 TSval=4279226776 TSecr=2121097335
   20 1612290803.890334941 192.168.1.254 → 192.168.2.254 TCP 1514 HTTP/1.1 200 OK  [TCP segment of a reassembled PDU]
   21 1612290803.890349330 192.168.1.254 → 192.168.2.254 TCP 1514 80 → 40852 [ACK] Seq=8202 Ack=949 Win=64384 Len=1448 TSval=4279226779 TSecr=2121097335 [TCP segment of a reassembled PDU]
   22 1612290803.890353756 192.168.1.254 → 192.168.2.254 TCP 1514 80 → 40852 [ACK] Seq=9650 Ack=949 Win=64384 Len=1448 TSval=4279226779 TSecr=2121097335 [TCP segment of a reassembled PDU]
   23 1612290803.890358071 192.168.1.254 → 192.168.2.254 TCP 1514 80 → 40852 [ACK] Seq=11098 Ack=949 Win=64384 Len=1448 TSval=4279226779 TSecr=2121097335 [TCP segment of a reassembled PDU]
   24 1612290803.890361830 192.168.1.254 → 192.168.2.254 HTTP 1060 HTTP/1.1 200 OK  (text/html)
   25 1612290803.891684016 192.168.2.254 → 192.168.1.254 TCP 66 40852 → 80 [ACK] Seq=949 Ack=8202 Win=64128 Len=0 TSval=2121097339 TSecr=4279226779
   26 1612290803.891716886 192.168.2.254 → 192.168.1.254 TCP 66 40852 → 80 [ACK] Seq=949 Ack=9650 Win=64128 Len=0 TSval=2121097339 TSecr=4279226779
   27 1612290803.891737182 192.168.2.254 → 192.168.1.254 TCP 66 40852 → 80 [ACK] Seq=949 Ack=11098 Win=64128 Len=0 TSval=2121097339 TSecr=4279226779
   28 1612290803.891868053 192.168.2.254 → 192.168.1.254 TCP 66 40852 → 80 [ACK] Seq=949 Ack=12546 Win=64128 Len=0 TSval=2121097339 TSecr=4279226779
   29 1612290803.891901479 192.168.2.254 → 192.168.1.254 TCP 66 40852 → 80 [ACK] Seq=949 Ack=13540 Win=64128 Len=0 TSval=2121097339 TSecr=4279226779
   30 1612290806.056092459 192.168.2.254 → 192.168.1.254 HTTP 540 GET /1.php HTTP/1.1 
   31 1612290806.056145051 192.168.1.254 → 192.168.2.254 TCP 66 80 → 40852 [ACK] Seq=13540 Ack=1423 Win=64128 Len=0 TSval=4279228945 TSecr=2121099503
   32 1612290806.058897033 192.168.1.254 → 192.168.2.254 TCP 1514 HTTP/1.1 200 OK  [TCP segment of a reassembled PDU]
   33 1612290806.058910255 192.168.1.254 → 192.168.2.254 TCP 1514 80 → 40852 [ACK] Seq=14988 Ack=1423 Win=64128 Len=1448 TSval=4279228947 TSecr=2121099503 [TCP segment of a reassembled PDU]
   34 1612290806.058914940 192.168.1.254 → 192.168.2.254 TCP 1514 80 → 40852 [ACK] Seq=16436 Ack=1423 Win=64128 Len=1448 TSval=4279228947 TSecr=2121099503 [TCP segment of a reassembled PDU]
   35 1612290806.058918922 192.168.1.254 → 192.168.2.254 TCP 1514 80 → 40852 [ACK] Seq=17884 Ack=1423 Win=64128 Len=1448 TSval=4279228947 TSecr=2121099503 [TCP segment of a reassembled PDU]
   36 1612290806.058922829 192.168.1.254 → 192.168.2.254 HTTP 1039 HTTP/1.1 200 OK  (text/html)
   37 1612290806.060314885 192.168.2.254 → 192.168.1.254 TCP 66 40852 → 80 [ACK] Seq=1423 Ack=14988 Win=64128 Len=0 TSval=2121099507 TSecr=4279228947
   38 1612290806.060350959 192.168.2.254 → 192.168.1.254 TCP 66 40852 → 80 [ACK] Seq=1423 Ack=16436 Win=64128 Len=0 TSval=2121099508 TSecr=4279228947
   39 1612290806.060368292 192.168.2.254 → 192.168.1.254 TCP 66 40852 → 80 [ACK] Seq=1423 Ack=17884 Win=64128 Len=0 TSval=2121099508 TSecr=4279228947
   40 1612290806.060531718 192.168.2.254 → 192.168.1.254 TCP 66 40852 → 80 [ACK] Seq=1423 Ack=19332 Win=64128 Len=0 TSval=2121099508 TSecr=4279228947
   41 1612290806.060562718 192.168.2.254 → 192.168.1.254 TCP 66 40852 → 80 [ACK] Seq=1423 Ack=20305 Win=64128 Len=0 TSval=2121099508 TSecr=4279228947
   42 1612290811.064150400 192.168.1.254 → 192.168.2.254 TCP 66 80 → 40852 [FIN, ACK] Seq=20305 Ack=1423 Win=64128 Len=0 TSval=4279233953 TSecr=2121099508
   43 1612290811.111218752 192.168.2.254 → 192.168.1.254 TCP 66 40852 → 80 [ACK] Seq=1423 Ack=20306 Win=64128 Len=0 TSval=2121104559 TSecr=4279233953
   44 1612290811.957909937 192.168.2.254 → 192.168.1.254 TCP 66 40852 → 80 [FIN, ACK] Seq=1423 Ack=20306 Win=64128 Len=0 TSval=2121105405 TSecr=4279233953
   45 1612290811.957956307 192.168.1.254 → 192.168.2.254 TCP 66 80 → 40852 [ACK] Seq=20306 Ack=1424 Win=64128 Len=0 TSval=4279234846 TSecr=2121105405
   46 1612290811.958345696 192.168.2.254 → 192.168.1.254 TCP 74 40854 → 80 [SYN] Seq=0 Win=64240 Len=0 MSS=1460 SACK_PERM=1 TSval=2121105406 TSecr=0 WS=128
   47 1612290811.958386437 192.168.1.254 → 192.168.2.254 TCP 74 80 → 40854 [SYN, ACK] Seq=0 Ack=1 Win=65160 Len=0 MSS=1460 SACK_PERM=1 TSval=4279234847 TSecr=2121105406 WS=128
   48 1612290811.958879900 192.168.2.254 → 192.168.1.254 TCP 66 40854 → 80 [ACK] Seq=1 Ack=1 Win=64256 Len=0 TSval=2121105406 TSecr=4279234847
   49 1612290811.959771770 192.168.2.254 → 192.168.1.254 HTTP 540 GET /1.php HTTP/1.1 
   50 1612290811.959816677 192.168.1.254 → 192.168.2.254 TCP 66 80 → 40854 [ACK] Seq=1 Ack=475 Win=64768 Len=0 TSval=4279234848 TSecr=2121105407
   51 1612290811.962655511 192.168.1.254 → 192.168.2.254 TCP 1514 HTTP/1.1 200 OK  [TCP segment of a reassembled PDU]
   52 1612290811.962670974 192.168.1.254 → 192.168.2.254 TCP 1514 80 → 40854 [ACK] Seq=1449 Ack=475 Win=64768 Len=1448 TSval=4279234851 TSecr=2121105407 [TCP segment of a reassembled PDU]
   53 1612290811.962675122 192.168.1.254 → 192.168.2.254 TCP 1514 80 → 40854 [ACK] Seq=2897 Ack=475 Win=64768 Len=1448 TSval=4279234851 TSecr=2121105407 [TCP segment of a reassembled PDU]
   54 1612290811.962679103 192.168.1.254 → 192.168.2.254 TCP 1514 80 → 40854 [ACK] Seq=4345 Ack=475 Win=64768 Len=1448 TSval=4279234851 TSecr=2121105407 [TCP segment of a reassembled PDU]
   55 1612290811.962683103 192.168.1.254 → 192.168.2.254 HTTP 1027 HTTP/1.1 200 OK  (text/html)
   56 1612290811.963927159 192.168.2.254 → 192.168.1.254 TCP 66 40854 → 80 [ACK] Seq=475 Ack=1449 Win=64128 Len=0 TSval=2121105411 TSecr=4279234851
   57 1612290811.963960955 192.168.2.254 → 192.168.1.254 TCP 66 40854 → 80 [ACK] Seq=475 Ack=2897 Win=64128 Len=0 TSval=2121105411 TSecr=4279234851
   58 1612290811.964006881 192.168.2.254 → 192.168.1.254 TCP 66 40854 → 80 [ACK] Seq=475 Ack=4345 Win=62720 Len=0 TSval=2121105411 TSecr=4279234851
   59 1612290811.964063881 192.168.2.254 → 192.168.1.254 TCP 66 40854 → 80 [ACK] Seq=475 Ack=6754 Win=60416 Len=0 TSval=2121105411 TSecr=4279234851
   60 1612290813.754089028 192.168.2.254 → 192.168.1.254 HTTP 540 GET /1.php HTTP/1.1 
   61 1612290813.754146843 192.168.1.254 → 192.168.2.254 TCP 66 80 → 40854 [ACK] Seq=6754 Ack=949 Win=64384 Len=0 TSval=4279236643 TSecr=2121107201
   62 1612290813.757130232 192.168.1.254 → 192.168.2.254 TCP 1514 HTTP/1.1 200 OK  [TCP segment of a reassembled PDU]
   63 1612290813.757152343 192.168.1.254 → 192.168.2.254 TCP 1514 80 → 40854 [ACK] Seq=8202 Ack=949 Win=64384 Len=1448 TSval=4279236646 TSecr=2121107201 [TCP segment of a reassembled PDU]
   64 1612290813.757156602 192.168.1.254 → 192.168.2.254 TCP 1514 80 → 40854 [ACK] Seq=9650 Ack=949 Win=64384 Len=1448 TSval=4279236646 TSecr=2121107201 [TCP segment of a reassembled PDU]
   65 1612290813.757160621 192.168.1.254 → 192.168.2.254 TCP 1514 80 → 40854 [ACK] Seq=11098 Ack=949 Win=64384 Len=1448 TSval=4279236646 TSecr=2121107201 [TCP segment of a reassembled PDU]
   66 1612290813.757164602 192.168.1.254 → 192.168.2.254 HTTP 1037 HTTP/1.1 200 OK  (text/html)
   67 1612290813.758309325 192.168.2.254 → 192.168.1.254 TCP 66 40854 → 80 [ACK] Seq=949 Ack=8202 Win=64128 Len=0 TSval=2121107205 TSecr=4279236646
   68 1612290813.758353380 192.168.2.254 → 192.168.1.254 TCP 66 40854 → 80 [ACK] Seq=949 Ack=9650 Win=64128 Len=0 TSval=2121107206 TSecr=4279236646
   69 1612290813.758597899 192.168.2.254 → 192.168.1.254 TCP 66 40854 → 80 [ACK] Seq=949 Ack=11098 Win=64128 Len=0 TSval=2121107206 TSecr=4279236646
   70 1612290813.758631936 192.168.2.254 → 192.168.1.254 TCP 66 40854 → 80 [ACK] Seq=949 Ack=12546 Win=64128 Len=0 TSval=2121107206 TSecr=4279236646
   71 1612290813.758651880 192.168.2.254 → 192.168.1.254 TCP 66 40854 → 80 [ACK] Seq=949 Ack=13517 Win=64128 Len=0 TSval=2121107206 TSecr=4279236646
   72 1612290816.665853712 192.168.2.254 → 192.168.1.254 HTTP 540 GET /1.php HTTP/1.1 
   73 1612290816.665908489 192.168.1.254 → 192.168.2.254 TCP 66 80 → 40854 [ACK] Seq=13517 Ack=1423 Win=64128 Len=0 TSval=4279239554 TSecr=2121110113
   74 1612290816.668826878 192.168.1.254 → 192.168.2.254 TCP 1514 HTTP/1.1 200 OK  [TCP segment of a reassembled PDU]
   75 1612290816.668842175 192.168.1.254 → 192.168.2.254 TCP 1514 80 → 40854 [ACK] Seq=14965 Ack=1423 Win=64128 Len=1448 TSval=4279239557 TSecr=2121110113 [TCP segment of a reassembled PDU]
   76 1612290816.668846804 192.168.1.254 → 192.168.2.254 TCP 1514 80 → 40854 [ACK] Seq=16413 Ack=1423 Win=64128 Len=1448 TSval=4279239557 TSecr=2121110113 [TCP segment of a reassembled PDU]
   77 1612290816.668851212 192.168.1.254 → 192.168.2.254 TCP 1514 80 → 40854 [ACK] Seq=17861 Ack=1423 Win=64128 Len=1448 TSval=4279239557 TSecr=2121110113 [TCP segment of a reassembled PDU]
   78 1612290816.668855119 192.168.1.254 → 192.168.2.254 HTTP 1054 HTTP/1.1 200 OK  (text/html)
   79 1612290816.670573638 192.168.2.254 → 192.168.1.254 TCP 66 40854 → 80 [ACK] Seq=1423 Ack=14965 Win=64128 Len=0 TSval=2121110118 TSecr=4279239557
   80 1612290816.670617156 192.168.2.254 → 192.168.1.254 TCP 66 40854 → 80 [ACK] Seq=1423 Ack=16413 Win=64128 Len=0 TSval=2121110118 TSecr=4279239557
   81 1612290816.670617249 192.168.2.254 → 192.168.1.254 TCP 66 40854 → 80 [ACK] Seq=1423 Ack=17861 Win=64128 Len=0 TSval=2121110118 TSecr=4279239557
   82 1612290816.670946526 192.168.2.254 → 192.168.1.254 TCP 66 40854 → 80 [ACK] Seq=1423 Ack=19309 Win=64128 Len=0 TSval=2121110118 TSecr=4279239557
   83 1612290816.670978249 192.168.2.254 → 192.168.1.254 TCP 66 40854 → 80 [ACK] Seq=1423 Ack=20297 Win=64128 Len=0 TSval=2121110118 TSecr=4279239557
   84 1612290819.699834969 192.168.2.254 → 192.168.1.254 HTTP 540 GET /1.php HTTP/1.1 
   85 1612290819.699892599 192.168.1.254 → 192.168.2.254 TCP 66 80 → 40854 [ACK] Seq=20297 Ack=1897 Win=64128 Len=0 TSval=4279242588 TSecr=2121113147
   86 1612290819.702758877 192.168.1.254 → 192.168.2.254 TCP 1514 HTTP/1.1 200 OK  [TCP segment of a reassembled PDU]
   87 1612290819.702774339 192.168.1.254 → 192.168.2.254 TCP 1514 80 → 40854 [ACK] Seq=21745 Ack=1897 Win=64128 Len=1448 TSval=4279242591 TSecr=2121113147 [TCP segment of a reassembled PDU]
   88 1612290819.702778895 192.168.1.254 → 192.168.2.254 TCP 1514 80 → 40854 [ACK] Seq=23193 Ack=1897 Win=64128 Len=1448 TSval=4279242591 TSecr=2121113147 [TCP segment of a reassembled PDU]
   89 1612290819.702783006 192.168.1.254 → 192.168.2.254 TCP 1514 80 → 40854 [ACK] Seq=24641 Ack=1897 Win=64128 Len=1448 TSval=4279242591 TSecr=2121113147 [TCP segment of a reassembled PDU]
   90 1612290819.702786877 192.168.1.254 → 192.168.2.254 HTTP 1043 HTTP/1.1 200 OK  (text/html)
   91 1612290819.703988117 192.168.2.254 → 192.168.1.254 TCP 66 40854 → 80 [ACK] Seq=1897 Ack=21745 Win=64128 Len=0 TSval=2121113151 TSecr=4279242591
   92 1612290819.704023395 192.168.2.254 → 192.168.1.254 TCP 66 40854 → 80 [ACK] Seq=1897 Ack=23193 Win=64128 Len=0 TSval=2121113151 TSecr=4279242591
   93 1612290819.704259043 192.168.2.254 → 192.168.1.254 TCP 66 40854 → 80 [ACK] Seq=1897 Ack=24641 Win=64128 Len=0 TSval=2121113152 TSecr=4279242591
   94 1612290819.704287895 192.168.2.254 → 192.168.1.254 TCP 66 40854 → 80 [ACK] Seq=1897 Ack=26089 Win=64128 Len=0 TSval=2121113152 TSecr=4279242591
   95 1612290819.704312080 192.168.2.254 → 192.168.1.254 TCP 66 40854 → 80 [ACK] Seq=1897 Ack=27066 Win=64128 Len=0 TSval=2121113152 TSecr=4279242591
   96 1612290822.510115042 192.168.2.254 → 192.168.1.254 HTTP 540 GET /1.php HTTP/1.1 
   97 1612290822.513046134 192.168.1.254 → 192.168.2.254 TCP 1514 HTTP/1.1 200 OK  [TCP segment of a reassembled PDU]
   98 1612290822.513072560 192.168.1.254 → 192.168.2.254 TCP 1514 80 → 40854 [ACK] Seq=28514 Ack=2371 Win=64128 Len=1448 TSval=4279245401 TSecr=2121115957 [TCP segment of a reassembled PDU]
   99 1612290822.513077393 192.168.1.254 → 192.168.2.254 TCP 1514 80 → 40854 [ACK] Seq=29962 Ack=2371 Win=64128 Len=1448 TSval=4279245401 TSecr=2121115957 [TCP segment of a reassembled PDU]
  100 1612290822.513081912 192.168.1.254 → 192.168.2.254 TCP 1514 80 → 40854 [ACK] Seq=31410 Ack=2371 Win=64128 Len=1448 TSval=4279245401 TSecr=2121115957 [TCP segment of a reassembled PDU]
